dominio,tipoProjeto,siglaTipoProjeto,numero,ano,autor,ementa,situacao,siglaSituacao,situacaoGeral,siglaSituacaoGeral,dataPublicacao,numeroDoc,proposicao,regime,norma,atualizacao,usuario,dataUltimaAcao,listaHistoricoTramitacoes,links,linksProposicoesAnexadas,acompanhamento,matricula,local,arquivamento,horario,indexacao,assuntoGeral,autoresEstruturados,tema,linksOrigem,legislacaoCitada,linkLegislacao.url,linkLegislacao.rotulo,proposicaoLei.descricao
Remissivo,PROJETO DE LEI,PL,204,1971,GOVERNADOR DO ESTADO,"AUTORIZA O PODER EXECUTIVO A TRANSFERIR ÀS CENTRAIS ELÉTRICAS DE
MG - CEMIG - TERRENO DE PROPRIEDADE DO ESTADO EM CAXAMBU.",TRANSFORMADO EM NORMA JURÍDICA,TNJUR,PROPOSIÇÕES APROVADAS,MAPRV,1971-08-10,000149352,PL. 204 1971 - PROJETO DE LEI,DELIBERAÇÃO DE PLENÁRIO,LEI 5773 1971 - LEI ORDINÁRIA,19980101,Carga,1971-08-06,"list(passo = 1, data = ""1971-08-06"", local = ""PLENÁRIO"", historico = ""HISTÓRICO DA TRAMITAÇÃO\nPLENÁRIO:\nDISCUSSÃO ÚNICA\nAPROVAÇÃO: 30 8 1971\nREDAÇÃO FINAL\nAPROVAÇÃO: 3 9 1971\nCOMISSÕES:\nJUSTIÇA, TRANSPORTES E FINANÇAS (REUNIÃO CONJUNTA)\nDISCUSSÃO ÚNICA\nRELATOR: DEP. FERNANDO JUNQUEIRA\nPUBLICAÇÃO: 26 8 1971\nREDAÇÃO\nREDAÇÃO FINAL\nRELATOR: DEP. GOMES MOREIRA\nPUBLICAÇÃO: 3 9 1971\nSANCIONADO\nPUBLICAÇÃO DA LEI: 28 9 1971."")",list(),list(),N,NA,NA,NA,NA,NA,NA,NULL,NA,"list(descricao = ""MSG 47 1971"")",NA,/legislacao/mineira/LEI/5773/1971,LEI 5773 1971 - LEI ORDINÁRIA,NA
Remissivo,PROJETO DE LEI,PL,203,1971,DEPUTADO TARCISIO DELGADO                  MDB,"DECLARA DE UTILIDADE PÚBLICA O INSTITUTO DE PSICOLOGIA CLÍNICA,
COM SEDE EM JUIZ DE FORA.",TRANSFORMADO EM NORMA JURÍDICA,TNJUR,PROPOSIÇÕES APROVADAS,MAPRV,1971-08-07,000149353,PL. 203 1971 - PROJETO DE LEI,DELIBERAÇÃO DE PLENÁRIO,LEI 5769 1971 - LEI ORDINÁRIA,20120229,rosanacf,1971-08-05,"list(passo = 1, data = ""1971-08-05"", local = ""PLENÁRIO"", historico = ""HISTÓRICO DA TRAMITAÇÃO\nPLENÁRIO:\nDISCUSSÃO ÚNICA\nAPROVAÇÃO: 30 8 1971\nREDAÇÃO FINAL\nAPROVAÇÃO: 3 9 1971\nCOMISSÕES:\nJUSTIÇA\nDISCUSSÃO ÚNICA\nRELATOR: DEP. RUY DA COSTA VAL\nPUBLICAÇÃO: 21 8 1971\nREDAÇÃO\nREDAÇÃO FINAL\nRELATOR: DEP. GOMES MOREIRA\nPUBLICAÇÃO: 3 9 1971\nSANCIONADO\nPUBLICAÇÃO DA LEI: 22 9 1971."")",list(),list(),N,1474,NA,NA,1222,"UTILIDADE PÚBLICA, ENTIDADE, MUNICÍPIO, JUIZ DE FORA.",UTILIDADE PÚBLICA,"list(id = 1474, nome = ""DEPUTADO TARCISIO DELGADO"", partido = ""MDB"")",NA,NULL,NA,/legislacao/mineira/LEI/5769/1971,LEI 5769 1971 - LEI ORDINÁRIA,NA
Remissivo,PROJETO DE LEI,PL,202,1971,DEPUTADO VALDIR MELGAÇO                    ARENA,"DECLARA DE UTILIDADE PÚBLICA A INSTITUIÇÃO BENEFICENTE JESUS DE
NAZARETH, DE PATROCÍNIO.",TRANSFORMADO EM NORMA JURÍDICA,TNJUR,PROPOSIÇÕES APROVADAS,MAPRV,1971-08-07,000149354,PL. 202 1971 - PROJETO DE LEI,DELIBERAÇÃO DE PLENÁRIO,LEI 5771 1971 - LEI ORDINÁRIA,20120229,rosanacf,1971-08-05,"list(passo = 1, data = ""1971-08-05"", local = ""PLENÁRIO"", historico = ""HISTÓRICO DA TRAMITAÇÃO\nPLENÁRIO:\nDISCUSSÃO ÚNICA\nAPROVAÇÃO: 30 8 1971\nREDAÇÃO FINAL\nAPROVAÇÃO: 3 9 1971\nCOMISSÕES:\nJUSTIÇA\nDISCUSSÃO ÚNICA\nRELATOR: DEP. RUY DA COSTA VAL\nPUBLICAÇÃO: 21 8 1971\nREDAÇÃO\nREDAÇÃO FINAL\nRELATOR: DEP. GOMES MOREIRA\nPUBLICAÇÃO: 3 9 1971\nSANCIONADO\nPUBLICAÇÃO DA LEI: 22 9 1971."")",list(),list(),N,720,NA,NA,1218,"UTILIDADE PÚBLICA, ENTIDADE, MUNICÍPIO, PATROCÍNIO.",UTILIDADE PÚBLICA,"list(id = 720, nome = ""DEPUTADO VALDIR MELGAÇO"", partido = ""ARENA"")",NA,NULL,NA,/legislacao/mineira/LEI/5771/1971,LEI 5771 1971 - LEI ORDINÁRIA,NA
Remissivo,PROJETO DE LEI,PL,201,1971,DEPUTADO FERNANDO JUNQUEIRA                PDS,"DECLARA DE UTILIDADE PÚBLICA O MOVIMENTO DE ASSISTÊNCIA SOCIAL - MAS -,
COM SEDE EM LEOPOLDINA.",TRANSFORMADO EM NORMA JURÍDICA,TNJUR,PROPOSIÇÕES APROVADAS,MAPRV,1971-08-06,000149356,PL. 201 1971 - PROJETO DE LEI,DELIBERAÇÃO DE PLENÁRIO,LEI 5770 1971 - LEI ORDINÁRIA,20120229,rosanacf,1971-08-04,"list(passo = 1, data = ""1971-08-04"", local = ""PLENÁRIO"", historico = ""HISTÓRICO DA TRAMITAÇÃO\nPLENÁRIO:\nDISCUSSÃO ÚNICA\nAPROVAÇÃO: 24 8 1971\nREDAÇÃO FINAL\nAPROVAÇÃO: 30 8 1971\nCOMISSÕES:\nJUSTIÇA\nDISCUSSÃO ÚNICA\nRELATOR: DEP. JOÃO NAVARRO\nPUBLICAÇÃO: 14 8 1971\nREDAÇÃO\nREDAÇÃO FINAL\nRELATOR: DEP. VALDIR MELGAÇO\nPUBLICAÇÃO: 28 8 1971\nSANCIONADO\nPUBLICAÇÃO DA LEI: 22 9 1971"")",list(),list(),N,1468,NA,NA,1214,"UTILIDADE PÚBLICA, ENTIDADE, MUNICÍPIO, LEOPOLDINA.",UTILIDADE PÚBLICA,"list(id = 1468, nome = ""DEPUTADO FERNANDO JUNQUEIRA"", partido = ""PDS"")",NA,NULL,NA,/legislacao/mineira/LEI/5770/1971,LEI 5770 1971 - LEI ORDINÁRIA,NA
Remissivo,PROJETO DE LEI,PL,200,1971,DEPUTADO FERNANDO JUNQUEIRA                PDS,"DECLARA DE UTILIDADE PÚBLICA A ASSOCIAÇÃO BRASILEIRA DE ODONTOLOGIA,
SUBSEÇÃO DE JUIZ DE FORA.",TRANSFORMADO EM NORMA JURÍDICA,TNJUR,PROPOSIÇÕES APROVADAS,MAPRV,1971-08-06,000149357,PL. 200 1971 - PROJETO DE LEI,DELIBERAÇÃO DE PLENÁRIO,LEI 5768 1971 - LEI ORDINÁRIA,20120229,rosanacf,1971-08-04,"list(passo = 1, data = ""1971-08-04"", local = ""PLENÁRIO"", historico = ""HISTÓRICO DA TRAMITAÇÃO\nPLENÁRIO:\nDISCUSSÃO ÚNICA\nAPROVAÇÃO: 23 8 1971\nREDAÇÃO FINAL\nAPROVAÇÃO: 30 8 1971\nCOMISSÕES:\nJUSTIÇA\nDISCUSSÃO ÚNICA\nRELATOR: DEP. NARCÉLIO MENDES\nPUBLICAÇÃO: 14 8 1971\nREDAÇÃO\nREDAÇÃO FINAL\nRELATOR: DEP. VALDIR MELGAÇO\nPUBLICAÇÃO: 28 8 1971\nSANCIONADO\nPUBLICAÇÃO DA LEI: 22 9 1971"")",list(),list(),N,1468,NA,NA,1207,"UTILIDADE PÚBLICA, ENTIDADE, MUNICÍPIO, JUIZ DE FORA.",UTILIDADE PÚBLICA,"list(id = 1468, nome = ""DEPUTADO FERNANDO JUNQUEIRA"", partido = ""PDS"")",NA,NULL,NA,/legislacao/mineira/LEI/5768/1971,LEI 5768 1971 - LEI ORDINÁRIA,NA
Remissivo,PROJETO DE LEI,PL,199,1971,DEPUTADO MORVAN ACAYABA                    ARENA,"DECLARA DE UTILIDADE PÚBLICA A ASSOCIAÇÃO DE PROTEÇÃO À INFÂNCIA
DE VARGINHA, COM SEDE EM VARGINHA.",TRANSFORMADO EM NORMA JURÍDICA,TNJUR,PROPOSIÇÕES APROVADAS,MAPRV,1971-08-06,000149358,PL. 199 1971 - PROJETO DE LEI,DELIBERAÇÃO DE PLENÁRIO,LEI 5782 1971 - LEI ORDINÁRIA,20120229,rosanacf,1971-08-04,"list(passo = 1, data = ""1971-08-04"", local = ""PLENÁRIO"", historico = ""HISTÓRICO DA TRAMITAÇÃO\nPLENÁRIO:\nDISCUSSÃO ÚNICA\nAPROVAÇÃO: 3 9 1971\nREDAÇÃO FINAL\nAPROVAÇÃO: 13 9 1971\nCOMISSÕES:\nJUSTIÇA\nDISCUSSÃO ÚNICA\nRELATOR: DEP. FERNANDO JUNQUEIRA\nPUBLICAÇÃO: 26 8 1971\nREDAÇÃO\nREDAÇÃO FINAL\nRELATOR: DEP. NARCÉLIO MENDES\nPUBLICAÇÃO: 11 9 1971\nSANCIONADO\nPUBLICAÇÃO DA LEI: 1 10 1971"")",list(),list(),N,1460,NA,NA,1205,"UTILIDADE PÚBLICA, ENTIDADE, MUNICÍPIO, VARGINHA.",UTILIDADE PÚBLICA,"list(id = 1460, nome = ""DEPUTADO MORVAN ACAYABA"", partido = ""ARENA"")",NA,NULL,NA,/legislacao/mineira/LEI/5782/1971,LEI 5782 1971 - LEI ORDINÁRIA,NA
Remissivo,PROJETO DE LEI,PL,198,1971,DEPUTADO VALDIR MELGAÇO                    ARENA,"PRORROGA PRAZO DE QUE TRATA O ART. 6 DA LEI 4276, DE
26 10 1966, QUE DISPÕE SOBRE DOAÇÃO DE TERRENO À FUNDAÇÃO
ESCOLA DE MEDICINA E CIRURGIA DE UBERLÂNDIA, DA CIDADE DE
UBERLÂNDIA.",TRANSFORMADO EM NORMA JURÍDICA,TNJUR,PROPOSIÇÕES APROVADAS,MAPRV,1971-08-06,000149359,PL. 198 1971 - PROJETO DE LEI,DELIBERAÇÃO DE PLENÁRIO,LEI 5812 1971 - LEI ORDINÁRIA,19980101,Carga,1971-08-04,"list(passo = 1, data = ""1971-08-04"", local = ""PLENÁRIO"", historico = ""HISTÓRICO DA TRAMITAÇÃO\nPLENÁRIO:\nPRIMEIRA DISCUSSÃO\nAPROVAÇÃO: 19 8 1971\nSEGUNDA DISCUSSÃO\nAPROVAÇÃO: 4 10 1971\nTERCEIRA DISCUSSÃO\nAPROVAÇÃO: 18 9 1971\nREDAÇÃO FINAL\nAPROVAÇÃO: 25 10 1971\nCOMISSÕES:\nJUSTIÇA\nSEGUNDA DISCUSSÃO\nRELATOR: DEP. PINHEIRO CHAGAS\nPUBLICAÇÃO: 29 9 1971\nEDUCAÇÃO\nSEGUNDA DISCUSSÃO\nRELATOR: DEP. AMILCAR PADOVANI\nPUBLICAÇÃO: 29 9 1971\nFINANÇAS\nSEGUNDA DISCUSSÃO\nRELATOR: DEP. LÚCIO DE SOUZA CRUZ\nPUBLICAÇÃO: 29 9 1971\nFINANÇAS\nTERCEIRA DISCUSSÃO\nRELATOR: DEP. LÚCIO DE SOUZA CRUZ\nPUBLICAÇÃO: 8 10 1971\nREDAÇÃO\nREDAÇÃO FINAL\nRELATOR: DEP. VALDIR MELGAÇO\nPUBLICAÇÃO: 23 10 1971\nSANCIONADO\nPUBLICAÇÃO DA LEI: 17 11 1971"")",list(),list(),N,720,NA,NA,NA,NA,NA,"list(id = 720, nome = ""DEPUTADO VALDIR MELGAÇO"", partido = ""ARENA"")",NA,NULL,NA,/legislacao/mineira/LEI/5812/1971,LEI 5812 1971 - LEI ORDINÁRIA,NA
Remissivo,PROJETO DE LEI,PL,196,1971,DEPUTADO NELSON LOMBARDI                   ARENA,"TRANSFORMA EM GRUPO ESCOLAR AS ESCOLAS REUNIDAS ""CORONEL XAVIER
CHAVES"", DO MUNICÍPIO DE CORONEL XAVIER.",ARQUIVADO,ARQVD,OUTRAS SITUAÇÕES,MOUTR,1971-08-04,000149360,PL. 196 1971 - PROJETO DE LEI,NA,NA,20100201,moreka,1971-08-02,"list(passo = 1, data = ""1971-08-02"", local = ""PLENÁRIO"", historico = ""HISTÓRICO DA TRAMITAÇÃO\nPLENÁRIO:\nPRIMEIRA DISCUSSÃO\nAPROVAÇÃO: 18 8 1971\nARQUIVADO, FINAL DE LEGISLATURA."")",list(),list(),N,1184,ARQUIVO,19750131,1209,"ALTERAÇÃO, DENOMINAÇÃO, TRANSFORMAÇÃO, ESTABELECIMENTO DE ENSINO, GRUPO
ESCOLAR, MUNICÍPIO, CORONEL XAVIER.",NA,"list(id = 1184, nome = ""DEPUTADO NELSON LOMBARDI"", partido = ""ARENA"")",NA,NULL,NA,NA,NA,NA
Remissivo,PROJETO DE LEI,PL,194,1971,DEPUTADO EDGARD DE VASCONCELOS             ARENA,"DÁ A DENOMINAÇÃO DE JOÃO FRANCISCO DA SILVA ÀS ESCOLAS REUNIDAS DE
CACHOEIRA DE SANTA CRUZ, DE VIÇOSA.",TRANSFORMADO EM NORMA JURÍDICA,TNJUR,PROPOSIÇÕES APROVADAS,MAPRV,1971-07-01,000149361,PL. 194 1971 - PROJETO DE LEI,NA,LEI 5811 1971 - LEI ORDINÁRIA,20120412,rosanacf,1971-06-29,"list(passo = 1, data = ""1971-06-29"", local = ""PLENÁRIO"", historico = ""HISTÓRICO DA TRAMITAÇÃO\nPLENÁRIO:\nPRIMEIRA DISCUSSÃO\nAPROVAÇÃO: 18 8 1971\nSEGUNDA DISCUSSÃO\nAPROVAÇÃO: 22 9 1971\nTERCEIRA DISCUSSÃO\nAPROVAÇÃO: 29 9 1971\nREDAÇÃO FINAL\nAPROVAÇÃO: 4 10 1971\nCOMISSÕES:\nJUSTIÇA\nSEGUNDA DISCUSSÃO\nRELATOR: DEP. PINHEIRO CHAGAS\nPUBLICAÇÃO: 18 9 1971\nEDUCAÇÃO\nSEGUNDA DISCUSSÃO\nRELATOR: DEP. MORVAN ACAYABA\nPUBLICAÇÃO: 18 9 1971\nEDUCAÇÃO\nTERCEIRA DISCUSSÃO\nRELATOR: DEP. PINHEIRO CHAGAS\nPUBLICAÇÃO: 28 9 1971\nREDAÇÃO\nREDAÇÃO FINAL\nRELATOR: DEP. JOÃO PEDRO GUSTIN\nPUBLICAÇÃO: 5 10 1971\nSANCIONADO\nPUBLICAÇÃO DA LEI: 1 11 1971"")",list(),list(),N,941,NA,NA,1151,"DENOMINAÇÃO, ESTABELECIMENTO DE ENSINO, MUNICÍPIO, VIÇOSA.","PRÓPRIO PÚBLICO
ESTABELECIMENTO DE ENSINO","list(id = 941, nome = ""DEPUTADO EDGARD DE VASCONCELOS"", partido = ""ARENA"")",NA,NULL,NA,/legislacao/mineira/LEI/5811/1971,LEI 5811 1971 - LEI ORDINÁRIA,NA
Remissivo,PROJETO DE LEI,PL,193,1971,DEPUTADO SAMIR TANNÚS                      ARENA,"DECLARA DE UTILIDADE PÚBLICA A CRECHE MAURO JOSÉ DOS SANTOS, COM
SEDE EM BELO HORIZONTE.",ARQUIVADO,ARQVD,OUTRAS SITUAÇÕES,MOUTR,1971-07-01,000149362,PL. 193 1971 - PROJETO DE LEI,NA,NA,20120229,rosanacf,1971-06-29,"list(passo = 1, data = ""1971-06-29"", local = ""PLENÁRIO"", historico = ""ARQUIVADO, FINAL DE LEGISLATURA."")",list(),list(),N,1463,ARQUIVO,NA,1149,"UTILIDADE PÚBLICA, ENTIDADE, MUNICÍPIO, BELO HORIZONTE.",UTILIDADE PÚBLICA,"list(id = 1463, nome = ""DEPUTADO SAMIR TANNÚS"", partido = ""ARENA"")",NA,NULL,NA,NA,NA,NA
Remissivo,PROJETO DE LEI,PL,192,1971,DEPUTADO SAMIR TANNÚS                      ARENA,"DECLARA DE UTILIDADE PÚBLICA A CONGREGAÇÃO DAS IRMÃS DOS SAGRADOS
CORAÇÕES DE JESUS E MARIA, DE CANÁPOLIS.",TRANSFORMADO EM NORMA JURÍDICA,TNJUR,PROPOSIÇÕES APROVADAS,MAPRV,1971-07-01,000149363,PL. 192 1971 - PROJETO DE LEI,DELIBERAÇÃO DE PLENÁRIO,LEI 5764 1971 - LEI ORDINÁRIA,20120229,rosanacf,1971-06-29,"list(passo = 1, data = ""1971-06-29"", local = ""PLENÁRIO"", historico = ""HISTÓRICO DA TRAMITAÇÃO\nPLENÁRIO:\nDISCUSSÃO ÚNICA\nAPROVAÇÃO: 24 8 1971\nREDAÇÃO FINAL\nAPROVAÇÃO: 30 8 1971\nCOMISSÕES:\nJUSTIÇA\nDISCUSSÃO ÚNICA\nRELATOR: DEP. TARCISIO DELGADO\nPUBLICAÇÃO: 21 8 1971\nREDAÇÃO\nREDAÇÃO FINAL\nRELATOR: DEP. VALDIR MELGAÇO\nPUBLICAÇÃO: 28 8 1971\nSANCIONADO\nPUBLICAÇÃO DA LEI: 22 9 1971"")",list(),list(),N,1463,NA,NA,1148,"UTILIDADE PÚBLICA, ENTIDADE, MUNICÍPIO, CANÁPOLIS.",UTILIDADE PÚBLICA,"list(id = 1463, nome = ""DEPUTADO SAMIR TANNÚS"", partido = ""ARENA"")",NA,NULL,NA,/legislacao/mineira/LEI/5764/1971,LEI 5764 1971 - LEI ORDINÁRIA,NA
Remissivo,PROJETO DE LEI,PL,191,1971,DEPUTADO JOÃO FERRAZ                       ARENA,"DECLARA DE UTILIDADE PÚBLICA O CENTRO ESPÍRITA AMOR E FÉ, COM
SEDE NA CIDADE DE TUPACIGUARA.",ARQUIVADO,ARQVD,OUTRAS SITUAÇÕES,MOUTR,1971-07-01,000149364,PL. 191 1971 - PROJETO DE LEI,NA,NA,20120229,rosanacf,1971-06-29,"list(passo = 1, data = ""1971-06-29"", local = ""PLENÁRIO"", historico = ""ARQUIVADO, FINAL DE LEGISLATURA."")",list(),list(),N,1171,ARQUIVO,19750131,1144,"UTILIDADE PÚBLICA, ENTIDADE, MUNICÍPIO, TUPACIGUARA.",UTILIDADE PÚBLICA,"list(id = 1171, nome = ""DEPUTADO JOÃO FERRAZ"", partido = ""ARENA"")",NA,NULL,NA,NA,NA,NA
Remissivo,PROJETO DE LEI,PL,190,1971,DEPUTADO MANOEL COSTA                      ARENA,"DECLARA DE UTILIDADE PÚBLICA A ""UNIÃO ATLÉTICA AREADENSE"", COM SEDE NA
CIDADE DE AREADO.",TRANSFORMADO EM NORMA JURÍDICA,TNJUR,PROPOSIÇÕES APROVADAS,MAPRV,1971-07-01,000149365,PL. 190 1971 - PROJETO DE LEI,NA,LEI 5763 1971 - LEI ORDINÁRIA,20120229,rosanacf,1971-06-29,"list(passo = 1, data = ""1971-06-29"", local = ""PLENÁRIO"", historico = ""HISTÓRICO DA TRAMITAÇÃO\nPLENÁRIO:\nDISCUSSÃO ÚNICA\nAPROVAÇÃO: 23 8 1971\nREDAÇÃO FINAL\nAPROVAÇÃO: 30 8 1971\nCOMISSÕES:\nJUSTIÇA\nDISCUSSÃO ÚNICA\nRELATOR: DEP. JOÃO NAVARRO\nPUBLICAÇÃO: 14 8 1971\nREDAÇÃO\nREDAÇÃO FINAL\nRELATOR: DEP. VALDIR MELGAÇO\nPUBLICAÇÃO: 28 8 1971\nSANCIONADO\nPUBLICAÇÃO DA LEI: 22 9 1971."")",list(),list(),N,326,NA,NA,1142,"UTILIDADE PÚBLICA, ENTIDADE, MUNICÍPIO, AREADO.",UTILIDADE PÚBLICA,"list(id = 326, nome = ""DEPUTADO MANOEL COSTA"", partido = ""ARENA"")",NA,NULL,NA,/legislacao/mineira/LEI/5763/1971,LEI 5763 1971 - LEI ORDINÁRIA,NA
Remissivo,PROJETO DE LEI,PL,189,1971,DEPUTADO EDGARD DE VASCONCELOS             ARENA,"TRANSFORMA EM GRUPO ESCOLAR AS ESCOLAS REUNIDAS PADRE ÁLVARO
CORREA BORGES, DA CIDADE DE VIÇOSA.",PROJETO VETADO TOTALMENTE,PVETO,PROPOSIÇÕES APROVADAS,MAPRV,1971-06-29,000149367,PL. 189 1971 - PROJETO DE LEI,DELIBERAÇÃO DE PLENÁRIO,NA,20091223,marga,1971-06-25,"list(passo = 1, data = ""1971-06-25"", local = ""PLENÁRIO"", historico = ""HISTÓRICO DA TRAMITAÇÃO\nPLENÁRIO:\nPRIMEIRA DISCUSSÃO\nAPROVAÇÃO: 13 8 1971\nSEGUNDA DISCUSSÃO\nAPROVAÇÃO: 21 10 1971\nTERCEIRA DISCUSSÃO\nAPROVAÇÃO: 17 11 1971\nREDAÇÃO FINAL\nAPROVAÇÃO: 23 11 1971\nCOMISSÕES:\nJUSTIÇA\nSEGUNDA DISCUSSÃO\nRELATOR: DEP. RUY DA COSTA VAL\nPUBLICAÇÃO: 16 10 1971\nEDUCAÇÃO\nSEGUNDA DISCUSSÃO\nRELATOR: DEP. EUCLIDES CINTRA\nPUBLICAÇÃO: 16 10 1971\nEDUCAÇÃO\nTERCEIRA DISCUSSÃO\nRELATOR: DEP. MARCOS TITO\nPUBLICAÇÃO: 29 10 1971\nREDAÇÃO\nREDAÇÃO FINAL\nRELATOR: DEP. VALDIR MELGAÇO\nPUBLICAÇÃO: 23 11 1971\nVETADO TOTALMENTE\nPUBLICAÇÃO DAS RAZÕES DO VETO: 16 12 1971\nVETO MANTIDO."")",list(),list(),N,941,NA,NA,1022,"ALTERAÇÃO, DENOMINAÇÃO, TRANSFORMAÇÃO, ESTABELECIMENTO DE ENSINO, GRUPO
ESCOLAR, MUNICÍPIO, VIÇOSA.",NA,"list(id = 941, nome = ""DEPUTADO EDGARD DE VASCONCELOS"", partido = ""ARENA"")",NA,NULL,NA,NA,NA,PRL 6385 1971
Remissivo,PROJETO DE LEI,PL,187,1971,DEPUTADO JOSÉ RAIMUNDO                     MDB,"CONCEDE O TÍTULO DE CIDADÃO HONORÁRIO DO ESTADO DE MINAS GERAIS
AO COMANDANTE JOAQUIM COSTA.",TRANSFORMADO EM NORMA JURÍDICA,TNJUR,PROPOSIÇÕES APROVADAS,MAPRV,1971-06-29,000149368,PL. 187 1971 - PROJETO DE LEI,DELIBERAÇÃO DE PLENÁRIO,LEI 5801 1971 - LEI ORDINÁRIA,20150428,m17461,1971-06-25,"list(passo = 1, data = ""1971-06-25"", local = ""PLENÁRIO"", historico = ""HISTÓRICO DA TRAMITAÇÃO\nPLENÁRIO:\nPRIMEIRA DISCUSSÃO\nAPROVAÇÃO: 12 8 1971\nSEGUNDA DISCUSSÃO\nAPROVAÇÃO: 27 9 1971\nTERCEIRA DISCUSSÃO\nAPROVAÇÃO: 4 10 1971\nREDAÇÃO FINAL\nAPROVAÇÃO: 6 10 1971\nCOMISSÕES:\nCONSELHO PERMANENTE DA MEDALHA DA INCONFIDÊNCIA\nRELATOR: CONSELHEIRO CEL. LUIZ NUNES NETO\nPARECER FAVORÁVEL\nJUSTIÇA\nSEGUNDA DISCUSSÃO\nRELATOR: DEP. NARCÉLIO MENDES\nPUBLICAÇÃO: 23 9 1971\nJUSTIÇA\nTERCEIRA DISCUSSÃO\nRELATOR: DEP. JOÃO NAVARRO\nPUBLICAÇÃO: 30 9 1971\nREDAÇÃO\nREDAÇÃO FINAL\nRELATOR: DEP. VALDIR MELGAÇO\nPUBLICAÇÃO: 8 10 1971\nSANCIONADO\nPUBLICAÇÃO DA LEI: 29 10 1971"")",list(),list(),N,647,NA,NA,1246,"CONCESSÃO HONORÍFICA, TÍTULO, CIDADÃO HONORÁRIO.",HOMENAGEM,"list(id = 647, nome = ""DEPUTADO JOSÉ RAIMUNDO"", partido = ""MDB"")",CULTURA,"list(descricao = ""PL. 1557 1970"")",NA,/legislacao/mineira/LEI/5801/1971,LEI 5801 1971 - LEI ORDINÁRIA,NA
Remissivo,PROJETO DE LEI,PL,186,1971,DEPUTADO EUCLIDES CINTRA                   ARENA,"DECLARA DE UTILIDADE PÚBLICA A ""SOCIEDADE DOM BOSCO DE EDUCAÇÃO
E CULTURA""(SODBEC), COM SEDE NA CIDADE DE DIVINÓPOLIS.",TRANSFORMADO EM NORMA JURÍDICA,TNJUR,PROPOSIÇÕES APROVADAS,MAPRV,1971-06-29,000149369,PL. 186 1971 - PROJETO DE LEI,DELIBERAÇÃO DE PLENÁRIO,LEI 5797 1971 - LEI ORDINÁRIA,20120229,rosanacf,1971-06-25,"list(passo = 1, data = ""1971-06-25"", local = ""PLENÁRIO"", historico = ""HISTÓRICO DA TRAMITAÇÃO\nPLENÁRIO:\nDISCUSSÃO ÚNICA\nAPROVAÇÃO: 1 10 1971\nREDAÇÃO FINAL\nAPROVAÇÃO: 6 10 1971\nCOMISSÕES:\nJUSTIÇA\nDISCUSSÃO ÚNICA\nRELATOR: DEP. JOÃO NAVARRO\nPUBLICAÇÃO: 30 9 1971\nREDAÇÃO\nREDAÇÃO FINAL\nRELATOR: DEP. VALDIR MELGAÇO\nPUBLICAÇÃO: 8 10 1971\nSANCIONADO\nPUBLICAÇÃO DA LEI: 15 10 1971."")",list(),list(),N,295,NA,NA,1126,"UTILIDADE PÚBLICA, ENTIDADE, MUNICÍPIO, DIVINÓPOLIS.",UTILIDADE PÚBLICA,"list(id = 295, nome = ""DEPUTADO EUCLIDES CINTRA"", partido = ""ARENA"")",NA,NULL,NA,/legislacao/mineira/LEI/5797/1971,LEI 5797 1971 - LEI ORDINÁRIA,NA
Remissivo,PROJETO DE LEI,PL,183,1971,DEPUTADO JOÃO NAVARRO                      ARENA,"DECLARA DE UTILIDADE PÚBLICA A FUNDAÇÃO GENERAL EDMUNDO DE MACEDO
SOARES E SILVA - FUGEMSS, MANTENEDORA DO COLÉGIO TÉCNICO GENERAL
EDMUNDO DE MACEDO SOARES E SILVA, COM SEDE NA CIDADE DE CONGONHAS.",TRANSFORMADO EM NORMA JURÍDICA,TNJUR,PROPOSIÇÕES APROVADAS,MAPRV,1971-06-26,000149371,PL. 183 1971 - PROJETO DE LEI,DELIBERAÇÃO DE PLENÁRIO,LEI 5765 1971 - LEI ORDINÁRIA,20120229,rosanacf,1971-06-24,"list(passo = 1, data = ""1971-06-24"", local = ""PLENÁRIO"", historico = ""HISTÓRICO DA TRAMITAÇÃO\nPLENÁRIO:\nDISCUSSÃO ÚNICA\nAPROVAÇÃO: 20 8 1971\nREDAÇÃO FINAL\nAPROVAÇÃO: 30 8 1971\nCOMISSÕES:\nJUSTIÇA\nDISCUSSÃO ÚNICA\nRELATOR: DEP. RUY DA COSTA VAL\nPUBLICAÇÃO: 7 8 1971\nREDAÇÃO\nREDAÇÃO FINAL\nRELATOR: DEP. VALDIR MELGAÇO\nPUBLICAÇÃO: 28 8 1971\nSANCIONADO\nPUBLICAÇÃO DA LEI: 22 9 1971"")",list(),list(),N,311,NA,NA,1121,"UTILIDADE PÚBLICA, ENTIDADE, MUNICÍPIO, CONGONHAS.",UTILIDADE PÚBLICA,"list(id = 311, nome = ""DEPUTADO JOÃO NAVARRO"", partido = ""ARENA"")",NA,NULL,NA,/legislacao/mineira/LEI/5765/1971,LEI 5765 1971 - LEI ORDINÁRIA,NA
Remissivo,PROJETO DE LEI,PL,181,1971,DEPUTADO AMILCAR PADOVANI                  MDB,"DECLARA DE UTILIDADE PÚBLICA O ""SPORT CLUB SANTA CRUZ"", COM SEDE EM
JUIZ DE FORA.",TRANSFORMADO EM NORMA JURÍDICA,TNJUR,PROPOSIÇÕES APROVADAS,MAPRV,1971-06-25,000149374,PL. 181 1971 - PROJETO DE LEI,DELIBERAÇÃO DE PLENÁRIO,LEI 5767 1971 - LEI ORDINÁRIA,20120229,rosanacf,1971-06-23,"list(passo = 1, data = ""1971-06-23"", local = ""PLENÁRIO"", historico = ""HISTÓRICO DA TRAMITAÇÃO\nPLENÁRIO:\nDISCUSSÃO ÚNICA\nAPROVAÇÃO: 18 8 1971\nREDAÇÃO FINAL\nAPROVAÇÃO: 26 8 1971\nCOMISSÕES:\nJUSTIÇA\nDISCUSSÃO ÚNICA\nRELATOR: DEP. JOÃO NAVARRO\nPUBLICAÇÃO: 7 8 1971\nREDAÇÃO\nREDAÇÃO FINAL\nRELATOR: DEP. VALDIR MELGAÇO\nPUBLICAÇÃO: 25 8 1971\nSANCIONADO\nPUBLICAÇÃO DA LEI: 22 9 1971"")",list(),list(),N,1189,NA,NA,1118,"UTILIDADE PÚBLICA, ENTIDADE, MUNICÍPIO, JUIZ DE FORA.",UTILIDADE PÚBLICA,"list(id = 1189, nome = ""DEPUTADO AMILCAR PADOVANI"", partido = ""MDB"")",NA,NULL,NA,/legislacao/mineira/LEI/5767/1971,LEI 5767 1971 - LEI ORDINÁRIA,NA
Remissivo,PROJETO DE LEI,PL,180,1971,DEPUTADO AMILCAR PADOVANI                  MDB,"DECLARA DE UTILIDADE PÚBLICA O ""DEMOCRATA FUTEBOL CLUBE"", COM SEDE
EM ARACITABA.",TRANSFORMADO EM NORMA JURÍDICA,TNJUR,PROPOSIÇÕES APROVADAS,MAPRV,1971-06-25,000149375,PL. 180 1971 - PROJETO DE LEI,DELIBERAÇÃO DE PLENÁRIO,LEI 6414 1974 - LEI ORDINÁRIA,20120229,rosanacf,1971-06-23,"list(passo = 1, data = ""1971-06-23"", local = ""PLENÁRIO"", historico = ""HISTÓRICO DA TRAMITAÇÃO\nPLENÁRIO:\nPRIMEIRA DISCUSSÃO\nAPROVAÇÃO: 21 6 1974\nSEGUNDA DISCUSSÃO\nAPROVAÇÃO: 16 8 1974\nTERCEIRA DISCUSSÃO\nAPROVAÇÃO: 2 9 1974\nREDAÇÃO FINAL\nAPROVAÇÃO: 9 9 1974\nCOMISSÕES:\nJUSTIÇA\nPRIMEIRA DISCUSSÃO\nRELATOR: DEP. MAURÍLIO CAMBRAIA\nPUBLICAÇÃO: 8 6 1974\nJUSTIÇA\nSEGUNDA DISCUSSÃO\nRELATOR: DEP. MORVAN ACAYABA\nPUBLICAÇÃO: 27 6 1974\nJUSTIÇA\nTERCEIRA DISCUSSÃO\nRELATOR: DEP. JOÃO NAVARRO\nPUBLICAÇÃO: 23 8 1974\nREDAÇÃO\nREDAÇÃO FINAL\nRELATOR: DEP. MAURÍLIO CAMBRAIA\nPUBLICAÇÃO: 6 9 1974\nSANCIONADO\nPUBLICAÇÃO DA LEI: 24 9 1974"")",list(),"list(expressao = ""(PL adj 1080 adj 1974[PROP])[dbmt]"", banco = ""mate"", descricao = ""PL. 1080 1974"", url = ""/proposicoes/pesquisa/avancada?expr=%28PL+adj+1080+adj+1974%5BPROP%5D%29%5Bdbmt%5D"", tipo = ""PL"", numero = 1080, ano = 1974)",N,1189,NA,NA,1115,"UTILIDADE PÚBLICA, ENTIDADE, MUNICÍPIO, ARACITABA.",UTILIDADE PÚBLICA,"list(id = 1189, nome = ""DEPUTADO AMILCAR PADOVANI"", partido = ""MDB"")",NA,NULL,NA,/legislacao/mineira/LEI/6414/1974,LEI 6414 1974 - LEI ORDINÁRIA,NA
Remissivo,PROJETO DE LEI,PL,179,1971,DEPUTADO JOÃO PEDRO GUSTIN                 ARENA,"DECLARA DE UTILIDADE PÚBLICA O GRUPO FOLCLÓRICO ARUANDA, COM SEDE EM
BELO HORIZONTE.",TRANSFORMADO EM NORMA JURÍDICA,TNJUR,PROPOSIÇÕES APROVADAS,MAPRV,1971-06-24,000149376,PL. 179 1971 - PROJETO DE LEI,DELIBERAÇÃO DE PLENÁRIO,LEI 5762 1971 - LEI ORDINÁRIA,20120229,rosanacf,1971-06-22,"list(passo = 1, data = ""1971-06-22"", local = ""PLENÁRIO"", historico = ""HISTÓRICO DA TRAMITAÇÃO\nPLENÁRIO:\nDISCUSSÃO ÚNICA\nAPROVAÇÃO: 18 8 1971\nREDAÇÃO FINAL\nAPROVAÇÃO: 26 8 1971\nCOMISSÕES:\nJUSTIÇA\nDISCUSSÃO ÚNICA\nRELATOR: DEP. PINHEIRO CHAGAS\nPUBLICAÇÃO: 7 8 1971\nREDAÇÃO\nREDAÇÃO FINAL\nRELATOR: DEP. VALDIR MELGAÇO\nPUBLICAÇÃO: 25 8 1971\nSANCIONADO\nPUBLICAÇÃO DA LEI: 22 9 1971"")",list(),list(),N,1462,NA,NA,1113,"UTILIDADE PÚBLICA, ENTIDADE, MUNICÍPIO, BELO HORIZONTE.",UTILIDADE PÚBLICA,"list(id = 1462, nome = ""DEPUTADO JOÃO PEDRO GUSTIN"", partido = ""ARENA"")",NA,NULL,NA,/legislacao/mineira/LEI/5762/1971,LEI 5762 1971 - LEI ORDINÁRIA,NA
Remissivo,PROJETO DE LEI,PL,178,1971,DEPUTADO LEÃO BORGES                       ARENA,"DECLARA DE UTILIDADE PÚBLICA O NÚCLEO ASSISTENCIAL CAMINHOS PARA
JESUS, NO BAIRRO SANTO INÁCIO, EM BELO HORIZONTE.",TRANSFORMADO EM NORMA JURÍDICA,TNJUR,PROPOSIÇÕES APROVADAS,MAPRV,1971-06-24,000149377,PL. 178 1971 - PROJETO DE LEI,DELIBERAÇÃO DE PLENÁRIO,LEI 5755 1971 - LEI ORDINÁRIA,20120229,rosanacf,1971-06-22,"list(passo = 1, data = ""1971-06-22"", local = ""PLENÁRIO"", historico = ""HISTÓRICO DA TRAMITAÇÃO\nPLENÁRIO:\nDISCUSSÃO ÚNICA\nAPROVAÇÃO: 16 8 1971\nREDAÇÃO FINAL\nAPROVAÇÃO: 20 8 1971\nCOMISSÕES:\nJUSTIÇA\nDISCUSSÃO ÚNICA\nRELATOR: DEP. JOÃO NAVARRO\nPUBLICAÇÃO: 7 8 1971\nREDAÇÃO\nREDAÇÃO FINAL\nRELATOR: DEP. NARCÉLIO MENDES\nPUBLICAÇÃO: 20 8 1971\nSANCIONADO\nPUBLICAÇÃO DA LEI: 3 9 1971"")",list(),list(),N,713,NA,NA,1110,"UTILIDADE PÚBLICA, ENTIDADE, MUNICÍPIO, BELO HORIZONTE.",UTILIDADE PÚBLICA,"list(id = 713, nome = ""DEPUTADO LEÃO BORGES"", partido = ""ARENA"")",NA,NULL,NA,/legislacao/mineira/LEI/5755/1971,LEI 5755 1971 - LEI ORDINÁRIA,NA
Remissivo,PROJETO DE LEI,PL,177,1971,DEPUTADO EDGARD DE VASCONCELOS             ARENA,"DECLARA DE UTILIDADE PÚBLICA A REVISTA ""TURMINAS - REVISTA MINEIRA
DE TURISMO"", DE BELO HORIZONTE.",ARQUIVADO,ARQVD,OUTRAS SITUAÇÕES,MOUTR,1971-06-23,000149378,PL. 177 1971 - PROJETO DE LEI,NA,NA,20120229,rosanacf,1971-06-21,"list(passo = 1, data = ""1971-06-21"", local = ""PLENÁRIO"", historico = ""ARQUIVADO, FINAL DE LEGISLATURA."")",list(),list(),N,941,ARQUIVO,19750131,1105,"UTILIDADE PÚBLICA, ENTIDADE, MUNICÍPIO, BELO HORIZONTE.",UTILIDADE PÚBLICA,"list(id = 941, nome = ""DEPUTADO EDGARD DE VASCONCELOS"", partido = ""ARENA"")",NA,NULL,NA,NA,NA,NA
Remissivo,PROJETO DE LEI,PL,176,1971,DEPUTADO EDGARD DE VASCONCELOS             ARENA,DÁ A DENOMINAÇÃO DE CRISTO-REI AO GINÁSIO ESTADUAL DE GUIRICEMA.,ARQUIVADO,ARQVD,OUTRAS SITUAÇÕES,MOUTR,1971-06-23,000149379,PL. 176 1971 - PROJETO DE LEI,NA,NA,20120412,rosanacf,1971-06-21,"list(passo = 1, data = ""1971-06-21"", local = ""PLENÁRIO"", historico = ""HISTÓRICO DA TRAMITAÇÃO\nPLENÁRIO:\nPRIMEIRA DISCUSSÃO\nAPROVAÇÃO: 25 6 1971\nSEGUNDA DISCUSSÃO\nAPROVAÇÃO: 26 8 1971 COM A EMENDA 2.\nCOMISSÕES:\nJUSTIÇA\nSEGUNDA DISCUSSÃO\nRELATOR: DEP. TARCISIO DELGADO\nPUBLICAÇÃO: 21 8 1971\nJUSTIÇA\nTERCEIRA DISCUSSÃO\nRELATOR: DEP. FERNANDO JUNQUEIRA\nPUBLICAÇÃO: 9 10 1971\nARQUIVADO, FINAL DE LEGISLATURA."")",list(),list(),N,941,ARQUIVO,19711116,1150,"DENOMINAÇÃO, ESTABELECIMENTO DE ENSINO, MUNICÍPIO, GUIRICEMA.","PRÓPRIO PÚBLICO
ESTABELECIMENTO DE ENSINO","list(id = 941, nome = ""DEPUTADO EDGARD DE VASCONCELOS"", partido = ""ARENA"")",NA,NULL,NA,NA,NA,NA
