dominio,tipoProjeto,siglaTipoProjeto,numero,ano,autor,ementa,situacao,siglaSituacao,situacaoGeral,siglaSituacaoGeral,dataPublicacao,numeroDoc,proposicao,regime,norma,atualizacao,usuario,dataUltimaAcao,listaHistoricoTramitacoes,links,linksProposicoesAnexadas,acompanhamento,matricula,local,arquivamento,horario,indexacao,assuntoGeral,autoresEstruturados,tema,linksOrigem,legislacaoCitada,linkLegislacao.url,linkLegislacao.rotulo,proposicaoLei.descricao
Remissivo,PROJETO DE LEI,PL,97,1971,DEPUTADO IVO MORAIS                        ARENA,"DECLARA DE UTILIDADE PÚBLICA A ASSOCIAÇÃO BRASILEIRA DE ODONTOLOGIA,
SEÇÃO DE MINAS GERAIS, COM SEDE EM BELO HORIZONTE.",TRANSFORMADO EM NORMA JURÍDICA,TNJUR,PROPOSIÇÕES APROVADAS,MAPRV,1971-04-23,000149458,PL. 97 1971 - PROJETO DE LEI,NA,LEI 5693 1971 - LEI ORDINÁRIA,20120307,rosanacf,1971-04-20,"list(passo = 1, data = ""1971-04-20"", local = ""PLENÁRIO"", historico = ""HISTÓRICO DA TRAMITAÇÃO\nPLENÁRIO:\nDISCUSSÃO ÚNICA\nAPROVAÇÃO: 6 5 1971\nREDAÇÃO FINAL\nAPROVAÇÃO: 12 5 1971\nCOMISSÕES:\nJUSTIÇA\nDISCUSSÃO ÚNICA\nRELATOR: DEP. JOÃO NAVARRO\nPUBLICAÇÃO: 4 5 1971\nREDAÇÃO\nREDAÇÃO FINAL\nRELATOR: DEP. LUIZ BACCARINI\nPUBLICAÇÃO: 12 5 1971\nSANCIONADO\nPUBLICAÇÃO DA LEI: 26 5 1971."")",list(),list(),N,1472,NA,NA,1452,"UTILIDADE PÚBLICA, ENTIDADE, MUNICÍPIO, BELO HORIZONTE.",UTILIDADE PÚBLICA,"list(id = 1472, nome = ""DEPUTADO IVO MORAIS"", partido = ""ARENA"")",NA,NULL,NA,/legislacao/mineira/LEI/5693/1971,LEI 5693 1971 - LEI ORDINÁRIA,NA
Remissivo,PROJETO DE LEI,PL,96,1971,DEPUTADO LOURIVAL BRASIL                   ARENA,"TRANSFORMA EN GRUPO ESCOLAR AS ESCOLAS REUNIDAS DA CIDADE
DE CRUZEIRO DA FORTALEZA.",ARQUIVADO,ARQVD,OUTRAS SITUAÇÕES,MOUTR,1971-04-23,000149459,PL. 96 1971 - PROJETO DE LEI,NA,NA,20100129,m17663,1971-04-20,"list(passo = 1, data = ""1971-04-20"", local = ""PLENÁRIO"", historico = ""HISTÓRICO DA TRAMITAÇÃO\nPLENÁRIO:\nPRIMEIRA DISCUSSÃO\nAPROVAÇÃO: 27 4 1971\nARQUIVADO, FINAL DE LEGISLATURA."")",list(),list(),N,322,ARQUIVO,19750131,1124,NA,NA,"list(id = 322, nome = ""DEPUTADO LOURIVAL BRASIL"", partido = ""ARENA"")",NA,"list(descricao = ""PL. 494 1968"")",NA,NA,NA,NA
Remissivo,PROJETO DE LEI,PL,95,1971,DEPUTADO NELSON LOMBARDI                   ARENA,"TRANSFORMA EM GRUPO ESCOLAR, COM A DENOMINAÇÃO DE ""GABRIEL PASSOS"",
AS ESCOLAS COMBINADAS DE MERCÊS DE ÁGUA LIMPA, EM SÃO TIAGO.",ARQUIVADO,ARQVD,OUTRAS SITUAÇÕES,MOUTR,1971-04-23,000149460,PL. 95 1971 - PROJETO DE LEI,NA,NA,20120412,rosanacf,1971-04-20,"list(passo = 1, data = ""1971-04-20"", local = ""PLENÁRIO"", historico = ""HISTÓRICO DA TRAMITAÇÃO\nPLENÁRIO:\nPRIMEIRA DISCUSSÃO\nAPROVAÇÃO: 27 4 1971\nARQUIVADO, FINAL DE LEGISLATURA."")",list(),list(),N,1184,ARQUIVO,19750131,1136,"ALTERAÇÃO, DENOMINAÇÃO, ESTABELECIMENTO DE ENSINO, MUNICÍPIO, SÃO TIAGO.","PRÓPRIO PÚBLICO
ESTABELECIMENTO DE ENSINO","list(id = 1184, nome = ""DEPUTADO NELSON LOMBARDI"", partido = ""ARENA"")",NA,NULL,NA,NA,NA,NA
Remissivo,PROJETO DE LEI,PL,94,1971,DEPUTADO BONIFÁCIO DE ANDRADA              ARENA,"DISPÕE SOBRE A PROTEÇÃO ESPECIAL DE DOCUMENTOS, OBRAS, LOCAIS
DE VALOR HISTÓRICO E ARTÍSTICO, MONUMENTOS, PAISAGENS NATURAIS
E JAZIDAS ARQUEOLÓGICAS, PELO ESTADO, E CONTÉM OUTRAS PROVIDÊNCIAS",TRANSFORMADO EM NORMA JURÍDICA,TNJUR,PROPOSIÇÕES APROVADAS,MAPRV,1971-04-23,000149461,PL. 94 1971 - PROJETO DE LEI,NA,LEI 5741 1971 - LEI ORDINÁRIA,20131022,rosanacf,1971-04-20,"list(passo = 1, data = ""1971-04-20"", local = ""PLENÁRIO"", historico = ""HISTÓRICO DA TRAMITAÇÃO\nPLENÁRIO:\nPRIMEIRA DISCUSSÃO\nAPROVAÇÃO: 26 4 1971\nSEGUNDA DISCUSSÃO\nAPROVAÇÃO: 3 6 1971\nTERCEIRA DISCUSSÃO\nAPROVAÇÃO: 15 6 1971\nREDAÇÃO FINAL\nAPROVAÇÃO: 17 6 1971\nCOMISSÕES:\nJUSTIÇA\nSEGUNDA DISCUSSÃO\nRELATOR: DEP. TARCISIO DELGADO\nPUBLICAÇÃO: 2 6 1971\nEDUCAÇÃO\nSEGUNDA DISCUSSÃO\nRELATOR: DEP. MARCOS TITO\nPUBLICAÇÃO: 2 6 1971\nFINANÇAS\nSEGUNDA DISCUSSÃO\nRELATOR: DEP. NELSON LOMBARDI\nPUBLICAÇÃO: 2 6 1971\nFINANÇAS\nTERCEIRA DISCUSSÃO\nRELATOR: DEP. VICENTE GUABIROBA\nPUBLICAÇÃO: 9 6 1971\nREDAÇÃO\nREDAÇÃO FINAL\nRELATOR: DEP. LUIZ BACCARINI\nPUBLICAÇÃO: 19 6 1971\nSANCIONADO\nPUBLICAÇÃO DA LEI: 9 7 1971."")",list(),list(),N,281,NA,NA,1337,"NORMAS, PROTEÇÃO, OBRA ARTÍSTICA, DOCUMENTO, OBJETO, VALOR, PATRIMÔNIO
HISTÓRICO, PATRIMÔNIO ARTÍSTICO, PATRIMÔNIO ARQUEOLÓGICO.","CULTURA
MEIO AMBIENTE","list(id = 281, nome = ""DEPUTADO BONIFÁCIO DE ANDRADA"", partido = ""ARENA"")","CULTURA
MEIO AMBIENTE","list(descricao = ""PL. 1563 1970"")",NA,/legislacao/mineira/LEI/5741/1971,LEI 5741 1971 - LEI ORDINÁRIA,PRL 6275 1971
Remissivo,PROJETO DE LEI,PL,93,1971,DEPUTADO SAMIR TANNÚS                      ARENA,"DÁ A DENOMINAÇÃO DE GINÁSIO ESTADUAL ""DURVAL SEVERINO DA SILVA"" AO
GINÁSIO ESTADUAL DE GURINHATÃ.",ARQUIVADO,ARQVD,OUTRAS SITUAÇÕES,MOUTR,1971-04-21,000149462,PL. 93 1971 - PROJETO DE LEI,NA,NA,20120412,rosanacf,1971-04-19,"list(passo = 1, data = ""1971-04-19"", local = ""PLENÁRIO"", historico = ""HISTÓRICO DA TRAMITAÇÃO\nPLENÁRIO:\nPRIMEIRA DISCUSSÃO\nAPROVAÇÃO: 26 4 1971\nARQUIVADO, FINAL DE LEGISLATURA."")",list(),list(),N,1463,ARQUIVO,19750131,1135,"DENOMINAÇÃO, ESTABELECIMENTO DE ENSINO, MUNICÍPIO, GURINHATÃ.","PRÓPRIO PÚBLICO
ESTABELECIMENTO DE ENSINO","list(id = 1463, nome = ""DEPUTADO SAMIR TANNÚS"", partido = ""ARENA"")",NA,NULL,NA,NA,NA,NA
Remissivo,PROJETO DE LEI,PL,92,1971,DEPUTADO SAMIR TANNÚS                      ARENA,"DÁ A DENOMINAÇÃO DE COLÉGIO ESTADUAL ""PEDRO DE FREITAS BARROS"" AO
COLÉGIO DE ITUIUTABA (COMERCIAL).",ARQUIVADO,ARQVD,OUTRAS SITUAÇÕES,MOUTR,1971-04-21,000149463,PL. 92 1971 - PROJETO DE LEI,NA,NA,20120412,rosanacf,1971-04-19,"list(passo = 1, data = ""1971-04-19"", local = ""PLENÁRIO"", historico = ""HISTÓRICO DA TRAMITAÇÃO\nPLENÁRIO:\nPRIMEIRA DISCUSSÃO\nAPROVAÇÃO: 26 4 1971\nCOMISSÕES:\nJUSTIÇA\nSEGUNDA DISCUSSÃO\nRELATOR: DEP. FERNANDO JUNQUEIRA\nPUBLICAÇÃO: 20 5 1971\nARQUIVADO, FINAL DE LEGISLATURA."")",list(),list(),N,1463,ARQUIVO,19750131,1134,"DENOMINAÇÃO, ESTABELECIMENTO DE ENSINO, MUNICÍPIO, ITUIUTABA.","PRÓPRIO PÚBLICO
ESTABELECIMENTO DE ENSINO","list(id = 1463, nome = ""DEPUTADO SAMIR TANNÚS"", partido = ""ARENA"")",NA,NULL,NA,NA,NA,NA
Remissivo,PROJETO DE LEI,PL,91,1971,DEPUTADO SAMIR TANNÚS                      ARENA,"DÁ DENOMINAÇÃO DE ""CORONEL EDMUNDO NOVAES"" AO COLÉGIO DA CIDADE DE
PRATA.",TRANSFORMADO EM NORMA JURÍDICA,TNJUR,PROPOSIÇÕES APROVADAS,MAPRV,1971-04-21,000149464,PL. 91 1971 - PROJETO DE LEI,NA,LEI 5740 1971 - LEI ORDINÁRIA,20120412,rosanacf,1971-04-19,"list(passo = 1, data = ""1971-04-19"", local = ""PLENÁRIO"", historico = ""HISTÓRICO DA TRAMITAÇÃO\nPLENÁRIO:\nPRIMEIRA DISCUSSÃO\nAPROVAÇÃO: 23 4 1971\nSEGUNDA DISCUSSÃO\nAPROVAÇÃO: 13 5 1971\nTERCEIRA DISCUSSÃO\nAPROVAÇÃO: 26 5 1971\nREDAÇÃO FINAL\nAPROVAÇÃO: 3 6 1971\nCOMISSÕES:\nJUSTIÇA\nSEGUNDA DISCUSSÃO\nRELATOR: DEP. MARCOS TITO\nPUBLICAÇÃO: 4 5 1971\nJUSTIÇA\nTERCEIRA DISCUSSÃO\nRELATOR: DEP. TARCISIO DELGADO\nPUBLICAÇÃO: 20 5 1971\nREDAÇÃO\nREDAÇÃO FINAL\nRELATOR: DEP. NARCÉLIO MENDES\nPUBLICAÇÃO: 3 6 1971\nSANCIONADO\nPUBLICAÇÃO DA LEI: 14 7 1971."")",list(),list(),N,1463,NA,NA,1133,"DENOMINAÇÃO, ESTABELECIMENTO DE ENSINO, MUNICÍPIO, PRATA.","PRÓPRIO PÚBLICO
ESTABELECIMENTO DE ENSINO","list(id = 1463, nome = ""DEPUTADO SAMIR TANNÚS"", partido = ""ARENA"")",NA,NULL,NA,/legislacao/mineira/LEI/5740/1971,LEI 5740 1971 - LEI ORDINÁRIA,NA
Remissivo,PROJETO DE LEI,PL,90,1971,DEPUTADO SAMIR TANNÚS                      ARENA,"DÁ A DENOMINAÇÃO DE COLÉGIO ESTADUAL ""ANTÔNIO PEDRO GUIMARÃES"" AO
COLÉGIO ESTADUAL DE ITUIUTABA.",ARQUIVADO,ARQVD,OUTRAS SITUAÇÕES,MOUTR,1971-04-21,000149465,PL. 90 1971 - PROJETO DE LEI,NA,NA,20120412,rosanacf,1971-04-19,"list(passo = 1, data = ""1971-04-19"", local = ""PLENÁRIO"", historico = ""HISTÓRICO DA TRAMITAÇÃO\nPLENÁRIO\nPRIMEIRA DISCUSSÃO\nAPROVAÇÃO: 26 4 1971\nCOMISSÕES:\nJUSTIÇA\nSEGUNDA DISCUSSÃO\nRELATOR: DEP. JOÃO NAVARRO\nPUBLICAÇÃO: 8 5 1971\nARQUIVADO, FINAL DE LEGISLATURA."")",list(),list(),N,1463,ARQUIVO,19750131,1132,"DENOMINAÇÃO, ESTABELECIMENTO DE ENSINO, MUNICÍPIO, ITUIUTABA.","PRÓPRIO PÚBLICO
ESTABELECIMENTO DE ENSINO","list(id = 1463, nome = ""DEPUTADO SAMIR TANNÚS"", partido = ""ARENA"")",NA,NULL,NA,NA,NA,NA
Remissivo,PROJETO DE LEI,PL,89,1971,DEPUTADO SAMIR TANNÚS                      ARENA,"DÁ A DENOMINAÇÃO DE ""NICANOR PARREIRA"" AO COLÉGIO ESTADUAL DE MONTE
ALEGRE DE MINAS.",TRANSFORMADO EM NORMA JURÍDICA,TNJUR,PROPOSIÇÕES APROVADAS,MAPRV,1971-04-21,000149466,PL. 89 1971 - PROJETO DE LEI,NA,LEI 5739 1971 - LEI ORDINÁRIA,20120412,rosanacf,1971-04-19,"list(passo = 1, data = ""1971-04-19"", local = ""PLENÁRIO"", historico = ""HISTÓRICO DA TRAMITAÇÃO\nPLENÁRIO:\nPRIMEIRA DISCUSSÃO\nAPROVAÇÃO: 23 4 1971\nSEGUNDA DISCUSSÃO\nAPROVAÇÃO: 10 5 1971\nTERCEIRA DISCUSSÃO\nAPROVAÇÃO: 26 5 1971\nREDAÇÃO FINAL\nAPROVAÇÃO: 2 6 1971\nCOMISSÕES:\nJUSTIÇA\nSEGUNDA DISCUSSÃO\nRELATOR: DEP. FERNANDO JUNQUEIRA\nPUBLICAÇÃO: 4 5 1971\nJUSTIÇA\nTERCEIRA DISCUSSÃO\nRELATOR: DEP. MORVAN ACAYABA\nPUBLICAÇÃO: 18 5 1971\nREDAÇÃO\nREDAÇÃO FINAL\nRELATOR: DEP. VALDIR MELGAÇO\nPUBLICAÇÃO: 2 6 1971\nSANCIONADO\nPUBLICAÇÃO DA LEI: 9 7 1971."")",list(),list(),N,1463,NA,NA,1130,"DENOMINAÇÃO, ESTABELECIMENTO DE ENSINO, MUNICÍPIO, MONTE ALEGRE DE
MINAS.","PRÓPRIO PÚBLICO
ESTABELECIMENTO DE ENSINO","list(id = 1463, nome = ""DEPUTADO SAMIR TANNÚS"", partido = ""ARENA"")",NA,NULL,NA,/legislacao/mineira/LEI/5739/1971,LEI 5739 1971 - LEI ORDINÁRIA,NA
Remissivo,PROJETO DE LEI,PL,88,1971,DEPUTADO SAMIR TANNÚS                      ARENA,"DECLARA DE UTILIDADE PÚBLICA A ESCOLA DE ADMINISTRAÇÃO DE EMPRESAS DE
ITUIUTABA, COM SEDE NA CIDADE DE ITUIUTABA.",TRANSFORMADO EM NORMA JURÍDICA,TNJUR,PROPOSIÇÕES APROVADAS,MAPRV,1971-04-21,000149467,PL. 88 1971 - PROJETO DE LEI,DELIBERAÇÃO DE PLENÁRIO,LEI 5692 1971 - LEI ORDINÁRIA,20120306,rosanacf,1971-04-19,"list(passo = 1, data = ""1971-04-19"", local = ""PLENÁRIO"", historico = ""HISTÓRICO DA TRAMITAÇÃO\nPLENÁRIO:\nDISCUSSÃO ÚNICA\nAPROVAÇÃO: 5 5 1971\nREDAÇÃO FINAL\nAPROVAÇÃO: 10 5 1971\nCOMISSÕES:\nJUSTIÇA\nDISCUSSÃO ÚNICA\nRELATOR: DEP. TARCISIO DELGADO\nPUBLICAÇÃO: 4 5 1971\nREDAÇÃO\nREDAÇÃO FINAL\nRELATOR: DEP. NARCÉLIO MENDES\nPUBLICAÇÃO: 12 5 1971\nSANCIONADO\nPUBLICAÇÃO DA LEI: 25 5 1971."")",list(),list(),N,1463,NA,NA,1623,"UTILIDADE PÚBLICA, ENTIDADE, MUNICÍPIO, ITUIUTABA.",UTILIDADE PÚBLICA,"list(id = 1463, nome = ""DEPUTADO SAMIR TANNÚS"", partido = ""ARENA"")",NA,NULL,NA,/legislacao/mineira/LEI/5692/1971,LEI 5692 1971 - LEI ORDINÁRIA,NA
Remissivo,PROJETO DE LEI,PL,87,1971,DEPUTADO JOÃO NAVARRO                      ARENA,"DÁ DENOMINAÇÃO À ESCOLA PRIMÁRIA DE SÃO SEBASTIÃO DO BARREADO,
MUNICÍPIO DE RIO PRETO.",TRANSFORMADO EM NORMA JURÍDICA,TNJUR,PROPOSIÇÕES APROVADAS,MAPRV,1971-04-20,000149468,PL. 87 1971 - PROJETO DE LEI,NA,LEI 5701 1971 - LEI ORDINÁRIA,20120412,rosanacf,1971-04-16,"list(passo = 1, data = ""1971-04-16"", local = ""PLENÁRIO"", historico = ""HISTÓRICO DA TRAMITAÇÃO\nPLENÁRIO:\nPRIMEIRA DISCUSSÃO\nAPROVAÇÃO: 22 4 1971\nSEGUNDA DISCUSSÃO\nAPROVAÇÃO: 6 5 1971\nTERCEIRA DISCUSSÃO\nAPROVAÇÃO: 19 5 1971\nREDAÇÃO FINAL\nAPROVAÇÃO: 26 5 1971\nCOMISSÕES:\nJUSTIÇA\nSEGUNDA DISCUSSÃO\nRELATOR: DEP. MARCOS TITO\nPUBLICAÇÃO: 4 5 1971\nJUSTIÇA\nTERCEIRA DISCUSSÃO\nRELATOR: DEP. NARCÉLIO MENDES\nPUBLICAÇÃO: 13 5 1971\nREDAÇÃO\nREDAÇÃO FINAL\nRELATOR: DEP. NARCÉLIO MENDES\nPUBLICAÇÃO: 26 5 1971\nSANCIONADO\nPUBLICAÇÃO DA LEI: 9 6 1971."")",list(),list(),N,311,NA,NA,1129,"DENOMINAÇÃO, ESTABELECIMENTO DE ENSINO, MUNICÍPIO, RIO PRETO.","PRÓPRIO PÚBLICO
ESTABELECIMENTO DE ENSINO","list(id = 311, nome = ""DEPUTADO JOÃO NAVARRO"", partido = ""ARENA"")",NA,NULL,NA,/legislacao/mineira/LEI/5701/1971,LEI 5701 1971 - LEI ORDINÁRIA,NA
Remissivo,PROJETO DE LEI,PL,86,1971,DEPUTADO JOÃO NAVARRO                      ARENA,"DÁ DENOMINAÇÃO DE SOUZA LEITE AO GINÁSIO ESTADUAL DA CIDADE DE MADRE DE
DEUS DE MINAS.",TRANSFORMADO EM NORMA JURÍDICA,TNJUR,PROPOSIÇÕES APROVADAS,MAPRV,1971-04-20,000149469,PL. 86 1971 - PROJETO DE LEI,NA,LEI 5700 1971 - LEI ORDINÁRIA,20120412,rosanacf,1971-04-16,"list(passo = 1, data = ""1971-04-16"", local = ""PLENÁRIO"", historico = ""HISTÓRICO DA TRAMITAÇÃO\nPLENÁRIO:\nPRIMEIRA DISCUSSÃO\nAPROVAÇÃO: 22 4 1971\nSEGUNDA DISCUSSÃO\nAPROVAÇÃO: 6 5 1971\nTERCEIRA DISCUSSÃO\nAPROVAÇÃO: 18 5 1971\nREDAÇÃO FINAL\nAPROVAÇÃO: 21 5 1971\nCOMISSÕES:\nJUSTIÇA\nSEGUNDA DISCUSSÃO\nRELATOR: DEP. MARCOS TITO\nPUBLICAÇÃO: 4 5 1971\nJUSTIÇA\nTERCEIRA DISCUSSÃO\nRELATOR: DEP. RUY DA COSTA VAL\nPUBLICAÇÃO: 13 5 1971\nREDAÇÃO\nREDAÇÃO FINAL\nRELATOR: DEP. VALDIR MELGAÇO\nPUBLICAÇÃO: NÃO CONSTA\nSANCIONADO\nPUBLICAÇÃO DA LEI: 4 6 1971."")",list(),list(),N,311,NA,NA,1128,"DENOMINAÇÃO, ESTABELECIMENTO DE ENSINO, MUNICÍPIO, MADRE DE DEUS DE
MINAS.","PRÓPRIO PÚBLICO
ESTABELECIMENTO DE ENSINO","list(id = 311, nome = ""DEPUTADO JOÃO NAVARRO"", partido = ""ARENA"")",NA,NULL,NA,/legislacao/mineira/LEI/5700/1971,LEI 5700 1971 - LEI ORDINÁRIA,NA
Remissivo,PROJETO DE LEI,PL,85,1971,DEPUTADO EUCLIDES CINTRA                   ARENA,"DÁ A DENOMINAÇÃO DE COMENDADOR MÁRIO GOULART AO COLÉGIO SECUNDÁRIO
ESTADUAL DE PEDRALVA.",TRANSFORMADO EM NORMA JURÍDICA,TNJUR,PROPOSIÇÕES APROVADAS,MAPRV,1971-04-20,000149470,PL. 85 1971 - PROJETO DE LEI,NA,LEI 5699 1971 - LEI ORDINÁRIA,20120412,rosanacf,1971-04-16,"list(passo = 1, data = ""1971-04-16"", local = ""PLENÁRIO"", historico = ""HISTÓRICO DA TRAMITAÇÃO\nPLENÁRIO:\nPRIMEIRA DISCUSSÃO\nAPROVAÇÃO: 20 4 1971\nSEGUNDA DISCUSSÃO\nAPROVAÇÃO: 6 5 1971\nTERCEIRA DISCUSSÃO\nAPROVAÇÃO: 18 5 1971\nREDAÇÃO FINAL\nAPROVAÇÃO: 21 5 1971\nCOMISSÕES:\nJUSTIÇA\nSEGUNDA DISCUSSÃO\nRELATOR: DEP. RUY DA COSTA VAL\nPUBLICAÇÃO: 4 5 1971\nJUSTIÇA\nTERCEIRA DISCUSSÃO\nRELATOR: DEP. NARCÉLIO MENDES\nPUBLICAÇÃO: 13 5 1971\nREDAÇÃO\nREDAÇÃO FINAL\nRELATOR: DEP. VALDIR MELGAÇO\nPUBLICAÇÃO: 4 6 1971\nSANCIONADO\nPUBLICAÇÃO DA LEI: 4 6 1971."")",list(),list(),N,295,NA,NA,1128,"DENOMINAÇÃO, ESTABELECIMENTO DE ENSINO, MUNICÍPIO, PEDRALVA.","PRÓPRIO PÚBLICO
ESTABELECIMENTO DE ENSINO","list(id = 295, nome = ""DEPUTADO EUCLIDES CINTRA"", partido = ""ARENA"")",NA,NULL,NA,/legislacao/mineira/LEI/5699/1971,LEI 5699 1971 - LEI ORDINÁRIA,NA
Remissivo,PROJETO DE LEI,PL,83,1971,DEPUTADO LEÃO BORGES                       ARENA,"DÁ A DENOMINAÇÃO DE LINDOLFO DE ALMEIDA FERREIRA AO GINÁSIO ESTADUAL DE
COMENDADOR GOMES.",TRANSFORMADO EM NORMA JURÍDICA,TNJUR,PROPOSIÇÕES APROVADAS,MAPRV,1971-04-17,000149472,PL. 83 1971 - PROJETO DE LEI,NA,LEI 5712 1971 - LEI ORDINÁRIA,20120412,rosanacf,1971-04-15,"list(passo = 1, data = ""1971-04-15"", local = ""PLENÁRIO"", historico = ""HISTÓRICO DA TRAMITAÇÃO\nPLENÁRIO:\nPRIMEIRA DISCUSSÃO\nAPROVAÇÃO: 20 4 1971\nSEGUNDA DISCUSSÃO\nAPROVAÇÃO: 10 5 1971\nTERCEIRA DISCUSSÃO\nAPROVAÇÃO: 25 5 1971\nREDAÇÃO FINAL\nAPROVAÇÃO: 31 5 1971\nCOMISSÕES:\nJUSTIÇA\nSEGUNDA DISCUSSÃO\nRELATOR: DEP. FERNANDO JUNQUEIRA\nPUBLICAÇÃO: 7 5 1971\nJUSTIÇA\nTERCEIRA DISCUSSÃO\nRELATOR: DEP. MORVAN ACAYABA\nPUBLICAÇÃO: 18 5 1971\nREDAÇÃO\nREDAÇÃO FINAL\nRELATOR: DEP. LUIZ BACCARINI\nPUBLICAÇÃO: 29 5 1971\nSANCIONADO\nPUBLICAÇÃO DA LEI: 18 6 1971."")",list(),list(),N,713,NA,NA,1127,"DENOMINAÇÃO, ESTABELECIMENTO DE ENSINO, MUNICÍPIO, COMENDADOR GOMES.","PRÓPRIO PÚBLICO
ESTABELECIMENTO DE ENSINO","list(id = 713, nome = ""DEPUTADO LEÃO BORGES"", partido = ""ARENA"")",NA,NULL,NA,/legislacao/mineira/LEI/5712/1971,LEI 5712 1971 - LEI ORDINÁRIA,NA
Remissivo,PROJETO DE LEI,PL,82,1971,DEPUTADO RODOLFO LEITE                     MDB,"DÁ A DENOMINAÇÃO DE ""DR. JOSÉ ZOCCOLI DE ANDRADE"" AO CONSERVATÓRIO
ESTADUAL DE MÚSICA DE ITUIUTABA.",TRANSFORMADO EM NORMA JURÍDICA,TNJUR,PROPOSIÇÕES APROVADAS,MAPRV,1971-04-17,000149473,PL. 82 1971 - PROJETO DE LEI,NA,LEI 5742 1971 - LEI ORDINÁRIA,20120412,rosanacf,1971-04-15,"list(passo = 1, data = ""1971-04-15"", local = ""PLENÁRIO"", historico = ""HISTÓRICO DA TRAMITAÇÃO\nPLENÁRIO:\nPRIMEIRA DISCUSSÃO\nAPROVAÇÃO: 20 4 1971\nSEGUNDA DISCUSSÃO\nAPROVAÇÃO: 26 5 1971\nTERCEIRA DISCUSSÃO\nAPROVAÇÃO: 8 6 1971\nREDAÇÃO FINAL\nAPROVAÇÃO: 16 6 1971\nCOMISSÕES:\nJUSTIÇA\nSEGUNDA DISCUSSÃO\nRELATOR: DEP. PINHEIRO CHAGAS\nPUBLICAÇÃO: 20 5 1971\nJUSTIÇA\nTERCEIRA DISCUSSÃO\nRELATOR: DEP. MARCOS TITO\nPUBLICAÇÃO: 3 6 1971\nREDAÇÃO\nREDAÇÃO FINAL\nRELATOR: DEP. VALDIR MELGAÇO\nPUBLICAÇÃO: 16 6 1971\nSANCIONADA\nPUBLICAÇÃO DA LEI: 9 7 1971."")",list(),list(),N,1475,NA,NA,1126,"DENOMINAÇÃO, CONSERVATÓRIO DE MÚSICA, MUNICÍPIO, ITUIUTABA.","PRÓPRIO PÚBLICO
ESTABELECIMENTO DE ENSINO","list(id = 1475, nome = ""DEPUTADO RODOLFO LEITE"", partido = ""MDB"")",NA,NULL,NA,/legislacao/mineira/LEI/5742/1971,LEI 5742 1971 - LEI ORDINÁRIA,NA
Remissivo,PROJETO DE LEI,PL,81,1971,DEPUTADO RODOLFO LEITE                     MDB,"DÁ A DENOMINAÇÃO DE ATHAIDES QUIRINO RIBEIRO AO GINÁSIO ESTADUAL DE
GURINHATÃ.",ARQUIVADO,ARQVD,OUTRAS SITUAÇÕES,MOUTR,1971-04-17,000149474,PL. 81 1971 - PROJETO DE LEI,NA,NA,20120412,rosanacf,1971-04-15,"list(passo = 1, data = ""1971-04-15"", local = ""PLENÁRIO"", historico = ""HISTÓRICO DA TRAMITAÇÃO\nPLENÁRIO:\nPRIMEIRA DISCUSSÃO\nAPROVAÇÃO: 19 4 1971\nCOMISSÕES:\nJUSTIÇA\nSEGUNDA DISCUSSÃO\nRELATOR: DEP. TARCISIO DELGADO\nPUBLICAÇÃO: 4 5 1971\nARQUIVADO, FINAL DE LEGISLATURA."")",list(),list(),N,1475,ARQUIVO,19750131,1115,"DENOMINAÇÃO, ESTABELECIMENTO DE ENSINO, MUNICÍPIO, GURINHATÃ.","PRÓPRIO PÚBLICO
ESTABELECIMENTO DE ENSINO","list(id = 1475, nome = ""DEPUTADO RODOLFO LEITE"", partido = ""MDB"")",NA,NULL,NA,NA,NA,NA
Remissivo,PROJETO DE LEI,PL,80,1971,DEPUTADO RODOLFO LEITE                     MDB,"DÁ A DENOMINAÇÃO DE MANOEL AFONSO CANCELLA AO COLÉGIO COMERCIAL DE
ITUIUTABA.",ARQUIVADO,ARQVD,OUTRAS SITUAÇÕES,MOUTR,1971-04-17,000149475,PL. 80 1971 - PROJETO DE LEI,NA,NA,20120412,rosanacf,1971-04-15,"list(passo = 1, data = ""1971-04-15"", local = ""PLENÁRIO"", historico = ""HISTÓRICO DA TRAMITAÇÃO\nPLENÁRIO:\nPRIMEIRA DISCUSSÃO\nAPROVAÇÃO: 19 4 1971\nCOMISSÕES:\nJUSTIÇA\nSEGUNDA DISCUSSÃO\nRELATOR: DEP. FERNANDO JUNQUEIRA\nPUBLICAÇÃO: 4 5 1971\nARQUIVADO, FINAL DE LEGISLATURA."")",list(),list(),N,1475,ARQUIVO,19750131,1113,"DENOMINAÇÃO, ESTABELECIMENTO DE ENSINO, MUNICÍPIO, ITUIUTABA.","PRÓPRIO PÚBLICO
ESTABELECIMENTO DE ENSINO","list(id = 1475, nome = ""DEPUTADO RODOLFO LEITE"", partido = ""MDB"")",NA,NULL,NA,NA,NA,NA
Remissivo,PROJETO DE LEI,PL,79,1971,COMISSÃO CONSTITUIÇÃO E JUSTIÇA,"DÁ A DENOMINAÇÃO DE PREFEITO MÁRIO NATAL GUIMARÃES AO COLÉGIO ESTADUAL
DE ITUIUTABA.",ARQUIVADO,ARQVD,OUTRAS SITUAÇÕES,MOUTR,1971-04-17,000149476,PL. 79 1971 - PROJETO DE LEI,NA,NA,20120412,rosanacf,1971-04-15,"list(passo = 1, data = ""1971-04-15"", local = ""PLENÁRIO"", historico = ""HISTÓRICO DA TRAMITAÇÃO\nPLENÁRIO\nPRIMEIRA DISCUSSÃO\nAPROVAÇÃO: 19 4 1971\nCOMISSÕES:\nJUSTIÇA\nSEGUNDA DISCUSSÃO\nRELATOR: DEP. JOÃO NAVARRO\nPUBLICAÇÃO: 7 5 1971\nARQUIVADO, FINAL DE LEGISLATURA."")",list(),list(),N,,ARQUIVO,19750131,1113,"DENOMINAÇÃO, ESTABELECIMENTO DE ENSINO, MUNICÍPIO, ITUIUTABA.","PRÓPRIO PÚBLICO
ESTABELECIMENTO DE ENSINO",NULL,NA,NULL,NA,NA,NA,NA
Remissivo,PROJETO DE LEI,PL,78,1971,DEPUTADO AMILCAR PADOVANI                  MDB,"DECLARA DE UTILIDADE PÚBLICA A SOCIEDADE PRÓ-MELHORAMENTOS DO BAIRRO DE
TEIXEIRAS, DE JUIZ DE FORA.",TRANSFORMADO EM NORMA JURÍDICA,TNJUR,PROPOSIÇÕES APROVADAS,MAPRV,1971-04-16,000149477,PL. 78 1971 - PROJETO DE LEI,DELIBERAÇÃO DE PLENÁRIO,LEI 5705 1971 - LEI ORDINÁRIA,20120306,rosanacf,1971-04-14,"list(passo = 1, data = ""1971-04-14"", local = ""PLENÁRIO"", historico = ""HISTÓRICO DA TRAMITAÇÃO\nPLENÁRIO:\nDISCUSSÃO ÚNICA\nAPROVAÇÃO: 21 5 1971\nREDAÇÃO FINAL\nAPROVAÇÃO: 26 5 1971\nCOMISSÕES:\nJUSTIÇA\nDISCUSSÃO ÚNICA\nRELATOR: DEP. PINHEIRO CHAGAS\nPUBLICAÇÃO: 13 5 1971\nREDAÇÃO\nREDAÇÃO FINAL\nRELATOR: DEP. JOÃO PEDRO GUSTIN\nPUBLICAÇÃO: 28 5 1971\nSANCIONADO\nPUBLICAÇÃO DA LEI: 9 6 1971."")",list(),list(),N,1189,NA,NA,1505,"UTILIDADE PÚBLICA, ENTIDADE, MUNICÍPIO, JUIZ DE FORA.",UTILIDADE PÚBLICA,"list(id = 1189, nome = ""DEPUTADO AMILCAR PADOVANI"", partido = ""MDB"")",NA,NULL,NA,/legislacao/mineira/LEI/5705/1971,LEI 5705 1971 - LEI ORDINÁRIA,NA
Remissivo,PROJETO DE LEI,PL,77,1971,DEPUTADO CARLOS ELOY                       ARENA,"DECLARA DE UTILIDADE PÚBLICA A ASSOCIAÇÃO ""DONA MARILENE PINTO DE
MATTOS"", COM SEDE NA CIDADE DE CONTAGEM.",TRANSFORMADO EM NORMA JURÍDICA,TNJUR,PROPOSIÇÕES APROVADAS,MAPRV,1971-04-16,000149478,PL. 77 1971 - PROJETO DE LEI,DELIBERAÇÃO DE PLENÁRIO,LEI 5709 1971 - LEI ORDINÁRIA,20120306,rosanacf,1971-04-14,"list(passo = 1, data = ""1971-04-14"", local = ""PLENÁRIO"", historico = ""HISTÓRICO DA TRAMITAÇÃO\nPLENÁRIO:\nDISCUSSÃO ÚNICA\nAPROVAÇÃO: 19 5 1971\nREDAÇÃO FINAL\nAPROVAÇÃO: 26 5 1971\nCOMISSÕES:\nJUSTIÇA\nDISCUSSÃO ÚNICA\nRELATOR: DEP. PINHEIRO CHAGAS\nPUBLICAÇÃO: 13 5 1971\nREDAÇÃO\nREDAÇÃO FINAL\nRELATOR: DEP. NARCÉLIO MENDES\nPUBLICAÇÃO: 26 5 1971\nSANCIONADO\nPUBLICAÇÃO DA LEI: 9 6 1971."")",list(),list(),N,708,NA,NA,1452,"UTILIDADE PÚBLICA, ENTIDADE, MUNICÍPIO, CONTAGEM.",UTILIDADE PÚBLICA,"list(id = 708, nome = ""DEPUTADO CARLOS ELOY"", partido = ""ARENA"")",NA,NULL,NA,/legislacao/mineira/LEI/5709/1971,LEI 5709 1971 - LEI ORDINÁRIA,NA
Remissivo,PROJETO DE LEI,PL,76,1971,GOVERNADOR DO ESTADO,"ALTERA A LEGISLAÇÃO TRIBUTÁRIA DO ESTADO E DÁ OUTRAS
PROVIDÊNCIAS.",RETIRADO DE TRAMITAÇÃO,RETRA,OUTRAS SITUAÇÕES,MOUTR,1971-04-16,000149479,PL. 76 1971 - PROJETO DE LEI,DELIBERAÇÃO DE PLENÁRIO,NA,19980101,Carga,1971-04-14,"list(passo = 1, data = ""1971-04-14"", local = ""PLENÁRIO"", historico = ""RETIRADO DE TRAMITAÇÃO EM VIRTUDE DE REQUERIMENTO DO GOVERNADOR\n(OFÍCIO 19, DE 21 4 1971)."")",list(),list(),N,NA,NA,NA,NA,NA,NA,NULL,NA,"list(descricao = ""PL. 1687 1970"")",NA,NA,NA,NA
Remissivo,PROJETO DE LEI,PL,75,1971,DEPUTADO FÁBIO VASCONCELLOS                ARENA,"DECLARA DE UTILIDADE PÚBLICA A FUNDAÇÃO PIO PENA, DE PONTE NOVA.",TRANSFORMADO EM NORMA JURÍDICA,TNJUR,PROPOSIÇÕES APROVADAS,MAPRV,1971-04-16,000149480,PL. 75 1971 - PROJETO DE LEI,DELIBERAÇÃO DE PLENÁRIO,LEI 5706 1971 - LEI ORDINÁRIA,20120306,rosanacf,1971-04-14,"list(passo = 1, data = ""1971-04-14"", local = ""PLENÁRIO"", historico = ""HISTÓRICO DA TRAMITAÇÃO\nPLENÁRIO:\nDISCUSSÃO ÚNICA\nAPROVAÇÃO: 18 5 1971\nREDAÇÃO FINAL\nAPROVAÇÃO: 21 5 1971\nCOMISSÕES:\nJUSTIÇA\nDISCUSSÃO ÚNICA\nRELATOR: DEP. MARCOS TITO\nPUBLICAÇÃO: 13 5 1971\nREDAÇÃO\nREDAÇÃO FINAL\nRELATOR: DEP. VALDIR MELGAÇO\nPUBLICAÇÃO: NÃO CONSTA\nSANCIONADO\nPUBLICAÇÃO DA LEI: 9 6 1971."")",list(),list(),N,1197,NA,NA,1412,"UTILIDADE PÚBLICA, ENTIDADE, MUNICÍPIO, PONTE NOVA.",UTILIDADE PÚBLICA,"list(id = 1197, nome = ""DEPUTADO FÁBIO VASCONCELLOS"", partido = ""ARENA"")",NA,NULL,NA,/legislacao/mineira/LEI/5706/1971,LEI 5706 1971 - LEI ORDINÁRIA,NA
Remissivo,PROJETO DE LEI,PL,74,1971,GOVERNADOR DO ESTADO,"ALTERA A REDAÇÃO DO ""CAPUT"" DO ART. 68 DA LEI 1195, DE 23 DE DEZEMBRO DE
1954. (ALTERA DISPOSITIVOS SOBRE NOMEAÇÃO DE PRESIDENTE DO INSTITUTO DE
PREVIDÊNCIA DOS SERVIDORES DO ESTADO DE MINAS GERAIS - IPSEMG).",TRANSFORMADO EM NORMA JURÍDICA,TNJUR,PROPOSIÇÕES APROVADAS,MAPRV,1971-04-14,000149481,PL. 74 1971 - PROJETO DE LEI,DELIBERAÇÃO DE PLENÁRIO,LEI 5658 1971 - LEI ORDINÁRIA,20131022,rosanacf,1971-04-12,"list(passo = 1, data = ""1971-04-12"", local = ""PLENÁRIO"", historico = ""HISTÓRICO DA TRAMITAÇÃO\nPLENÁRIO:\nDISCUSSÃO ÚNICA\nAPROVAÇÃO: 23 4 1971\nREDAÇÃO FINAL\nAPROVAÇÃO: 23 4 1971\nCOMISSÕES:\nJUSTIÇA, SERVIÇO PÚBLICO E FINANÇAS (REUNIÃO CONJUNTA)\nDISCUSSÃO ÚNICA\nRELATOR: DEP. JOÃO NAVARRO\nPUBLICAÇÃO: 23 4 1971 E 24 4 1971\nREDAÇÃO\nREDAÇÃO FINAL\nRELATOR: DEP. VICENTE GUABIROBA\nPUBLICAÇÃO: 27 4 1971\nSANCIONADO\nPUBLICAÇÃO DA LEI: 27 4 1971"")",list(),list(),N,,NA,NA,1339,NA,INSTITUTO DE PREVIDÊNCIA DOS SERVIDORES DO ESTADO DE MINAS GERAIS (IPSEMG),NULL,ADMINISTRAÇÃO PÚBLICA,NULL,LEI 1195 1954 - LEI ORDINÁRIA,/legislacao/mineira/LEI/5658/1971,LEI 5658 1971 - LEI ORDINÁRIA,NA
Remissivo,PROJETO DE LEI,PL,73,1971,DEPUTADO LEÃO BORGES                       ARENA,"DÁ A DENOMINAÇÃO DE ""HORIZONTA LEMOS"" ÀS ESCOLAS COMBINADAS, ANEXAS À
DELEGACIA DE ENSINO, DE UBERABA.",TRANSFORMADO EM NORMA JURÍDICA,TNJUR,PROPOSIÇÕES APROVADAS,MAPRV,1971-04-14,000149482,PL. 73 1971 - PROJETO DE LEI,NA,LEI 5698 1971 - LEI ORDINÁRIA,20120412,rosanacf,1971-04-12,"list(passo = 1, data = ""1971-04-12"", local = ""PLENÁRIO"", historico = ""HISTÓRICO DA TRAMITAÇÃO\nPLENÁRIO:\nPRIMEIRA DISCUSSÃO\nAPROVAÇÃO: 16 4 1971\nSEGUNDA DISCUSSÃO\nAPROVAÇÃO: 26 4 1971\nTERCEIRA DISCUSSÃO\nAPROVAÇÃO: 12 5 1971\nREDAÇÃO FINAL\nAPROVAÇÃO: 21 5 1971\nCOMISSÕES:\nJUSTIÇA\nSEGUNDA DISCUSSÃO\nRELATOR: DEP. JOÃO NAVARRO\nPUBLICAÇÃO: 23 4 1971\nJUSTIÇA\nTERCEIRA DISCUSSÃO\nRELATOR: DEP. MARCOS TITO\nPUBLICAÇÃO: 8 5 1971\nREDAÇÃO\nREDAÇÃO FINAL\nRELATOR: DEP. JOÃO PEDRO GUSTIN\nPUBLICAÇÃO: 20 5 1971\nSANCIONADO\nPUBLICAÇÃO DA LEI: 4 6 1971."")",list(),list(),N,713,NA,NA,1112,"DENOMINAÇÃO, ESTABELECIMENTO DE ENSINO, MUNICÍPIO, UBERABA.","PRÓPRIO PÚBLICO
ESTABELECIMENTO DE ENSINO","list(id = 713, nome = ""DEPUTADO LEÃO BORGES"", partido = ""ARENA"")",NA,NULL,NA,/legislacao/mineira/LEI/5698/1971,LEI 5698 1971 - LEI ORDINÁRIA,NA
