dominio,tipoProjeto,siglaTipoProjeto,numero,ano,autor,ementa,situacao,siglaSituacao,situacaoGeral,siglaSituacaoGeral,dataPublicacao,numeroDoc,proposicao,regime,norma,atualizacao,usuario,dataUltimaAcao,listaHistoricoTramitacoes,links,linksProposicoesAnexadas,acompanhamento,matricula,local,arquivamento,horario,indexacao,assuntoGeral,autoresEstruturados,tema,linksOrigem,legislacaoCitada,linkLegislacao.url,linkLegislacao.rotulo,proposicaoLei.descricao
Remissivo,PROJETO DE LEI,PL,282,1971,GOVERNADOR DO ESTADO,"CRIA 2 CARGOS DE PROMOTOR DE JUSTIÇA, DE TERCEIRA (CONTAGEM) E
DE PRIMEIRA (ITURAMA) ENTRÂNCIAS, RESPECTIVAMENTE, E AUTORIZA
ABERTURA DE CRÉDITO ESPECIAL PARA O FIM QUE MENCIONA.",TRANSFORMADO EM NORMA JURÍDICA,TNJUR,PROPOSIÇÕES APROVADAS,MAPRV,1971-10-15,000149275,PL. 282 1971 - PROJETO DE LEI,DELIBERAÇÃO DE PLENÁRIO,LEI 5823 1971 - LEI ORDINÁRIA,20101209,m17461,1971-10-13,"list(passo = 1, data = ""1971-10-13"", local = ""PLENÁRIO"", historico = ""HISTÓRICO DA TRAMITAÇÃO\nPLENÁRIO:\nDISCUSSÃO ÚNICA\nAPROVAÇÃO: 5 11 1971\nREDAÇÃO FINAL\nAPROVAÇÃO: 10 11 1971\nCOMISSÕES:\nJUSTIÇA\nDISCUSSÃO ÚNICA\nRELATOR: DEP. RUY DA COSTA VAL\nPUBLICAÇÃO: 27 10 1971\nFINANÇAS\nDISCUSSÃO ÚNICA\nRELATOR: DEP. LÚCIO DE SOUZA CRUZ\nPUBLICAÇÃO: 27 10 1971\nREDAÇÃO\nREDAÇÃO FINAL\nRELATOR: DEP. VALDIR MELGAÇO\nPUBLICAÇÃO: 11 11 1971\nSANCIONADO\nPUBLICAÇÃO DA LEI: 23 11 1971"")",list(),list(),N,,NA,NA,1826,"ABERTURA, CRÉDITO ESPECIAL, MINISTÉRIO PÚBLICO ESTADUAL (MPMG).
CRIAÇÃO, CARGO, PROMOTOR DE JUSTIÇA, MUNICÍPIO, CONTAGEM.","CRÉDITO
MINISTÉRIO PÚBLICO DO ESTADO DE MINAS GERAIS (MPMG)
PESSOAL",NULL,NA,"list(descricao = ""MSG 75 1971"")",NA,/legislacao/mineira/LEI/5823/1971,LEI 5823 1971 - LEI ORDINÁRIA,NA
Remissivo,PROJETO DE LEI,PL,281,1971,GOVERNADOR DO ESTADO,"AUTORIZA A ABERTURA AO PODER JUDICIÁRIO DO CRÉDITO ESPECIAL DE
186.685,74, PARA PAGAMENTO DE VENCIMENTOS A JUÍZES, SERVENTUÁRIOS
E AUXILIARES DA JUSTIÇA DAS COMARCAS DE CONTAGEM, ITURAMA E
AQUISIÇÃO DE MÓVEIS, MÁQUINAS E UTENSÍLIOS PARA OS RESPECTIVOS
FÓRUNS.",TRANSFORMADO EM NORMA JURÍDICA,TNJUR,PROPOSIÇÕES APROVADAS,MAPRV,1971-10-15,000149276,PL. 281 1971 - PROJETO DE LEI,DELIBERAÇÃO DE PLENÁRIO,LEI 5822 1971 - LEI ORDINÁRIA,20101209,m17461,1971-10-13,"list(passo = 1, data = ""1971-10-13"", local = ""PLENÁRIO"", historico = ""HISTÓRICO DA TRAMITAÇÃO\nPLENÁRIO:\nDISCUSSÃO ÚNICA\nAPROVAÇÃO: 5 11 1971\nREDAÇÃO FINAL\nAPROVAÇÃO: 10 11 1971\nCOMISSÕES:\nJUSTIÇA\nDISCUSSÃO ÚNICA\nRELATOR: DEP. NARCÉLIO MENDES\nPUBLICAÇÃO: 27 10 1971\nFINANÇAS\nDISCUSSÃO ÚNICA\nRELATOR: DEP. MARTINS SILVEIRA\nPUBLICAÇÃO: 27 10 1971\nREDAÇÃO\nREDAÇÃO FINAL\nRELATOR: DEP. NARCÉLIO MENDES\nPUBLICAÇÃO: 11 11 1971\nSANCIONADO\nPUBLICAÇÃO DA LEI: 23 11 1971"")",list(),list(),N,,NA,NA,1626,"ABERTURA, CRÉDITO ESPECIAL, JUDICIÁRIO.",CRÉDITO,NULL,NA,"list(descricao = ""MSG 74 1971"")",NA,/legislacao/mineira/LEI/5822/1971,LEI 5822 1971 - LEI ORDINÁRIA,NA
Remissivo,PROJETO DE LEI,PL,280,1971,DEPUTADO GERARDO RENAULT                   ARENA,"DECLARA DE UTILIDADE PÚBLICA A FUNDAÇÃO EDUCACIONAL MUZAMBINHO,
COM SEDE EM MUZAMBINHO.",ARQUIVADO,ARQVD,OUTRAS SITUAÇÕES,MOUTR,1971-10-12,000149277,PL. 280 1971 - PROJETO DE LEI,NA,NA,20120229,rosanacf,1971-10-08,"list(passo = 1, data = ""1971-10-08"", local = ""PLENÁRIO"", historico = ""ARQUIVADO, FINAL DE LEGISLATURA."")",list(),list(),N,1176,ARQUIVO,19750131,1604,"UTILIDADE PÚBLICA, ENTIDADE, MUNICÍPIO, MUZAMBINHO.",UTILIDADE PÚBLICA,"list(id = 1176, nome = ""DEPUTADO GERARDO RENAULT"", partido = ""ARENA"")",NA,NULL,NA,NA,NA,NA
Remissivo,PROJETO DE LEI,PL,279,1971,GOVERNADOR DO ESTADO,"AUTORIZA A DOAÇÃO DE ÁREA DE TERRAS DEVOLUTAS AO INSTITUTO DOS
MISSIONÁRIOS SACRAMENTINOS DE NOSSA SENHORA DE MANHUMIRIM.",TRANSFORMADO EM NORMA JURÍDICA,TNJUR,PROPOSIÇÕES APROVADAS,MAPRV,1971-10-12,000149278,PL. 279 1971 - PROJETO DE LEI,DELIBERAÇÃO DE PLENÁRIO,LEI 5825 1971 - LEI ORDINÁRIA,19980101,Carga,1971-10-08,"list(passo = 1, data = ""1971-10-08"", local = ""PLENÁRIO"", historico = ""HISTÓRICO DA TRAMITAÇÃO\nPLENÁRIO:\nDISCUSSÃO ÚNICA\nAPROVAÇÃO: 5 11 1971\nREDAÇÃO FINAL\nAPROVAÇÃO: 10 11 1971\nCOMISSÕES:\nJUSTIÇA, EDUCAÇÃO E FINANÇAS (REUNIÃO CONJUNTA)\nDISCUSSÃO ÚNICA\nRELATOR: DEP. MARTINS SILVEIRA\nPUBLICAÇÃO: 29 10 1971\nREDAÇÃO\nREDAÇÃO FINAL\nRELATOR: DEP. NARCÉLIO MENDES\nPUBLICAÇÃO: 11 11 1971\nSANCIONADO\nPUBLICAÇÃO DA LEI: 23 11 1971"")",list(),list(),N,NA,NA,NA,NA,NA,NA,NULL,NA,"list(descricao = ""MSG 72 1971"")",NA,/legislacao/mineira/LEI/5825/1971,LEI 5825 1971 - LEI ORDINÁRIA,NA
Remissivo,PROJETO DE LEI,PL,278,1971,DEPUTADO AMILCAR PADOVANI                  MDB,"DECLARA DE UTILIDADE PÚBLICA O ""GRUPO ESPÍRITA AMOR AOS DESENCARNADOS"",
COM SEDE EM JUIZ DE FORA.",TRANSFORMADO EM NORMA JURÍDICA,TNJUR,PROPOSIÇÕES APROVADAS,MAPRV,1971-10-09,000149279,PL. 278 1971 - PROJETO DE LEI,DELIBERAÇÃO DE PLENÁRIO,LEI 5817 1971 - LEI ORDINÁRIA,20120229,rosanacf,1971-10-07,"list(passo = 1, data = ""1971-10-07"", local = ""PLENÁRIO"", historico = ""HISTÓRICO DA TRAMITAÇÃO\nPLENÁRIO:\nDISCUSSÃO ÚNICA\nAPROVAÇÃO: 21 10 1971\nREDAÇÃO FINAL\nAPROVAÇÃO: 27 10 1971\nCOMISSÕES:\nJUSTIÇA\nDISCUSSÃO ÚNICA\nRELATOR: DEP. PINHEIRO CHAGAS\nPUBLICAÇÃO: 16 10 1971\nREDAÇÃO\nREDAÇÃO FINAL\nRELATOR: DEP. VALDIR MELGAÇO\nPUBLICAÇÃO: 27 10 1971\nSANCIONADO\nPUBLICAÇÃO DA LEI: 17 11 1971"")",list(),list(),N,1189,NA,NA,1603,"UTILIDADE PÚBLICA, ENTIDADE, MUNICÍPIO, JUIZ DE FORA.",UTILIDADE PÚBLICA,"list(id = 1189, nome = ""DEPUTADO AMILCAR PADOVANI"", partido = ""MDB"")",NA,NULL,NA,/legislacao/mineira/LEI/5817/1971,LEI 5817 1971 - LEI ORDINÁRIA,NA
Remissivo,PROJETO DE LEI,PL,277,1971,DEPUTADO DALTON CANABRAVA                  MDB,"DECLARA DE UTILIDADE PÚBLICA O CENTRO ESPÍRITA JESUS MARIA JOSÉ,
COM SEDE EM CURVELO.",TRANSFORMADO EM NORMA JURÍDICA,TNJUR,PROPOSIÇÕES APROVADAS,MAPRV,1971-10-09,000149280,PL. 277 1971 - PROJETO DE LEI,DELIBERAÇÃO DE PLENÁRIO,LEI 5818 1971 - LEI ORDINÁRIA,20120229,rosanacf,1971-10-07,"list(passo = 1, data = ""1971-10-07"", local = ""PLENÁRIO"", historico = ""HISTÓRICO DA TRAMITAÇÃO\nPLENÁRIO:\nDISCUSSÃO ÚNICA\nAPROVAÇÃO: 20 10 1971\nREDAÇÃO FINAL\nAPROVAÇÃO: 27 10 1971\nCOMISSÕES:\nJUSTIÇA\nDISCUSSÃO ÚNICA\nRELATOR: DEP. NARCÉLIO MENDES\nPUBLICAÇÃO: 16 10 1971\nREDAÇÃO\nREDAÇÃO FINAL\nRELATOR: DEP. VALDIR MELGAÇO\nPUBLICAÇÃO: 27 10 1971\nSANCIONADO\nPUBLICAÇÃO DA LEI: 17 11 1971"")",list(),list(),N,791,NA,NA,1602,"UTILIDADE PÚBLICA, ENTIDADE, MUNICÍPIO, CURVELO.",UTILIDADE PÚBLICA,"list(id = 791, nome = ""DEPUTADO DALTON CANABRAVA"", partido = ""MDB"")",NA,NULL,NA,/legislacao/mineira/LEI/5818/1971,LEI 5818 1971 - LEI ORDINÁRIA,NA
Remissivo,PROJETO DE LEI,PL,276,1971,DEPUTADO JOÃO NAVARRO                      ARENA,INSTITUI A SEMANA DAS FANFARRAS E DAS BANDAS.,ARQUIVADO,ARQVD,OUTRAS SITUAÇÕES,MOUTR,1971-10-08,000149282,PL. 276 1971 - PROJETO DE LEI,NA,NA,20100203,moreka,1971-10-06,"list(passo = 1, data = ""1971-10-06"", local = ""PLENÁRIO"", historico = ""HISTÓRICO DA TRAMITAÇÃO\nPLENÁRIO:\nPRIMEIRA DISCUSSÃO\nAPROVAÇÃO: 18 10 1971\nSEGUNDA DISCUSSÃO\nAPROVAÇÃO: 29 11 1971\nTERCEIRA DISCUSSÃO\nAPROVAÇÃO: 20 3 1972\nCOMISSÕES:\nJUSTIÇA\nSEGUNDA DISCUSSÃO\nRELATOR: DEP. RUY DA COSTA VAL\nPUBLICAÇÃO: 9 11 1971\nEDUCAÇÃO\nSEGUNDA DISCUSSÃO\nRELATOR: DEP. PINHEIRO CHAGAS\nPUBLICAÇÃO: 9 11 1971\nFINANÇAS\nSEGUNDA DISCUSSÃO\nRELATOR: DEP. LÚCIO DE SOUZA CRUZ\nPUBLICAÇÃO: 9 11 1971\nFINANÇAS\nTERCEIRA DISCUSSÃO\nRELATOR: DEP. NELSON LOMBARDI\nPUBLICAÇÃO: 30 11 1971\nARQUIVADO, FINAL DE LEGISLATURA"")",list(),list(),N,311,ARQUIVO,19750131,1042,NA,NA,"list(id = 311, nome = ""DEPUTADO JOÃO NAVARRO"", partido = ""ARENA"")",NA,NULL,NA,NA,NA,NA
Remissivo,PROJETO DE LEI,PL,273,1971,DEPUTADO LUIZ BACCARINI                    MDB,"DECLARA DE UTILIDADE PÚBLICA O CLUBE ATLÉTICO YPIRANGA, COM SEDE NO
MUNICÍPIO DE MERCÊS.",TRANSFORMADO EM NORMA JURÍDICA,TNJUR,PROPOSIÇÕES APROVADAS,MAPRV,1971-10-05,000149284,PL. 273 1971 - PROJETO DE LEI,DELIBERAÇÃO DE PLENÁRIO,LEI 5848 1971 - LEI ORDINÁRIA,20120229,rosanacf,1971-10-01,"list(passo = 1, data = ""1971-10-01"", local = ""PLENÁRIO"", historico = ""HISTÓRICO DA TRAMITAÇÃO\nPLENÁRIO:\nDISCUSSÃO ÚNICA\nAPROVAÇÃO: 29 11 1971\nREDAÇÃO FINAL\nAPROVAÇÃO: 30 11 1971\nCOMISSÕES:\nJUSTIÇA\nDISCUSSÃO ÚNICA\nRELATOR: DEP. NARCÉLIO MENDES\nPUBLICAÇÃO: 27 11 1971\nREDAÇÃO\nREDAÇÃO FINAL\nRELATOR: DEP. JOÃO PEDRO GUSTIN\nPUBLICAÇÃO: 1 12 1971\nSANCIONADO\nPUBLICAÇÃO DA LEI: 14 12 1971"")",list(),list(),N,972,NA,NA,1559,"UTILIDADE PÚBLICA, ENTIDADE, MUNICÍPIO, MERCÊS.",UTILIDADE PÚBLICA,"list(id = 972, nome = ""DEPUTADO LUIZ BACCARINI"", partido = ""MDB"")",NA,NULL,NA,/legislacao/mineira/LEI/5848/1971,LEI 5848 1971 - LEI ORDINÁRIA,NA
Remissivo,PROJETO DE LEI,PL,272,1971,GOVERNADOR DO ESTADO,"CRIA, NA SECRETARIA DE ESTADO DA FAZENDA, O INSTITUTO DE TÉCNICA
TRIBUTÁRIA, E DÁ OUTRAS PROVIDÊNCIAS.",TRANSFORMADO EM NORMA JURÍDICA,TNJUR,PROPOSIÇÕES APROVADAS,MAPRV,1971-10-01,000149286,PL. 272 1971 - PROJETO DE LEI,DELIBERAÇÃO DE PLENÁRIO,LEI 5820 1971 - LEI ORDINÁRIA,20140218,sheyla,1971-10-01,"list(passo = 1, data = ""1971-10-01"", local = ""PLENÁRIO"", historico = ""HISTÓRICO DA TRAMITAÇÃO\nPLENÁRIO:\nDISCUSSÃO ÚNICA\nAPROVAÇÃO: 19 10 1971\nREDAÇÃO FINAL\nAPROVAÇÃO: 3 11 1971\nCOMISSÕES:\nJUSTIÇA\nDISCUSSÃO ÚNICA\nRELATOR: DEP. NARCÉLIO MENDES\nPUBLICAÇÃO: NÃO CONSTA\nFINANÇAS\nDISCUSSÃO ÚNICA\nRELATOR: DEP. CHRISTOVAM CHIARADIA\nPUBLICAÇÃO: 15 10 1971\nREDAÇÃO\nREDAÇÃO FINAL\nRELATOR: DEP. NARCÉLIO MENDES\nPUBLICAÇÃO: 29 10 1971\nMANTIDO O VETO, EM 6 4 1972."")",list(),list(),N,,NA,NA,1542,NA,"SECRETARIA DE ESTADO
FINANÇAS PÚBLICAS
ORGANIZAÇÃO ADMINISTRATIVA",NULL,"ADMINISTRAÇÃO PÚBLICA
FINANÇAS PÚBLICAS","list(descricao = ""MSG 69 1971"")",NA,/legislacao/mineira/LEI/5820/1971,LEI 5820 1971 - LEI ORDINÁRIA,NA
Remissivo,PROJETO DE LEI,PL,271,1971,DEPUTADO JOÃO NAVARRO                      ARENA,"OFICIALIZA A FESTA DAS ROSAS, DE BARBACENA.",ARQUIVADO,ARQVD,OUTRAS SITUAÇÕES,MOUTR,1971-09-30,000149288,PL. 271 1971 - PROJETO DE LEI,NA,NA,20100202,moreka,1971-09-30,"list(passo = 1, data = ""1971-09-30"", local = ""PLENÁRIO"", historico = ""HISTÓRICO DA TRAMITAÇÃO\nPLENÁRIO:\nPRIMEIRA DISCUSSÃO\nAPROVAÇÃO: 13 10 1971\nARQUIVADO, FINAL DE LEGISLATURA."")",list(),list(),N,311,ARQUIVO,19750131,1205,NA,NA,"list(id = 311, nome = ""DEPUTADO JOÃO NAVARRO"", partido = ""ARENA"")",NA,NULL,NA,NA,NA,NA
Remissivo,PROJETO DE LEI,PL,270,1971,DEPUTADO FERNANDO JUNQUEIRA                PDS,"AUTORIZA O PODER EXECUTIVO A DOAR UMA ÁREA DE TERRENO AO
""MOVIMENTO AÇÃO SOCIAL - MAS, DO MUNICÍPIO DE LEOPOLDINA.",ARQUIVADO,ARQVD,OUTRAS SITUAÇÕES,MOUTR,1971-10-02,000149285,PL. 270 1971 - PROJETO DE LEI,NA,NA,20100202,moreka,1971-09-30,"list(passo = 1, data = ""1971-09-30"", local = ""PLENÁRIO"", historico = ""HISTÓRICO DA TRAMITAÇÃO\nPLENÁRIO:\nPRIMEIRA DISCUSSÃO\nAPROVAÇÃO: 7 10 1971\nSEGUNDA DISCUSSÃO\nAPROVAÇÃO: 29 11 1971\nTERCEIRA DISCUSSÃO\nAPROVAÇÃO: 17 3 1972\nJUSTIÇA\nSEGUNDA DISCUSSÃO\nRELATOR: DEP. MARCOS TITO\nPUBLICAÇÃO: 23 11 1971\nTRABALHO\nSEGUNDA DISCUSSÃO\nRELATOR: DEP. GERALDO QUINTÃO\nPUBLICAÇÃO: 23 11 1971\nFINANÇAS\nSEGUNDA DISCUSSÃO\nRELATOR: DEP. MARTINS SILVEIRA\nPUBLICAÇÃO: 23 11 1971\nFINANÇAS\nTERCEIRA DISCUSSÃO\nRELATOR: DEP. NELSON LOMBARDI\nPUBLICAÇÃO: 30 11 1971\nARQUIVADO, FINAL DE LEGISLATURA."")",list(),list(),N,1468,ARQUIVO,19750131,1204,NA,NA,"list(id = 1468, nome = ""DEPUTADO FERNANDO JUNQUEIRA"", partido = ""PDS"")",NA,NULL,NA,NA,NA,NA
Remissivo,PROJETO DE LEI,PL,268,1971,DEPUTADO JOÃO NAVARRO                      ARENA,INSTITUI A MEDALHA DO MÉRITO DA INTEGRAÇÃO NACIONAL.,ARQUIVADO,ARQVD,OUTRAS SITUAÇÕES,MOUTR,1971-09-30,000149289,PL. 268 1971 - PROJETO DE LEI,NA,NA,20150514,m17461,1971-09-28,"list(passo = 1, data = ""1971-09-28"", local = ""PLENÁRIO"", historico = ""HISTÓRICO DA TRAMITAÇÃO\nPLENÁRIO:\nPRIMEIRA DISCUSSÃO\nAPROVAÇÃO: 7 10 1971\nARQUIVADO, FINAL DE LEGISLATURA."")",list(),list(),N,311,ARQUIVO,19750131,1516,"CRIAÇÃO, MEDALHA.",HOMENAGEM,"list(id = 311, nome = ""DEPUTADO JOÃO NAVARRO"", partido = ""ARENA"")",ADMINISTRAÇÃO PÚBLICA,NULL,NA,NA,NA,NA
Remissivo,PROJETO DE LEI,PL,267,1971,GOVERNADOR DO ESTADO,"CONCEDE PENSÃO MENSAL À VIÚVA DO VICE-GOVERNADOR JOSÉ RIBEIRO
PENA.",TRANSFORMADO EM NORMA JURÍDICA,TNJUR,PROPOSIÇÕES APROVADAS,MAPRV,1971-09-30,000149290,PL. 267 1971 - PROJETO DE LEI,DELIBERAÇÃO DE PLENÁRIO,LEI 5802 1971 - LEI ORDINÁRIA,19980101,Carga,1971-09-28,"list(passo = 1, data = ""1971-09-28"", local = ""PLENÁRIO"", historico = ""HISTÓRICO DA TRAMITAÇÃO\nPLENÁRIO:\nDISCUSSÃO ÚNICA\nAPROVAÇÃO: 14 10 1971\nREDAÇÃO FINAL\nAPROVAÇÃO: 19 10 1971\nCOMISSÕES:\nJUSTIÇA\nDISCUSSÃO ÚNICA\nRELATOR: DEP. JOÃO NAVARRO\nPUBLICAÇÃO: 13 10 1971\nFINANÇAS\nDISCUSSÃO ÚNICA\nRELATOR: DEP. GOMES MOREIRA\nPUBLICAÇÃO: 13 10 1971\nREDAÇÃO\nREDAÇÃO FINAL\nRELATOR: DEP. JOÃO PEDRO GUSTIN\nPUBLICAÇÃO: 29 10 1971"")",list(),list(),N,NA,NA,NA,NA,NA,NA,NULL,NA,"list(descricao = ""MSG 66 1971"")",NA,/legislacao/mineira/LEI/5802/1971,LEI 5802 1971 - LEI ORDINÁRIA,NA
Remissivo,PROJETO DE LEI,PL,266,1971,DEPUTADO SYLO COSTA                        ARENA,"DECLARA DE UTILIDADE PÚBLICA A AÇÃO SOCIAL SANTO ANTÔNIO, DA CIDADE DE
ARAÇUAÍ.",TRANSFORMADO EM NORMA JURÍDICA,TNJUR,PROPOSIÇÕES APROVADAS,MAPRV,1971-09-29,000149291,PL. 266 1971 - PROJETO DE LEI,DELIBERAÇÃO DE PLENÁRIO,LEI 5815 1971 - LEI ORDINÁRIA,20120229,rosanacf,1971-09-27,"list(passo = 1, data = ""1971-09-27"", local = ""PLENÁRIO"", historico = ""HISTÓRICO DA TRAMITAÇÃO\nPLENÁRIO:\nDISCUSSÃO ÚNICA\nAPROVAÇÃO: 19 10 1971\nREDAÇÃO FINAL\nAPROVAÇÃO: 25 10 1971\nCOMISSÕES:\nJUSTIÇA\nDISCUSSÃO ÚNICA\nRELATOR: DEP. TARCISIO DELGADO\nPUBLICAÇÃO: 9 10 1971\nREDAÇÃO\nREDAÇÃO FINAL\nRELATOR: DEP. VALDIR MELGAÇO\nPUBLICAÇÃO: 23 10 1971\nSANCIONADO\nPUBLICAÇÃO DA LEI: 17 11 1971"")",list(),list(),N,978,NA,NA,1558,"UTILIDADE PÚBLICA, ENTIDADE, MUNICÍPIO, ARAÇUAÍ.",UTILIDADE PÚBLICA,"list(id = 978, nome = ""DEPUTADO SYLO COSTA"", partido = ""ARENA"")",NA,NULL,NA,/legislacao/mineira/LEI/5815/1971,LEI 5815 1971 - LEI ORDINÁRIA,NA
Remissivo,PROJETO DE LEI,PL,265,1971,DEPUTADO JÉSUS TRINDADE                    ARENA,"ALTERA DISPOSIÇÕES DA LEI 5406, DE 16 12 1969, QUE CONTÉM A
- LEI ORGÂNICA DA POLÍCIA CIVIL.
(AUTORIZA REDUÇÃO NA DURAÇÃO DO CURSO DE ASPIRANTE DA POLÍCIA
CIVIL).",TRANSFORMADO EM NORMA JURÍDICA,TNJUR,PROPOSIÇÕES APROVADAS,MAPRV,1971-09-29,000149292,PL. 265 1971 - PROJETO DE LEI,DELIBERAÇÃO DE PLENÁRIO,LEI 5853 1971 - LEI ORDINÁRIA,20131021,rosanacf,1971-09-27,"list(passo = 1, data = ""1971-09-27"", local = ""PLENÁRIO"", historico = ""HISTÓRICO DA TRAMITAÇÃO\nPLENÁRIO:\nPRIMEIRA DISCUSSÃO\nAPROVAÇÃO: 30 9 1971\nEMENDAS PUBLICADAS NO DL EM 10 11 1971\nSEGUNDA DISCUSSÃO\nAPROVAÇÃO: 12 11 1971, COM EMENDAS\nTERCEIRA DISCUSSÃO\nAPROVAÇÃO: 23 11 1971\nREDAÇÃO FINAL\nAPROVAÇÃO: 28 11 1971\nCOMISSÕES:\nJUSTIÇA\nSEGUNDA DISCUSSÃO\nRELATOR: DEP. FERNANDO JUNQUEIRA\nPUBLICAÇÃO: 5 11 1971\nSEGURANÇA\nSEGUNDA DISCUSSÃO\nRELATOR: DEP. JOÃO BELLO\nPUBLICAÇÃO: 5 11 1971\nSEGURANÇA\nSEGUNDA DISCUSSÃO\nPARECER SOBRE EMENDAS\nRELATOR: DEP. JOÃO BELLO\nPUBLICAÇÃO: 11 11 1971\nSEGURANÇA\nTERCEIRA DISCUSSÃO\nRELATOR: DEP. JOÃO BELLO\nPUBLICAÇÃO: 19 11 1971\nREDAÇÃO\nREDAÇÃO FINAL\nRELATOR: DEP. VALDIR MELGAÇO\nPUBLICAÇÃO: 30 11 1971\nSANCIONADO\nPUBLICAÇÃO DA LEI: 17 12 1971"")",list(),list(),N,1048,NA,NA,1747,NA,"POLÍCIA CIVIL DO ESTADO DE MINAS GERAIS (PCMG)
PESSOAL","list(id = 1048, nome = ""DEPUTADO JÉSUS TRINDADE"", partido = ""ARENA"")","ADMINISTRAÇÃO PÚBLICA
SEGURANÇA PÚBLICA",NULL,LEI 5406 1969 - LEI ORDINÁRIA,/legislacao/mineira/LEI/5853/1971,LEI 5853 1971 - LEI ORDINÁRIA,NA
Remissivo,PROJETO DE LEI,PL,264,1971,DEPUTADO MANOEL COSTA                      ARENA,AUTORIZA A PERMUTA DE IMÓVEIS NA CIDADE DE CAXAMBU.,PROJETO VETADO TOTALMENTE,PVETO,PROPOSIÇÕES APROVADAS,MAPRV,1971-09-29,000149293,PL. 264 1971 - PROJETO DE LEI,DELIBERAÇÃO DE PLENÁRIO,NA,19980101,Carga,1971-09-27,"list(passo = 1, data = ""1971-09-27"", local = ""PLENÁRIO"", historico = ""HISTÓRICO DA TRAMITAÇÃO\nPLENÁRIO\nPRIMEIRA DISCUSSÃO\nAPROVAÇÃO: 6 10 1971\nSEGUNDA DISCUSSÃO\nAPROVAÇÃO: 29 11 1971\nTERCEIRA DISCUSSÃO\nAPROVAÇÃO: 5 4 1972\nREDAÇÃO FINAL\nAPROVAÇÃO: 17 4 1972\nCOMISSÕES:\nJUSTIÇA\nSEGUNDA DISCUSSÃO\nRELATOR: DEP. JOÃO NAVARRO\nPUBLICAÇÃO: 26 11 1971\nFINANÇAS\nSEGUNDA DISCUSSÃO\nRELATOR: DEP. JOÃO MARQUES\nPUBLICAÇÃO: 26 11 1971\nFINANÇAS\nTERCEIRA DISCUSSÃO\nRELATOR: DEP. NELSON LOMBARDI\nPUBLICAÇÃO: 30 11 1971\nREDAÇÃO\nREDAÇÃO FINAL\nRELATOR: DEP. NARCÉLIO MENDES\nPUBLICAÇÃO: 14 4 1972\nVETADO TOTALMENTE\nPUBLICAÇÃO DAS RAZÕES DO VETO: 13 5 1972\nVETO MANTIDO, EM 24 5 1972"")",list(),list(),N,326,NA,NA,NA,NA,NA,"list(id = 326, nome = ""DEPUTADO MANOEL COSTA"", partido = ""ARENA"")",NA,NULL,NA,NA,NA,PRL 6418 1972
Remissivo,PROJETO DE LEI,PL,263,1971,DEPUTADO CHRISTOVAM CHIARADIA              ARENA,"DÁ A DENOMINAÇÃO DE SÉRGIO FARIA PACHECO À UNIDADE SANITÁRIA DE SANTA
RITA DE CALDAS.",ARQUIVADO,ARQVD,OUTRAS SITUAÇÕES,MOUTR,1971-09-25,000149294,PL. 263 1971 - PROJETO DE LEI,NA,NA,20120412,rosanacf,1971-09-23,"list(passo = 1, data = ""1971-09-23"", local = ""PLENÁRIO"", historico = ""HISTÓRICO DA TRAMITAÇÃO\nPLENÁRIO\nPRIMEIRA DISCUSSÃO\nAPROVAÇÃO: 28 9 1971\nARQUIVADO, FINAL DE LEGISLATURA."")",list(),list(),N,1177,ARQUIVO,19750131,1155,"DENOMINAÇÃO, UNIDADE SANITÁRIA, MUNICÍPIO, SANTA RITA DE CALDAS.",PRÓPRIO PÚBLICO,"list(id = 1177, nome = ""DEPUTADO CHRISTOVAM CHIARADIA"", partido = ""ARENA"")",NA,NULL,NA,NA,NA,NA
Remissivo,PROJETO DE LEI,PL,262,1971,DEPUTADO BONIFÁCIO DE ANDRADA              ARENA,"DECLARA DE UTILIDADE PÚBLICA O CLUBE DOS OPERÁRIOS, DA CIDADE
DE NEPOMUCENO.",TRANSFORMADO EM NORMA JURÍDICA,TNJUR,PROPOSIÇÕES APROVADAS,MAPRV,1971-09-25,000149295,PL. 262 1971 - PROJETO DE LEI,DELIBERAÇÃO DE PLENÁRIO,LEI 5819 1971 - LEI ORDINÁRIA,20120229,rosanacf,1971-09-23,"list(passo = 1, data = ""1971-09-23"", local = ""PLENÁRIO"", historico = ""HISTÓRICO DA TRAMITAÇÃO\nPLENÁRIO:\nDISCUSSÃO ÚNICA\nAPROVAÇÃO: 18 10 1971\nREDAÇÃO FINAL\nAPROVAÇÃO: 25 10 1971\nCOMISSÕES:\nJUSTIÇA\nDISCUSSÃO ÚNICA\nRELATOR: DEP. PINHEIRO CHAGAS\nPUBLICAÇÃO: 9 10 1971\nREDAÇÃO\nREDAÇÃO FINAL\nRELATOR: DEP. NARCÉLIO MENDES\nPUBLICAÇÃO: 23 10 1971\nSANCIONADO\nPUBLICAÇÃO DA LEI: 17 11 1971"")",list(),list(),N,281,NA,NA,1556,"UTILIDADE PÚBLICA, ENTIDADE, MUNICÍPIO, NEPOMUCENO.",UTILIDADE PÚBLICA,"list(id = 281, nome = ""DEPUTADO BONIFÁCIO DE ANDRADA"", partido = ""ARENA"")",NA,NULL,NA,/legislacao/mineira/LEI/5819/1971,LEI 5819 1971 - LEI ORDINÁRIA,NA
Remissivo,PROJETO DE LEI,PL,261,1971,DEPUTADO MOACIR LOPES                      ARENA,"ALTERA A REDAÇÃO DO ART. 1 DA LEI 3373, DE 12 5 1965, QUE
ESTABELECE NORMAS PELAS QUAIS SÃO AS SOCIEDADES DECLARADAS DE
UTILIDADE PÚBLICA (ALTERA REQUISITOS PARA DECLARAÇÃO DE UTILIDADE
PÚBLICA).",ARQUIVADO,ARQVD,OUTRAS SITUAÇÕES,MOUTR,1971-09-23,000149296,PL. 261 1971 - PROJETO DE LEI,DELIBERAÇÃO DE PLENÁRIO,NA,20120229,rosanacf,1971-09-21,"list(passo = 1, data = ""1971-09-21"", local = ""PLENÁRIO"", historico = ""HISTÓRICO DA TRAMITAÇÃO\nPLENÁRIO:\nDISCUSSÃO ÚNICA\nAPROVAÇÃO: 6 10 1971\nCOMISSÕES:\nJUSTIÇA\nSEGUNDA DISCUSSÃO\nRELATOR: DEP. TARCISIO DELGADO\nPUBLICAÇÃO: 20 4 1972\nANEXADO AO PROJETO DE LEI 255 1971, EM 12 10 1971.\nDESANEXADO DE ACORDO COM DECISÃO DA MESA, EM 9 11 1971.\nARQUIVADO EM 3 5 1972."")",list(),list(),N,1461,NA,NA,1554,"ALTERAÇÃO, LEI ESTADUAL, REQUISITOS, DECLARAÇÃO, UTILIDADE PÚBLICA,
ASSOCIAÇÕES, SOCIEDADE CIVIL, FUNDAÇÃO.",UTILIDADE PÚBLICA,"list(id = 1461, nome = ""DEPUTADO MOACIR LOPES"", partido = ""ARENA"")",NA,NULL,NA,NA,NA,NA
Remissivo,PROJETO DE LEI,PL,260,1971,DEPUTADO LÚCIO DE SOUZA CRUZ               ARENA,"CONCEDE SUBVENÇÕES A DIVERSAS INSTITUIÇÕES (PARA O EXERCÍCIO DE
1972).",TRANSFORMADO EM NORMA JURÍDICA,TNJUR,PROPOSIÇÕES APROVADAS,MAPRV,1971-09-23,000149297,PL. 260 1971 - PROJETO DE LEI,NA,LEI 5862 1972 - LEI ORDINÁRIA,20010917,LOURDESM,1971-09-21,"list(passo = 1, data = ""1971-09-21"", local = ""PLENÁRIO"", historico = ""HISTÓRICO DA TRAMITAÇÃO\nPLENÁRIO:\nPRIMEIRA DISCUSSÃO\nAPROVAÇÃO: 27 9 1971\nEMENDAS PÚBLICAS EM 25 11 1971\nSEGUNDA DISCUSSÃO\nAPROVAÇÃO: 28 11 1971\nTERCEIRA DISCUSSÃO\nAPROVAÇÃO: 29 11 1971\nREDAÇÃO FINAL\nAPROVAÇÃO: 30 11 1971\nCOMISSÕES:\nFINANÇAS\nSEGUNDA DISCUSSÃO\nRELATOR: DEP. LÚCIO DE SOUZA CRUZ\nPUBLICAÇÃO: 13 11 1971\nFINANÇAS\nSEGUNDA DISCUSSÃO\nPARECER SOBRE AS EMENDAS\nRELATOR: DEP. LÚCIO DE SOUZA CRUZ\nPUBLICAÇÃO: 25 11 1971\nFINANÇAS\nTERCEIRA DISCUSSÃO\nRELATOR: DEP. MARTINS SILVEIRA\nPUBLICAÇÃO: 30 11 1971\nREDAÇÃO\nREDAÇÃO FINAL\nPUBLICAÇÃO: 1 2 1971, 3 2 1972, 25 5 1973, 6 12 1973,\n16 3 1974, 20 3 1974, 21 3 1974, 28 3 1974, 26 4 1974,\n31 5 1974, 18 5 1974 E 17 1 1976\nSANCIONADO\nPUBLICAÇÃO DA LEI: 17 2 1972."")",list(),list(),N,323,NA,NA,NA,NA,NA,"list(id = 323, nome = ""DEPUTADO LÚCIO DE SOUZA CRUZ"", partido = ""ARENA"")",NA,NULL,NA,/legislacao/mineira/LEI/5862/1972,LEI 5862 1972 - LEI ORDINÁRIA,NA
Remissivo,PROJETO DE LEI,PL,259,1971,DEPUTADO NARCÉLIO MENDES                   PDS,"DECLARA DE UTILIDADE PÚBLICA O ""LAR DAS MENINAS DE CARATINGA"", DE
CARATINGA.",TRANSFORMADO EM NORMA JURÍDICA,TNJUR,PROPOSIÇÕES APROVADAS,MAPRV,1971-09-23,000149298,PL. 259 1971 - PROJETO DE LEI,DELIBERAÇÃO DE PLENÁRIO,LEI 5816 1971 - LEI ORDINÁRIA,20120229,rosanacf,1971-09-21,"list(passo = 1, data = ""1971-09-21"", local = ""PLENÁRIO"", historico = ""HISTÓRICO DA TRAMITAÇÃO\nPLENÁRIO:\nDISCUSSÃO ÚNICA\nAPROVAÇÃO: 19 10 1971\nREDAÇÃO FINAL\nAPROVAÇÃO: 25 10 1971\nCOMISSÕES:\nJUSTIÇA\nDISCUSSÃO ÚNICA\nRELATOR: DEP. FERNANDO JUNQUEIRA\nPUBLICAÇÃO: 9 10 1971\nREDAÇÃO\nREDAÇÃO FINAL\nRELATOR: DEP. NARCÉLIO MENDES\nPUBLICAÇÃO: 23 10 1971\nSANCIONADO\nPUBLICAÇÃO DA LEI: 17 11 1971"")",list(),list(),N,1465,NA,NA,1551,"UTILIDADE PÚBLICA, ENTIDADE, MUNICÍPIO, CARATINGA.",UTILIDADE PÚBLICA,"list(id = 1465, nome = ""DEPUTADO NARCÉLIO MENDES"", partido = ""PDS"")",NA,NULL,NA,/legislacao/mineira/LEI/5816/1971,LEI 5816 1971 - LEI ORDINÁRIA,NA
Remissivo,PROJETO DE LEI,PL,258,1971,DEPUTADO CARLOS ELOY                       ARENA,"DECLARA DE UTILIDADE PÚBLICA A ALIANÇA DIVINOPOLITANA DE ASSISTÊNCIA E
PROMOÇÃO, DE DIVINÓPOLIS.",TRANSFORMADO EM NORMA JURÍDICA,TNJUR,PROPOSIÇÕES APROVADAS,MAPRV,1971-09-22,000149299,PL. 258 1971 - PROJETO DE LEI,DELIBERAÇÃO DE PLENÁRIO,LEI 5808 1971 - LEI ORDINÁRIA,20120229,rosanacf,1971-09-20,"list(passo = 1, data = ""1971-09-20"", local = ""PLENÁRIO"", historico = ""HISTÓRICO DA TRAMITAÇÃO\nPLENÁRIO:\nDISCUSSÃO ÚNICA\nAPROVAÇÃO: 14 10 1971\nREDAÇÃO FINAL\nAPROVAÇÃO: 19 10 1971\nCOMISSÕES:\nJUSTIÇA\nDISCUSSÃO ÚNICA\nRELATOR: DEP. JOÃO NAVARRO\nPUBLICAÇÃO: 9 10 1971\nREDAÇÃO\nREDAÇÃO FINAL\nRELATOR: DEP. JOÃO PEDRO GUSTIN\nPUBLICAÇÃO: 21 10 1971\nSANCIONADO\nPUBLICAÇÃO DA LEI: 29 10 1971"")",list(),list(),N,708,NA,NA,1551,"UTILIDADE PÚBLICA, ENTIDADE, MUNICÍPIO, DIVINÓPOLIS.",UTILIDADE PÚBLICA,"list(id = 708, nome = ""DEPUTADO CARLOS ELOY"", partido = ""ARENA"")",NA,NULL,NA,/legislacao/mineira/LEI/5808/1971,LEI 5808 1971 - LEI ORDINÁRIA,NA
Remissivo,PROJETO DE LEI,PL,257,1971,DEPUTADO AMILCAR PADOVANI                  MDB,"DECLARA DE UTILIDADE PÚBLICA O GRUPO ESPÍRITA DE CARIDADE NOSSA
SENHORA DA APARECIDA, DE JUIZ DE FORA.",ARQUIVADO,ARQVD,OUTRAS SITUAÇÕES,MOUTR,1971-09-22,000149300,PL. 257 1971 - PROJETO DE LEI,NA,NA,20120229,rosanacf,1971-09-20,"list(passo = 1, data = ""1971-09-20"", local = ""PLENÁRIO"", historico = ""ARQUIVADO, FINAL DE LEGISLATURA."")",list(),list(),N,1189,ARQUIVO,19750131,1549,"UTILIDADE PÚBLICA, ENTIDADE, MUNICÍPIO, JUIZ DE FORA.",UTILIDADE PÚBLICA,"list(id = 1189, nome = ""DEPUTADO AMILCAR PADOVANI"", partido = ""MDB"")",NA,NULL,NA,NA,NA,NA
Remissivo,PROJETO DE LEI,PL,256,1971,DEPUTADO GERARDO RENAULT                   ARENA,"DECLARA DE UTILIDADE PÚBLICA O ""CONJUNTO LILIAS"", DA CIDADE DE BAMBUÍ.",TRANSFORMADO EM NORMA JURÍDICA,TNJUR,PROPOSIÇÕES APROVADAS,MAPRV,1971-09-22,000149301,PL. 256 1971 - PROJETO DE LEI,DELIBERAÇÃO DE PLENÁRIO,LEI 5814 1971 - LEI ORDINÁRIA,20120229,rosanacf,1971-09-20,"list(passo = 1, data = ""1971-09-20"", local = ""PLENÁRIO"", historico = ""HISTÓRICO DA TRAMITAÇÃO\nPLENÁRIO:\nDISCUSSÃO ÚNICA\nAPROVAÇÃO: 13 10 1971\nREDAÇÃO FINAL\nAPROVAÇÃO: 25 10 1971\nCOMISSÕES:\nJUSTIÇA\nDISCUSSÃO ÚNICA\nRELATOR: DEP. TARCISIO DELGADO\nPUBLICAÇÃO: 9 10 1971\nREDAÇÃO\nREDAÇÃO FINAL\nRELATOR: DEP. VALDIR MELGAÇO\nPUBLICAÇÃO: 23 10 1971\nSANCIONADO\nPUBLICAÇÃO DA LEI: 17 11 1971"")",list(),list(),N,1176,NA,NA,1548,"UTILIDADE PÚBLICA, ENTIDADE, MUNICÍPIO, BAMBUÍ.",UTILIDADE PÚBLICA,"list(id = 1176, nome = ""DEPUTADO GERARDO RENAULT"", partido = ""ARENA"")",NA,NULL,NA,/legislacao/mineira/LEI/5814/1971,LEI 5814 1971 - LEI ORDINÁRIA,NA
