dominio,tipoProjeto,siglaTipoProjeto,numero,ano,autor,ementa,situacao,siglaSituacao,situacaoGeral,siglaSituacaoGeral,dataPublicacao,numeroDoc,proposicao,regime,norma,atualizacao,usuario,dataUltimaAcao,listaHistoricoTramitacoes,links,linksProposicoesAnexadas,linksOrigem,acompanhamento,tema,matricula,assuntoGeral,horario,indexacao,autoresEstruturados,local,arquivamento,legislacaoCitada,linkLegislacao.url,linkLegislacao.rotulo,proposicaoLei.descricao
Remissivo,PROJETO DE LEI,PL,454,1972,DEPUTADO GERARDO RENAULT                   ARENA,"DECLARA DE UTILIDADE PÚBLICA A INSTITUIÇÃO CRISTÃ DE AMPARO À VELHICE -
ICAV - COM SEDE EM BELO HORIZONTE.",TRANSFORMADO EM NORMA JURÍDICA,TNJUR,PROPOSIÇÕES APROVADAS,MAPRV,1972-05-17,000149100,PL. 454 1972 - PROJETO DE LEI,DELIBERAÇÃO DE PLENÁRIO,LEI 6372 1972 - LEI ORDINÁRIA,20120305,rosanacf,1972-05-15,"list(passo = 1, data = ""1972-05-15"", local = ""PLENÁRIO"", historico = ""HISTÓRICO DA TRAMITAÇÃO\nPLENÁRIO:\nPRIMEIRA DISCUSSÃO\nAPROVAÇÃO: 3 6 1974\nSEGUNDA DISCUSSÃO\nAPROVAÇÃO: 21 6 1974\nREDAÇÃO FINAL\nAPROVAÇÃO: 24 6 1974\nCOMISSÕES:\nJUSTIÇA\nPRIMEIRA DISCUSSÃO\nRELATOR: DEP. JOÃO NAVARRO\nPUBLICAÇÃO: 30 5 1972\nSEGUNDA DISCUSSÃO\nRELATOR: DEP. MORVAN ACAYABA\nPUBLICAÇÃO: 8 6 1974\nREDAÇÃO\nREDAÇÃO FINAL\nRELATOR: DEP. CARLOS ELOY\nPUBLICAÇÃO: 26 6 1974\nSANCIONADO\nPUBLICAÇÃO DA LEI: 10 7 1974."")",list(),list(),NULL,N,NA,1176,UTILIDADE PÚBLICA,1546,"UTILIDADE PÚBLICA, ENTIDADE, MUNICÍPIO, BELO HORIZONTE.","list(id = 1176, nome = ""DEPUTADO GERARDO RENAULT"", partido = ""ARENA"")",NA,NA,NA,/legislacao/mineira/LEI/6372/1972,LEI 6372 1972 - LEI ORDINÁRIA,NA
Remissivo,PROJETO DE LEI,PL,453,1972,TRIBUNAL DE CONTAS,"CONCEDE AO PESSOAL DOS SERVIÇOS AUXILIARES DO TRIBUNAL DE
CONTAS DO ESTADO, AUMENTO DE VENCIMENTOS, NAS CONDIÇÕES QUE
ESPECIFICA.",TRANSFORMADO EM NORMA JURÍDICA,TNJUR,PROPOSIÇÕES APROVADAS,MAPRV,1972-05-16,000149104,PL. 453 1972 - PROJETO DE LEI,DELIBERAÇÃO DE PLENÁRIO,LEI 5949 1972 - LEI ORDINÁRIA,20170926,m20993,1972-05-12,"list(passo = 1, data = ""1972-05-12"", local = ""PLENÁRIO"", historico = ""HISTÓRICO DA TRAMITAÇÃO\nPLENÁRIO:\nPRIMEIRA DISCUSSÃO\nAPROVAÇÃO: 28 6 1972, COM EMENDAS\nSEGUNDA DISCUSSÃO\nAPROVAÇÃO: 29 6 1972\nREDAÇÃO FINAL\nAPROVAÇÃO: 29 6 1972\nCOMISSÕES:\nJUSTIÇA, SERVIÇO PÚBLICO E FINANÇAS (REUNIÃO CONJUNTA)\nPRIMEIRA DISCUSSÃO\nRELATOR: DEP. PINHEIRO CHAGAS\nPUBLICAÇÃO: 28 6 1972\nJUSTIÇA\nSEGUNDA DISCUSSÃO\nRELATOR: DEP. NARCÉLIO MENDES\nPUBLICAÇÃO: 29 6 1972\nREDAÇÃO\nREDAÇÃO FINAL\nRELATOR: DEP. NARCÉLIO MENDES\nPUBLICAÇÃO: 30 6 1972 E 8 7 1972\nSANCIONADO\nPUBLICAÇÃO DA LEI: 12 7 1972."")",list(),list(),"list(descricao = ""MSG 135 1972"")",N,ADMINISTRAÇÃO PÚBLICA,,"PESSOAL
TRIBUNAL DE CONTAS DO ESTADO DE MINAS GERAIS (TCEMG)",1132,NA,NULL,NA,NA,NA,/legislacao/mineira/LEI/5949/1972,LEI 5949 1972 - LEI ORDINÁRIA,NA
Remissivo,PROJETO DE LEI,PL,452,1972,GOVERNADOR DO ESTADO,"MODIFICA DISPOSITIVOS DA LEI 5694, DE PRIMEIRO DE JUNHO DE 1971,
QUE AUTORIZA O PODER EXECUTIVO A DOAR IMÓVEL DE PROPRIEDADE DO
ESTADO À FUNDAÇÃO UNIVERSITÁRIA MUNICIPAL DE SÃO JOÃO DEL-REI.",TRANSFORMADO EM NORMA JURÍDICA,TNJUR,PROPOSIÇÕES APROVADAS,MAPRV,1972-05-13,000149107,PL. 452 1972 - PROJETO DE LEI,NA,LEI 5904 1972 - LEI ORDINÁRIA,20020725,GRACA,1972-05-11,"list(passo = 1, data = ""1972-05-11"", local = ""PLENÁRIO"", historico = ""HISTÓRICO DA TRAMITAÇÃO\nPLENÁRIO:\nDISCUSSÃO ÚNICA\nAPROVAÇÃO: 26 5 1972\nREDAÇÃO FINAL\nAPROVAÇÃO: 30 5 1972\nCOMISSÕES:\nJUSTIÇA\nDISCUSSÃO ÚNICA\nRELATOR: DEP. RUY DA COSTA VAL\nPUBLICAÇÃO: 26 5 1972\nEDUCAÇÃO\nDISCUSSÃO ÚNICA\nRELATOR: DEP. MORVAN ACAYABA\nPUBLICAÇÃO: 26 5 1972\nREDAÇÃO\nREDAÇÃO FINAL\nRELATOR: DEP. IVO MORAIS\nPUBLICAÇÃO: 30 5 1972\nSANCIONADO\nPUBLICAÇÃO DA LEI: 9 6 1972."")",list(),list(),"list(descricao = ""MSG 134 1972"")",N,NA,NA,NA,NA,NA,NULL,NA,NA,NA,/legislacao/mineira/LEI/5904/1972,LEI 5904 1972 - LEI ORDINÁRIA,NA
Remissivo,PROJETO DE LEI,PL,448,1972,DEPUTADO DÊNIO MOREIRA                     ARENA,"DECLARA DE UTILIDADE PÚBLICA A ASSOCIAÇÃO MINEIRA DOS ADVOGADOS
CRIMINOLOGISTAS, COM SEDE EM BELO HORIZONTE.",TRANSFORMADO EM NORMA JURÍDICA,TNJUR,PROPOSIÇÕES APROVADAS,MAPRV,1972-05-16,000149105,PL. 448 1972 - PROJETO DE LEI,DELIBERAÇÃO DE PLENÁRIO,LEI 5930 1972 - LEI ORDINÁRIA,20120305,rosanacf,1972-05-12,"list(passo = 1, data = ""1972-05-12"", local = ""PLENÁRIO"", historico = ""HISTÓRICO DA TRAMITAÇÃO\nPLENÁRIO:\nPRIMEIRA DISCUSSÃO\nAPROVAÇÃO: 30 5 1972\nSEGUNDA DISCUSSÃO\nAPROVAÇÃO: 14 6 1972\nREDAÇÃO FINAL\nAPROVAÇÃO: 15 6 1972\nCOMISSÕES:\nJUSTIÇA\nPRIMEIRA DISCUSSÃO\nRELATOR: DEP. MARCOS TITO\nPUBLICAÇÃO: 20 5 1972\nJUSTIÇA\nSEGUNDA DISCUSSÃO\nRELATOR: DEP. JOÃO NAVARRO\nPUBLICAÇÃO: 8 6 1972\nREDAÇÃO\nREDAÇÃO FINAL\nRELATOR: DEP. NARCÉLIO MENDES\nPUBLICAÇÃO: 17 6 1972\nSANCIONADO\nPUBLICAÇÃO DA LEI: 30 6 1972."")",list(),list(),NULL,N,NA,246,UTILIDADE PÚBLICA,1538,"UTILIDADE PÚBLICA, ENTIDADE, MUNICÍPIO, BELO HORIZONTE.","list(id = 246, nome = ""DEPUTADO DÊNIO MOREIRA"", partido = ""ARENA"")",NA,NA,NA,/legislacao/mineira/LEI/5930/1972,LEI 5930 1972 - LEI ORDINÁRIA,NA
Remissivo,PROJETO DE LEI,PL,447,1972,DEPUTADO HUMBERTO SOUTO                    ARENA,"DECLARA DE UTILIDADE PÚBLICA A ""ASSOCIAÇÃO ATLÉTICA CASSIMIRO DE
ABREU"", DE MONTES CLAROS.",TRANSFORMADO EM NORMA JURÍDICA,TNJUR,PROPOSIÇÕES APROVADAS,MAPRV,1972-05-13,000149108,PL. 447 1972 - PROJETO DE LEI,DELIBERAÇÃO DE PLENÁRIO,LEI 5939 1972 - LEI ORDINÁRIA,20120305,rosanacf,1972-05-11,"list(passo = 1, data = ""1972-05-11"", local = ""PLENÁRIO"", historico = ""HISTÓRICO DA TRAMITAÇÃO\nPLENÁRIO:\nPRIMEIRA DISCUSSÃO\nAPROVAÇÃO: 31 5 1972\nSEGUNDA DISCUSSÃO\nAPROVAÇÃO: 19 6 1972\nREDAÇÃO FINAL\nAPROVAÇÃO: 26 6 1972\nCOMISSÕES:\nJUSTIÇA\nPRIMEIRA DISCUSSÃO\nRELATOR: DEP. RUY DA COSTA VAL\nPUBLICAÇÃO: 20 5 1972\nJUSTIÇA\nSEGUNDA DISCUSSÃO\nRELATOR: DEP. RUY DA COSTA VAL\nPUBLICAÇÃO: 8 6 1972\nREDAÇÃO\nREDAÇÃO FINAL\nRELATOR: DEP. JÉSUS TRINDADE\nPUBLICAÇÃO: 23 6 1972\nSANCIONADO\nPUBLICAÇÃO DA LEI: 5 7 1972."")",list(),list(),NULL,N,NA,1489,UTILIDADE PÚBLICA,1535,"UTILIDADE PÚBLICA, ENTIDADE, MUNICÍPIO, MONTES CLAROS.","list(id = 1489, nome = ""DEPUTADO HUMBERTO SOUTO"", partido = ""ARENA"")",NA,NA,NA,/legislacao/mineira/LEI/5939/1972,LEI 5939 1972 - LEI ORDINÁRIA,NA
Remissivo,PROJETO DE LEI,PL,446,1972,DEPUTADO VALDIR MELGAÇO                    ARENA,"DECLARA DE UTILIDADE PÚBLICA A ""OBRA SOCIAL DA PARÓQUIA NOSSA SENHORA
DA PIEDADE"", COM SEDE EM BELO HORIZONTE.",TRANSFORMADO EM NORMA JURÍDICA,TNJUR,PROPOSIÇÕES APROVADAS,MAPRV,1972-05-12,000149109,PL. 446 1972 - PROJETO DE LEI,NA,LEI 5941 1972 - LEI ORDINÁRIA,20120305,rosanacf,1972-05-10,"list(passo = 1, data = ""1972-05-10"", local = ""PLENÁRIO"", historico = ""HISTÓRICO DA TRAMITAÇÃO\nPLENÁRIO:\nPRIMEIRA DISCUSSÃO\nAPROVAÇÃO: 30 5 1972\nSEGUNDA DISCUSSÃO\nAPROVAÇÃO: 19 6 1972\nREDAÇÃO FINAL\nAPROVAÇÃO: 26 6 1972\nCOMISSÕES:\nJUSTIÇA\nPRIMEIRA DISCUSSÃO\nRELATOR: DEP. TARCISIO DELGADO\nPUBLICAÇÃO: 20 5 1972\nJUSTIÇA\nSEGUNDA DISCUSSÃO\nRELATOR: DEP. NARCÉLIO MENDES\nPUBLICAÇÃO: 8 6 1972\nREDAÇÃO\nREDAÇÃO FINAL\nRELATOR: DEP. JÉSUS TRINDADE\nPUBLICAÇÃO: 23 6 1972\nSANCIONADO\nPUBLICAÇÃO DA LEI: 5 7 1972."")",list(),list(),NULL,N,NA,720,UTILIDADE PÚBLICA,1534,"UTILIDADE PÚBLICA, ENTIDADE, MUNICÍPIO, BELO HORIZONTE.","list(id = 720, nome = ""DEPUTADO VALDIR MELGAÇO"", partido = ""ARENA"")",NA,NA,NA,/legislacao/mineira/LEI/5941/1972,LEI 5941 1972 - LEI ORDINÁRIA,NA
Remissivo,PROJETO DE LEI,PL,444,1972,DEPUTADO JOÃO NAVARRO                      ARENA,"CONCEDE AO SENADOR FILINTO MULLER, O TÍTULO DE ""CIDADÃO
HONORÁRIO DO ESTADO DE MINAS GERAIS"".",TRANSFORMADO EM NORMA JURÍDICA,TNJUR,PROPOSIÇÕES APROVADAS,MAPRV,1972-05-12,000149110,PL. 444 1972 - PROJETO DE LEI,NA,LEI 6109 1972 - LEI ORDINÁRIA,20150518,m17461,1972-05-10,"list(passo = 1, data = ""1972-05-10"", local = ""PLENÁRIO"", historico = ""HISTÓRICO DA TRAMITAÇÃO\nPLENÁRIO:\nPRIMEIRA DISCUSSÃO\nAPROVAÇÃO: 12 4 1973\nSEGUNDA DISCUSSÃO\nAPROVAÇÃO: 7 6 1973\nREDAÇÃO FINAL\nAPROVAÇÃO: 20 6 1973\nCOMISSÕES:\nCONSELHO DA MEDALHA DA INCONFIDÊNCIA\nRELATOR: CONSELHEIRO DERMEVAL J. PIMENTA\nPARECER FAVORÁVEL\nJUSTIÇA\nPRIMEIRA DISCUSSÃO\nRELATOR: DEP. TARCISIO DELGADO\nPUBLICAÇÃO: 25 11 1972\nJUSTIÇA\nSEGUNDA DISCUSSÃO\nRELATOR: DEP. MANOEL COSTA\nPUBLICAÇÃO: 1 5 1973\nREDAÇÃO\nREDAÇÃO FINAL\nRELATOR: DEP. NELSON LOMBARDI\nPUBLICAÇÃO: 13 6 1973\nSANCIONADO\nPUBLICAÇÃO DA LEI: 27 6 1973."")",list(),list(),NULL,N,NA,311,HOMENAGEM,1025,"CONCESSÃO HONORÍFICA, TÍTULO, CIDADÃO.","list(id = 311, nome = ""DEPUTADO JOÃO NAVARRO"", partido = ""ARENA"")",NA,NA,NA,/legislacao/mineira/LEI/6109/1972,LEI 6109 1972 - LEI ORDINÁRIA,NA
Remissivo,PROJETO DE LEI,PL,443,1972,DEPUTADO MANOEL COSTA                      ARENA,"DÁ A DENOMINAÇÃO DE ""PRESIDENTE ARTUR DA COSTA E SILVA"" À ESCOLA
POLIVALENTE DO PREMEM, DE POUSO ALEGRE E DETERMINA OUTRAS PROVIDÊNCIAS.",TRANSFORMADO EM NORMA JURÍDICA,TNJUR,PROPOSIÇÕES APROVADAS,MAPRV,1972-05-11,000149111,PL. 443 1972 - PROJETO DE LEI,NA,LEI 5934 1972 - LEI ORDINÁRIA,20120521,rosanacf,1972-05-09,"list(passo = 1, data = ""1972-05-09"", local = ""PLENÁRIO"", historico = ""HISTÓRICO DA TRAMITAÇÃO\nPLENÁRIO:\nPRIMEIRA DISCUSSÃO\nAPROVAÇÃO: 26 5 1972\nSEGUNDA DISCUSSÃO\nAPROVAÇÃO: 15 6 1972\nREDAÇÃO FINAL\nAPROVAÇÃO: 26 6 1972\nCOMISSÕES:\nJUSTIÇA\nPRIMEIRA DISCUSSÃO\nRELATOR: DEP. MARCOS TITO\nPUBLICAÇÃO: 20 5 1972\nJUSTIÇA\nSEGUNDA DISCUSSÃO\nRELATOR: DEP. RUY DA COSTA VAL\nPUBLICAÇÃO: 8 6 1972\nREDAÇÃO\nREDAÇÃO FINAL\nRELATOR: DEP. NARCÉLIO MENDES\nPUBLICAÇÃO: 22 6 1972\nSANCIONADO\nPUBLICAÇÃO DA LEI: 5 7 1972."")",list(),list(),NULL,N,NA,326,"PRÓPRIO PÚBLICO
ESTABELECIMENTO DE ENSINO",1540,"DENOMINAÇÃO, ESTABELECIMENTO DE ENSINO, MUNICÍPIO, POUSO ALEGRE.","list(id = 326, nome = ""DEPUTADO MANOEL COSTA"", partido = ""ARENA"")",NA,NA,NA,/legislacao/mineira/LEI/5934/1972,LEI 5934 1972 - LEI ORDINÁRIA,NA
Remissivo,PROJETO DE LEI,PL,442,1972,DEPUTADO CARLOS ELOY                       ARENA,"DECLARA DE UTILIDADE PÚBLICA A ""ASSISTÊNCIA AOS ESCOLARES DO BAIRRO
SANTO ANTÔNIO"", COM SEDE EM BELO HORIZONTE.",TRANSFORMADO EM NORMA JURÍDICA,TNJUR,PROPOSIÇÕES APROVADAS,MAPRV,1972-05-10,000149112,PL. 442 1972 - PROJETO DE LEI,DELIBERAÇÃO DE PLENÁRIO,LEI 5914 1972 - LEI ORDINÁRIA,20120305,rosanacf,1972-05-08,"list(passo = 1, data = ""1972-05-08"", local = ""PLENÁRIO"", historico = ""HISTÓRICO DA TRAMITAÇÃO\nPLENÁRIO:\nPRIMEIRA DISCUSSÃO\nAPROVAÇÃO: 17 5 1972\nSEGUNDA DISCUSSÃO\nAPROVAÇÃO: 30 5 1972\nREDAÇÃO FINAL\nAPROVAÇÃO: 5 6 1972\nCOMISSÕES:\nJUSTIÇA\nPRIMEIRA DISCUSSÃO\nRELATOR: DEP. MARCOS TITO\nPUBLICAÇÃO: 13 5 1972\nJUSTIÇA\nSEGUNDA DISCUSSÃO\nRELATOR: DEP. JOÃO NAVARRO\nPUBLICAÇÃO: 25 5 1972\nREDAÇÃO\nREDAÇÃO FINAL\nRELATOR: DEP. IVO MORAIS\nPUBLICAÇÃO: 7 6 1972\nSANCIONADO\nPUBLICAÇÃO DA LEI: 14 6 1972."")",list(),list(),NULL,N,NA,708,UTILIDADE PÚBLICA,1533,"UTILIDADE PÚBLICA, ENTIDADE, MUNICÍPIO, BELO HORIZONTE.","list(id = 708, nome = ""DEPUTADO CARLOS ELOY"", partido = ""ARENA"")",NA,NA,NA,/legislacao/mineira/LEI/5914/1972,LEI 5914 1972 - LEI ORDINÁRIA,NA
Remissivo,PROJETO DE LEI,PL,441,1972,GOVERNADOR DO ESTADO,"DISPÕE SOBRE REORGANIZAÇÃO DE QUADROS DE PESSOAL DIRETRIZES PARA
CLASSIFICAÇÃO E AVALIAÇÃO DE CARGOS, CONSELHO ESTADUAL DE POLÍTICA DE
PESSOAL E REAJUSTAMENTO DE VENCIMENTO E DÁ OUTRAS PROVIDÊNCIAS.",TRANSFORMADO EM NORMA JURÍDICA COM VETO PARCIAL,TNJVP,PROPOSIÇÕES APROVADAS,MAPRV,1972-05-10,000149113,PL. 441 1972 - PROJETO DE LEI,DELIBERAÇÃO DE PLENÁRIO,LEI 5945 1972 - LEI ORDINÁRIA,20131021,rosanacf,1972-05-08,"list(passo = 1, data = ""1972-05-08"", local = ""PLENÁRIO"", historico = ""HISTÓRICO DA TRAMITAÇÃO\nPLENÁRIO\nDISCUSSÃO ÚNICA\nAPROVAÇÃO: 26 6 1972\nEMENDAS PUBLICADAS EM 17 5 1972 E 7 6 1972\nNÃO FOI APRECIADO EM REDAÇÃO FINAL POR PERDA DE PRAZO DE\nAPRECIAÇÃO PELA ASSEMBLEIA.\nCOMISSÕES:\nJUSTIÇA, SERVIÇO PÚBLICO E FINANÇAS (REUNIÃO CONJUNTA)\nDISCUSSÃO ÚNICA\nRELATOR: DEP. NARCÉLIO MENDES\nPUBLICAÇÃO: 17 6 1972\nREDAÇÃO\nREDAÇÃO FINAL\nRELATOR: DEP. IVO MORAIS\nPUBLICAÇÃO: 6 7 1972 E 8 7 1972\nVETADO PARCIALMENTE\nPUBLICAÇÃO DE LEI: 12 7 1972\nVETO PARCIAL MANTIDO"")",list(),list(),"list(descricao = ""MSG 133 1972"")",N,ADMINISTRAÇÃO PÚBLICA,,"EXECUTIVO
JUDICIÁRIO
MINISTÉRIO PÚBLICO DO ESTADO DE MINAS GERAIS (MPMG)
PESSOAL",1713,NA,NULL,NA,NA,NA,/legislacao/mineira/LEI/5945/1972,LEI 5945 1972 - LEI ORDINÁRIA,PRL 6495 1972
Remissivo,PROJETO DE LEI,PL,440,1972,DEPUTADO BONIFÁCIO DE ANDRADA              ARENA,"CONCEDE O TÍTULO DE CIDADÃO HONORÁRIO DO ESTADO DE MINAS
GERAIS AO PROFESSOR HERMANN MATHIAS GORGEN.",TRANSFORMADO EM NORMA JURÍDICA,TNJUR,PROPOSIÇÕES APROVADAS,MAPRV,1972-05-09,000149114,PL. 440 1972 - PROJETO DE LEI,DELIBERAÇÃO DE PLENÁRIO,LEI 5906 1972 - LEI ORDINÁRIA,20150518,m17461,1972-05-05,"list(passo = 1, data = ""1972-05-05"", local = ""PLENÁRIO"", historico = ""HISTÓRICO DA TRAMITAÇÃO\nPLENÁRIO:\nPRIMEIRA DISCUSSÃO\nAPROVAÇÃO: 5 6 1972\nSEGUNDA DISCUSSÃO\nAPROVAÇÃO: 6 6 1972\nREDAÇÃO FINAL\nAPROVAÇÃO: 6 6 1972\nCOMISSÕES:\nCONSELHO DA MEDALHA DA INCONFIDÊNCIA\nRELATOR: CONSELHEIRO MARCELO VASCONCELOS\nPARECER FAVORÁVEL\nJUSTIÇA\nPRIMEIRA DISCUSSÃO\nRELATOR: DEP. TARCISIO DELGADO\nPUBLICAÇÃO: 3 6 1972\nJUSTIÇA\nSEGUNDA DISCUSSÃO\nRELATOR: DEP. FERNANDO JUNQUEIRA\nPUBLICAÇÃO: 6 6 1972\nREDAÇÃO\nREDAÇÃO FINAL\nRELATOR: DEP. JOÃO PEDRO GUSTIN\nPUBLICAÇÃO: 7 6 1972\nSANCIONADO\nPUBLICAÇÃO DA LEI: 9 6 1972."")",list(),list(),NULL,N,NA,281,HOMENAGEM,1025,"CONCESSÃO HONORÍFICA, TÍTULO, CIDADÃO.","list(id = 281, nome = ""DEPUTADO BONIFÁCIO DE ANDRADA"", partido = ""ARENA"")",NA,NA,NA,/legislacao/mineira/LEI/5906/1972,LEI 5906 1972 - LEI ORDINÁRIA,NA
Remissivo,PROJETO DE LEI,PL,439,1972,DEPUTADO JOÃO NAVARRO                      ARENA,"DECLARA DE UTILIDADE PÚBLICA A ""ASSOCIAÇÃO DOS PAIS E MESTRES"", DO
COLÉGIO ESTADUAL EMBAIXADOR JOSÉ BONIFÁCIO, DE BARBACENA.",TRANSFORMADO EM NORMA JURÍDICA,TNJUR,PROPOSIÇÕES APROVADAS,MAPRV,1972-05-09,000149115,PL. 439 1972 - PROJETO DE LEI,NA,LEI 5942 1972 - LEI ORDINÁRIA,20120305,rosanacf,1972-05-05,"list(passo = 1, data = ""1972-05-05"", local = ""PLENÁRIO"", historico = ""HISTÓRICO DA TRAMITAÇÃO\nPLENÁRIO:\nPRIMEIRA DISCUSSÃO\nAPROVAÇÃO: 23 5 1972\nSEGUNDA DISCUSSÃO\nAPROVAÇÃO: 9 6 1972\nREDAÇÃO FINAL\nAPROVAÇÃO: 19 6 1972\nCOMISSÕES:\nJUSTIÇA\nPRIMEIRA DISCUSSÃO\nRELATOR: DEP. PINHEIRO CHAGAS\nPUBLICAÇÃO: 13 5 1972\nJUSTIÇA\nSEGUNDA DISCUSSÃO\nRELATOR: DEP. FERNANDO JUNQUEIRA\nPUBLICAÇÃO: 26 5 1972\nREDAÇÃO\nREDAÇÃO FINAL\nRELATOR: DEP. IVO MORAIS\nPUBLICAÇÃO: 16 6 1972\nSANCIONADO\nPUBLICAÇÃO DA LEI: 5 7 1972"")",list(),list(),NULL,N,NA,311,UTILIDADE PÚBLICA,1531,"UTILIDADE PÚBLICA, ENTIDADE, MUNICÍPIO, BARBACENA.","list(id = 311, nome = ""DEPUTADO JOÃO NAVARRO"", partido = ""ARENA"")",NA,NA,NA,/legislacao/mineira/LEI/5942/1972,LEI 5942 1972 - LEI ORDINÁRIA,NA
Remissivo,PROJETO DE LEI,PL,438,1972,DEPUTADO JOÃO NAVARRO                      ARENA,"DECLARA DE UTILIDADE PÚBLICA O ""CLUBE RECREATIVO RIO PRETO"", COM SEDE
NA CIDADE DE RIO PRETO.",TRANSFORMADO EM NORMA JURÍDICA,TNJUR,PROPOSIÇÕES APROVADAS,MAPRV,1972-05-06,000149116,PL. 438 1972 - PROJETO DE LEI,DELIBERAÇÃO DE PLENÁRIO,LEI 5933 1972 - LEI ORDINÁRIA,20120305,rosanacf,1972-05-04,"list(passo = 1, data = ""1972-05-04"", local = ""PLENÁRIO"", historico = ""HISTÓRICO DA TRAMITAÇÃO\nPLENÁRIO\nPRIMEIRA DISCUSSÃO\nAPROVAÇÃO: 23 5 1972\nSEGUNDA DISCUSSÃO\nAPROVAÇÃO: 8 6 1972\nREDAÇÃO FINAL\nAPROVAÇÃO: 19 6 1972\nCOMISSÕES:\nJUSTIÇA\nPRIMEIRA DISCUSSÃO\nRELATOR: DEP. MARCOS TITO\nPUBLICAÇÃO: 13 5 1972\nJUSTIÇA\nSEGUNDA DISCUSSÃO\nRELATOR: DEP. FERNANDO JUNQUEIRA\nPUBLICAÇÃO: 26 5 1972\nREDAÇÃO\nREDAÇÃO FINAL\nRELATOR: DEP. IVO MORAIS\nPUBLICAÇÃO: 16 6 1972\nSANCIONADO\nPUBLICAÇÃO DA LEI: 1 7 1972."")",list(),list(),NULL,N,NA,311,UTILIDADE PÚBLICA,1530,"UTILIDADE PÚBLICA, ENTIDADE, MUNICÍPIO, RIO PRETO.","list(id = 311, nome = ""DEPUTADO JOÃO NAVARRO"", partido = ""ARENA"")",NA,NA,NA,/legislacao/mineira/LEI/5933/1972,LEI 5933 1972 - LEI ORDINÁRIA,NA
Remissivo,PROJETO DE LEI,PL,437,1972,DEPUTADO VICENTE GUABIROBA                 ARENA,"DECLARA DE UTILIDADE PÚBLICA O ""ESPORTE CLUBE DEMOCRATA"", COM SEDE NA
CIDADE DE GOVERNADOR VALADARES.",TRANSFORMADO EM NORMA JURÍDICA,TNJUR,PROPOSIÇÕES APROVADAS,MAPRV,1972-05-05,000149117,PL. 437 1972 - PROJETO DE LEI,DELIBERAÇÃO DE PLENÁRIO,LEI 5963 1972 - LEI ORDINÁRIA,20120305,rosanacf,1972-05-03,"list(passo = 1, data = ""1972-05-03"", local = ""PLENÁRIO"", historico = ""HISTÓRICO DA TRAMITAÇÃO\nPLENÁRIO\nPRIMEIRA DISCUSSÃO\nAPROVAÇÃO: 20 6 1972\nSEGUNDA DISCUSSÃO\nAPROVAÇÃO: 29 6 1972\nREDAÇÃO FINAL\nAPROVAÇÃO: 7 8 1972\nCOMISSÕES:\nJUSTIÇA\nPRIMEIRA DISCUSSÃO\nRELATOR: DEP. PINHEIRO CHAGAS\nPUBLICAÇÃO: 15 6 1972\nJUSTIÇA\nSEGUNDA DISCUSSÃO\nRELATOR: DEP. PINHEIRO CHAGAS\nPUBLICAÇÃO: 28 6 1972\nREDAÇÃO\nREDAÇÃO FINAL\nRELATOR: DEP. NARCÉLIO MENDES\nPUBLICAÇÃO: 8 8 1972\nSANCIONADO\nPUBLICAÇÃO DA LEI: 25 8 1972."")",list(),list(),NULL,N,NA,1464,UTILIDADE PÚBLICA,1529,"UTILIDADE PÚBLICA, ENTIDADE, MUNICÍPIO, GOVERNADOR VALADARES.","list(id = 1464, nome = ""DEPUTADO VICENTE GUABIROBA"", partido = ""ARENA"")",NA,NA,NA,/legislacao/mineira/LEI/5963/1972,LEI 5963 1972 - LEI ORDINÁRIA,NA
Remissivo,PROJETO DE LEI,PL,436,1972,DEPUTADO JÉSUS TRINDADE                    ARENA,"DÁ A DENOMINAÇÃO DE ""DOMINGOS GONÇALVES MACHADO"" ÀS ESCOLAS COMBINADAS
DE BARRO BRANCO, MUNICÍPIO DE BARRA LONGA.",TRANSFORMADO EM NORMA JURÍDICA,TNJUR,PROPOSIÇÕES APROVADAS,MAPRV,1972-05-05,000149118,PL. 436 1972 - PROJETO DE LEI,NA,LEI 5931 1972 - LEI ORDINÁRIA,20120521,rosanacf,1972-05-03,"list(passo = 1, data = ""1972-05-03"", local = ""PLENÁRIO"", historico = ""HISTÓRICO DA TRAMITAÇÃO\nPLENÁRIO:\nPRIMEIRA DISCUSSÃO\nAPROVAÇÃO: 22 5 1972\nSEGUNDA DISCUSSÃO\nAPROVAÇÃO: 9 6 1972\nREDAÇÃO FINAL\nAPROVAÇÃO: 19 6 1972\nCOMISSÕES:\nJUSTIÇA\nPRIMEIRA DISCUSSÃO\nRELATOR: DEP. MARCOS TITO\nPUBLICAÇÃO: 13 5 1972\nJUSTIÇA\nSEGUNDA DISCUSSÃO\nRELATOR: DEP. MARCOS TITO\nPUBLICAÇÃO: 26 5 1972\nREDAÇÃO\nREDAÇÃO FINAL\nRELATOR: DEP. IVO MORAIS\nPUBLICAÇÃO: 16 6 1972\nSANCIONADO\nPUBLICAÇÃO DA LEI: 1 7 1972."")",list(),list(),NULL,N,NA,1048,"PRÓPRIO PÚBLICO
ESTABELECIMENTO DE ENSINO",1540,"DENOMINAÇÃO, ESTABELECIMENTO DE ENSINO, MUNICÍPIO, BARRA LONGA.","list(id = 1048, nome = ""DEPUTADO JÉSUS TRINDADE"", partido = ""ARENA"")",NA,NA,NA,/legislacao/mineira/LEI/5931/1972,LEI 5931 1972 - LEI ORDINÁRIA,NA
Remissivo,PROJETO DE LEI,PL,435,1972,DEPUTADO MANOEL COSTA                      ARENA,"DECLARA DE UTILIDADE PÚBLICA A ""CASA DA CRIANÇA"", COM SEDE NA CIDADE DE
GUARANÉSIA.",TRANSFORMADO EM NORMA JURÍDICA,TNJUR,PROPOSIÇÕES APROVADAS,MAPRV,1972-05-05,000149119,PL. 435 1972 - PROJETO DE LEI,DELIBERAÇÃO DE PLENÁRIO,LEI 5920 1972 - LEI ORDINÁRIA,20120305,rosanacf,1972-05-03,"list(passo = 1, data = ""1972-05-03"", local = ""PLENÁRIO"", historico = ""HISTÓRICO DA TRAMITAÇÃO\nPLENÁRIO:\nPRIMEIRA DISCUSSÃO\nAPROVAÇÃO: 19 5 1972\nSEGUNDA DISCUSSÃO\nAPROVAÇÃO: 6 6 1972\nREDAÇÃO FINAL\nAPROVAÇÃO: 13 6 1972\nCOMISSÕES:\nJUSTIÇA\nPRIMEIRA DISCUSSÃO\nRELATOR: DEP. NARCÉLIO MENDES\nPUBLICAÇÃO: 13 5 1972\nJUSTIÇA\nSEGUNDA DISCUSSÃO\nRELATOR: DEP. JOÃO NAVARRO\nPUBLICAÇÃO: 25 5 1972\nREDAÇÃO\nREDAÇÃO FINAL\nRELATOR: DEP. NARCÉLIO MENDES\nPUBLICAÇÃO: 10 6 1972\nSANCIONADO\nPUBLICAÇÃO DA LEI: 29 6 1972."")",list(),list(),NULL,N,NA,326,UTILIDADE PÚBLICA,1526,"UTILIDADE PÚBLICA, ENTIDADE, MUNICÍPIO, GUARANÉSIA.","list(id = 326, nome = ""DEPUTADO MANOEL COSTA"", partido = ""ARENA"")",NA,NA,NA,/legislacao/mineira/LEI/5920/1972,LEI 5920 1972 - LEI ORDINÁRIA,NA
Remissivo,PROJETO DE LEI,PL,434,1972,DEPUTADO JOÃO FERRAZ                       ARENA,"DECLARA DE UTILIDADE PÚBLICA O ""HOSPITAL NOSSA SENHORA APARECIDA"", COM
SEDE NA CIDADE DE LUZ.",TRANSFORMADO EM NORMA JURÍDICA,TNJUR,PROPOSIÇÕES APROVADAS,MAPRV,1972-05-05,000149120,PL. 434 1972 - PROJETO DE LEI,DELIBERAÇÃO DE PLENÁRIO,LEI 5923 1972 - LEI ORDINÁRIA,20120305,rosanacf,1972-05-03,"list(passo = 1, data = ""1972-05-03"", local = ""PLENÁRIO"", historico = ""HISTÓRICO DA TRAMITAÇÃO\nPLENÁRIO:\nPRIMEIRA DISCUSSÃO\nAPROVAÇÃO: 19 5 1972\nSEGUNDA DISCUSSÃO\nAPROVAÇÃO: 6 6 1972\nREDAÇÃO FINAL\nAPROVAÇÃO: 13 6 1972\nCOMISSÕES:\nJUSTIÇA\nPRIMEIRA DISCUSSÃO\nRELATOR: DEP. RUY DA COSTA VAL\nPUBLICAÇÃO: 13 5 1972\nJUSTIÇA\nSEGUNDA DISCUSSÃO\nRELATOR: DEP. NARCÉLIO MENDES\nPUBLICAÇÃO: 25 5 1972\nREDAÇÃO\nREDAÇÃO FINAL\nRELATOR: DEP. NARCÉLIO MENDES\nPUBLICAÇÃO: 10 6 1972\nSANCIONADO\nPUBLICAÇÃO DA LEI: 29 6 1972."")",list(),list(),NULL,N,NA,1171,UTILIDADE PÚBLICA,1525,"UTILIDADE PÚBLICA, ENTIDADE, MUNICÍPIO, LUZ.","list(id = 1171, nome = ""DEPUTADO JOÃO FERRAZ"", partido = ""ARENA"")",NA,NA,NA,/legislacao/mineira/LEI/5923/1972,LEI 5923 1972 - LEI ORDINÁRIA,NA
Remissivo,PROJETO DE LEI,PL,433,1972,GOVERNADOR DO ESTADO,"CONCEDE PENSÃO ESPECIAL À VIÚVA DO EX-DEPUTADO NACIP RAYDAN
COUTINHO.",TRANSFORMADO EM NORMA JURÍDICA,TNJUR,PROPOSIÇÕES APROVADAS,MAPRV,1972-05-04,000149121,PL. 433 1972 - PROJETO DE LEI,DELIBERAÇÃO DE PLENÁRIO,LEI 5895 1972 - LEI ORDINÁRIA,19980101,Carga,1972-05-02,"list(passo = 1, data = ""1972-05-02"", local = ""PLENÁRIO"", historico = ""HISTÓRICO DA TRAMITAÇÃO\nPLENÁRIO:\nDISCUSSÃO ÚNICA\nAPROVAÇÃO: 16 5 1972\nREDAÇÃO FINAL\nAPROVAÇÃO: 18 5 1972\nCOMISSÕES:\nJUSTIÇA\nDISCUSSÃO ÚNICA\nRELATOR: DEP. JOÃO NAVARRO\nPUBLICAÇÃO: 13 5 1972\nFINANÇAS\nRELATOR: DEP. LÚCIO DE SOUZA CRUZ\nPUBLICAÇÃO: 13 5 1972\nREDAÇÃO\nREDAÇÃO FINAL\nRELATOR: DEP. IVO MORAIS\nPUBLICAÇÃO: 24 5 1972\nSANCIONADO\nPUBLICAÇÃO DA LEI: 31 5 1972."")",list(),list(),NULL,N,NA,NA,NA,NA,NA,NULL,NA,NA,NA,/legislacao/mineira/LEI/5895/1972,LEI 5895 1972 - LEI ORDINÁRIA,NA
Remissivo,PROJETO DE LEI,PL,432,1972,GOVERNADOR DO ESTADO,"ESTABELECE NORMAS PARA A INTEGRAÇÃO DO HOSPITAL BIAS FORTE,
DOADO PELO ESTADO A UNIVERSIDADE FEDERAL DO ESTADO DE MINAS
GERAIS, COM O HOSPITAL DAS CLÍNICAS, MANTIDO POR ESTA ÚLTIMA.",TRANSFORMADO EM NORMA JURÍDICA,TNJUR,PROPOSIÇÕES APROVADAS,MAPRV,1972-05-04,000149122,PL. 432 1972 - PROJETO DE LEI,DELIBERAÇÃO DE PLENÁRIO,LEI 5910 1972 - LEI ORDINÁRIA,19980101,Carga,1972-05-02,"list(passo = 1, data = ""1972-05-02"", local = ""PLENÁRIO"", historico = ""HISTÓRICO DA TRAMITAÇÃO\nPLENÁRIO:\nDISCUSSÃO ÚNICA\nAPROVAÇÃO: 24 5 1972\nREDAÇÃO FINAL\nAPROVAÇÃO: 30 5 1972\nCOMISSÕES:\nJUSTIÇA\nDISCUSSÃO ÚNICA\nRELATOR: DEP. NARCÉLIO MENDES\nPUBLICAÇÃO: 23 5 1972\nSAÚDE AÇÃO SOCIAL\nRELATOR: DEP. HAROLDO LOPES DA COSTA\nPUBLICAÇÃO: 23 5 1972\nREDAÇÃO\nREDAÇÃO FINAL\nRELATOR: DEP. IVO MORAIS\nPUBLICAÇÃO: 30 5 1972\nSANCIONADO\nPUBLICAÇÃO DA LEI: 14 6 1972."")",list(),list(),NULL,N,NA,NA,NA,NA,NA,NULL,NA,NA,NA,/legislacao/mineira/LEI/5910/1972,LEI 5910 1972 - LEI ORDINÁRIA,NA
Remissivo,PROJETO DE LEI,PL,431,1972,DEPUTADO JOÃO FERRAZ                       ARENA,"DECLARA DE UTILIDADE PÚBLICA A ""ESCOLA NORMAL NOSSA SENHORA DO CARMO E
GINÁSIO LEÃO XIII"", COM SEDE NA CIDADE DE PIRANGA.",TRANSFORMADO EM NORMA JURÍDICA,TNJUR,PROPOSIÇÕES APROVADAS,MAPRV,1972-05-03,000149123,PL. 431 1972 - PROJETO DE LEI,DELIBERAÇÃO DE PLENÁRIO,LEI 5922 1972 - LEI ORDINÁRIA,20120305,rosanacf,1972-04-28,"list(passo = 1, data = ""1972-04-28"", local = ""PLENÁRIO"", historico = ""HISTÓRICO DA TRAMITAÇÃO\nPLENÁRIO:\nPRIMEIRA DISCUSSÃO\nAPROVAÇÃO: 17 5 1972\nSEGUNDA DISCUSSÃO\nAPROVAÇÃO: 6 6 1972\nREDAÇÃO FINAL\nAPROVAÇÃO: 13 6 1972\nCOMISSÕES:\nJUSTIÇA\nPRIMEIRA DISCUSSÃO\nRELATOR: DEP. MARCOS TITO\nPUBLICAÇÃO: 11 5 1972\nJUSTIÇA\nSEGUNDA DISCUSSÃO\nRELATOR: DEP. PINHEIRO CHAGAS\nPUBLICAÇÃO: 25 5 1972\nREDAÇÃO\nREDAÇÃO FINAL\nRELATOR: DEP. NARCÉLIO MENDES\nPUBLICAÇÃO: 10 6 1972\nSANCIONADO\nPUBLICAÇÃO DA LEI: 29 6 1972."")",list(),list(),NULL,N,NA,1171,UTILIDADE PÚBLICA,1522,"UTILIDADE PÚBLICA, ENTIDADE, MUNICÍPIO, PIRANGA.","list(id = 1171, nome = ""DEPUTADO JOÃO FERRAZ"", partido = ""ARENA"")",NA,NA,NA,/legislacao/mineira/LEI/5922/1972,LEI 5922 1972 - LEI ORDINÁRIA,NA
Remissivo,PROJETO DE LEI,PL,430,1972,DEPUTADO HAROLDO LOPES DA COSTA            MDB,INSTITUI O DIA DO MÉDICO.,TRANSFORMADO EM NORMA JURÍDICA,TNJUR,PROPOSIÇÕES APROVADAS,MAPRV,1972-05-03,000149124,PL. 430 1972 - PROJETO DE LEI,DELIBERAÇÃO DE PLENÁRIO,LEI 5952 1972 - LEI ORDINÁRIA,20170825,m20993,1972-04-28,"list(passo = 1, data = ""1972-04-28"", local = ""PLENÁRIO"", historico = ""HISTÓRICO DA TRAMITAÇÃO\nPLENÁRIO:\nPRIMEIRA DISCUSSÃO\nAPROVAÇÃO: 6 6 1972\nSEGUNDA DISCUSSÃO\nAPROVAÇÃO: 28 6 1972\nREDAÇÃO FINAL\nAPROVAÇÃO: 30 6 1972\nCOMISSÕES:\nJUSTIÇA\nPRIMEIRA DISCUSSÃO\nRELATOR: DEP. JOÃO NAVARRO\nPUBLICAÇÃO: 26 5 1972\nJUSTIÇA\nSEGUNDA DISCUSSÃO\nRELATOR: DEP. TARCISIO DELGADO\nPUBLICAÇÃO: 15 6 1972\nREDAÇÃO\nREDAÇÃO FINAL\nRELATOR: DEP. IVO MORAIS\nPUBLICAÇÃO: 4 7 1972\nSANCIONADO\nPUBLICAÇÃO DA LEI: 14 7 1972."")",list(),list(),NULL,N,"TRABALHO, EMPREGO E RENDA
SAÚDE PÚBLICA",1473,"CALENDÁRIO
SAÚDE PÚBLICA
TRABALHO EMPREGO E RENDA",1203,"CRIAÇÃO, DIA, MÉDICO.","list(id = 1473, nome = ""DEPUTADO HAROLDO LOPES DA COSTA"", partido = ""MDB"")",NA,NA,NA,/legislacao/mineira/LEI/5952/1972,LEI 5952 1972 - LEI ORDINÁRIA,NA
