dominio,tipoProjeto,siglaTipoProjeto,numero,ano,autor,ementa,situacao,siglaSituacao,situacaoGeral,siglaSituacaoGeral,dataPublicacao,numeroDoc,proposicao,regime,norma,atualizacao,usuario,dataUltimaAcao,listaHistoricoTramitacoes,links,linksProposicoesAnexadas,linksOrigem,acompanhamento,tema,matricula,assuntoGeral,horario,indexacao,autoresEstruturados,local,arquivamento,legislacaoCitada,linkLegislacao.url,linkLegislacao.rotulo,proposicaoLei.descricao
Remissivo,PROJETO DE LEI,PL,653,1972,GOVERNADOR DO ESTADO,"AUTORIZA O PODER EXECUTIVO A RECEBER, EM DOAÇÃO, O IMÓVEL
QUE MENCIONA, NO MUNICÍPIO DE NOVA ERA.",TRANSFORMADO EM NORMA JURÍDICA,TNJUR,PROPOSIÇÕES APROVADAS,MAPRV,1973-01-17,000148895,PL. 653 1972 - PROJETO DE LEI,DELIBERAÇÃO DE PLENÁRIO,LEI 6071 1973 - LEI ORDINÁRIA,19980101,Carga,1973-01-16,"list(passo = 1, data = ""1973-01-16"", local = ""PLENÁRIO"", historico = ""PLENÁRIO\nDISCUSSÃO ÚNICA\nAPROVAÇÃO: 23 3 1973\nJUSTIÇA, EDUCAÇÃO E FINANÇAS (REUNIÃO CONJUNTA)\nRELATOR: DEP. GERALDO QUINTÃO\nPERDEU PRAZO\nREDAÇÃO\nREDAÇÃO FINAL\nRELATOR: NÃO CONSTA\nPUBLICAÇÃO: PERDEU PRAZO\nSANCIONADO\nPUBLICAÇÃO DA LEI: 13 4 1973."")",list(),list(),"list(descricao = ""MSG 230 1973"")",N,NA,NA,NA,NA,NA,NULL,NA,NA,NA,/legislacao/mineira/LEI/6071/1973,LEI 6071 1973 - LEI ORDINÁRIA,NA
Remissivo,PROJETO DE LEI,PL,652,1972,GOVERNADOR DO ESTADO,"CONTÉM O ESTATUTO DO MAGISTÉRIO DO ENSINO DE 1º E 2º GRAUS EM MINAS
GERAIS.",TRANSFORMADO EM NORMA JURÍDICA,TNJUR,PROPOSIÇÕES APROVADAS,MAPRV,1972-12-02,000148896,PL. 652 1972 - PROJETO DE LEI,DELIBERAÇÃO DE PLENÁRIO,LEI 6277 1973 - LEI ORDINÁRIA,20150219,m17461,1972-11-30,"list(passo = 1, data = ""1972-11-30"", local = ""PLENÁRIO"", historico = ""HISTÓRICO DA TRAMITAÇÃO\nPLENÁRIO:\nPRIMEIRA DISCUSSÃO\nAPROVAÇÃO: 22 11 1973\nSEGUNDA DISCUSSÃO\nAPROVAÇÃO: 29 11 1973\nREDAÇÃO FINAL\nAPROVAÇÃO: 30 11 1973\nCOMISSÕES:\nJUSTIÇA\nPRIMEIRA DISCUSSÃO\nRELATOR: DEP. EUCLIDES CINTRA\nPERDEU PRAZO\nEDUCAÇÃO\nPRIMEIRA DISCUSSÃO\nRELATOR: DEP. IBRAHIM ABI-ACKEL\nPUBLICAÇÃO: 17 11 1973\nFINANÇAS\nPRIMEIRA DISCUSSÃO\nRELATOR: DEP. VICENTE GUABIROBA\nPUBLICAÇÃO: 17 11 1973\nFINANÇAS\nSEGUNDA DISCUSSÃO\nRELATOR: DEP. JOÃO PEDRO GUSTIN\nPUBLICAÇÃO: 27 11 1973\nREDAÇÃO\nREDAÇÃO FINAL\nRELATOR: DEP. IBRAHIM ABI-ACKEL\nPUBLICAÇÃO: 7 12 1973 E 13 12 1973\nVETADO TOTALMENTE.\nVETO MANTIDO. PUBLICAÇÃO DAS RAZÕES DO VETO: 28 12 1973."")",list(),list(),"list(descricao = ""MSG 224 1972"")",N,EDUCAÇÃO,,"PESSOAL
SECRETARIA DE ESTADO",1553,NA,NULL,NA,NA,NA,/legislacao/mineira/LEI/6277/1973,LEI 6277 1973 - LEI ORDINÁRIA,NA
Remissivo,PROJETO DE LEI,PL,651,1972,GOVERNADOR DO ESTADO,"AUTORIZA O PODER EXECUTIVO A INSTITUIR A FUNDAÇÃO ESTADUAL
DE ASSISTÊNCIA LEPROCOMIAL, COM SEDE EM BELO HORIZONTE
E DÁ OUTRAS PROVIDÊNCIAS.",TRANSFORMADO EM NORMA JURÍDICA,TNJUR,PROPOSIÇÕES APROVADAS,MAPRV,1972-11-30,000148897,PL. 651 1972 - PROJETO DE LEI,DELIBERAÇÃO DE PLENÁRIO,LEI 6081 1973 - LEI ORDINÁRIA,20131021,rosanacf,1972-11-29,"list(passo = 1, data = ""1972-11-29"", local = ""PLENÁRIO"", historico = ""PLENÁRIO\nDISCUSSÃO ÚNICA\nAPROVAÇÃO: 12 4 1973\nCOMISSÕES:\nJUSTIÇA, SAÚDE E FINANÇAS (REUNIÃO CONJUNTA)\nDISCUSSÃO ÚNICA\nRELATOR: DEP. NARCÉLIO MENDES\nPUBLICAÇÃO: 7 4 1973\nREDAÇÃO\nREDAÇÃO FINAL\nRELATOR: NÃO CONSTA\nPUBLICAÇÃO: PERDEU PRAZO\nSANCIONADO\nPUBLICAÇÃO DA LEI: 12 5 1973."")",list(),list(),"list(descricao = ""MSG 223 1972"")",N,"ADMINISTRAÇÃO PÚBLICA
SAÚDE PÚBLICA",,"FUNDAÇÃO PÚBLICA
SAÚDE PÚBLICA",1635,NA,NULL,NA,NA,NA,/legislacao/mineira/LEI/6081/1973,LEI 6081 1973 - LEI ORDINÁRIA,NA
Remissivo,PROJETO DE LEI,PL,650,1972,GOVERNADOR DO ESTADO,CONCEDE PENSÃO ESPECIAL À VIÚVA DO EX-DEPUTADO ALVARO SALLES.,TRANSFORMADO EM NORMA JURÍDICA,TNJUR,PROPOSIÇÕES APROVADAS,MAPRV,1972-11-30,000148898,PL. 650 1972 - PROJETO DE LEI,DELIBERAÇÃO DE PLENÁRIO,LEI 6073 1973 - LEI ORDINÁRIA,19980101,Carga,1972-11-29,"list(passo = 1, data = ""1972-11-29"", local = ""PLENÁRIO"", historico = ""PLENÁRIO\nDISCUSSÃO ÚNICA\nAPROVAÇÃO: 23 3 1973\nCOMISSÕES:\nJUSTIÇA, SAÚDE E FINANÇAS (REUNIÃO CONJUNTA)\nRELATOR: DEP. JOÃO PEDRO GUSTIN\nPERDEU PRAZO\nREDAÇÃO\nREDAÇÃO FINAL\nRELATOR: DEP. JOÃO PEDRO GUSTIN\nPUBLICAÇÃO: NÃO CONSTA\nSANCIONADO\nPUBLICAÇÃO DA LEI: 13 4 1973."")",list(),list(),"list(descricao = ""MSG 222 1972"")",N,NA,NA,NA,NA,NA,NULL,NA,NA,NA,/legislacao/mineira/LEI/6073/1973,LEI 6073 1973 - LEI ORDINÁRIA,NA
Remissivo,PROJETO DE LEI,PL,648,1972,DEPUTADO GERALDO QUINTÃO                   ARENA,"DECLARA DE UTILIDADE PÚBLICA O GRÊMIO MÍNERO-METALÚRGICO ""LOUIS ENSCH"",
COM SEDE EM BELO HORIZONTE.",TRANSFORMADO EM NORMA JURÍDICA,TNJUR,PROPOSIÇÕES APROVADAS,MAPRV,1972-11-30,000148899,PL. 648 1972 - PROJETO DE LEI,DELIBERAÇÃO DE PLENÁRIO,LEI 6114 1973 - LEI ORDINÁRIA,20120306,rosanacf,1972-11-28,"list(passo = 1, data = ""1972-11-28"", local = ""PLENÁRIO"", historico = ""HISTÓRICO DA TRAMITAÇÃO\nPLENÁRIO:\nPRIMEIRA DISCUSSÃO\nAPROVAÇÃO: 10 4 1973\nSEGUNDA DISCUSSÃO\nAPROVAÇÃO: 7 6 1973\nREDAÇÃO FINAL\nAPROVAÇÃO: 20 6 1973\nCOMISSÕES:\nJUSTIÇA\nPRIMEIRA DISCUSSÃO\nRELATOR: DEP. FRANCISCO BILAC PINTO\nPUBLICAÇÃO: 30 3 1973\nJUSTIÇA\nSEGUNDA DISCUSSÃO\nRELATOR: DEP. EUCLIDES CINTRA\nPUBLICAÇÃO: 4 5 1973\nREDAÇÃO\nREDAÇÃO FINAL\nRELATOR: DEP. NELSON LOMBARDI\nPUBLICAÇÃO: 13 6 1973\nSANCIONADO\nPUBLICAÇÃO DA LEI: 3 7 1973."")",list(),list(),NULL,N,NA,750,UTILIDADE PÚBLICA,1112,"UTILIDADE PÚBLICA, ENTIDADE, MUNICÍPIO, BELO HORIZONTE.","list(id = 750, nome = ""DEPUTADO GERALDO QUINTÃO"", partido = ""ARENA"")",NA,NA,NA,/legislacao/mineira/LEI/6114/1973,LEI 6114 1973 - LEI ORDINÁRIA,NA
Remissivo,PROJETO DE LEI,PL,647,1972,DEPUTADO JOÃO PEDRO GUSTIN                 ARENA,"CONCEDE O TÍTULO DE CIDADÃO HONORÁRIO DO ESTADO DE MINAS
GERAIS AO PROFESSOR MILTON DE MAGALHÃES PORTO.",ARQUIVADO,ARQVD,OUTRAS SITUAÇÕES,MOUTR,1972-11-30,000148900,PL. 647 1972 - PROJETO DE LEI,NA,NA,20150518,m17461,1972-11-28,"list(passo = 1, data = ""1972-11-28"", local = ""PLENÁRIO"", historico = ""ARQUIVADO, FINAL DE LEGISLATURA."")",list(),list(),NULL,N,NA,1462,HOMENAGEM,1038,"CONCESSÃO HONORÍFICA, TÍTULO, CIDADÃO.","list(id = 1462, nome = ""DEPUTADO JOÃO PEDRO GUSTIN"", partido = ""ARENA"")",ARQUIVO,19750131,NA,NA,NA,NA
Remissivo,PROJETO DE LEI,PL,646,1972,DEPUTADO GERARDO RENAULT                   ARENA,"DECLARA DE UTILIDADE PÚBLICA O INSTITUTO FREI LEOPOLDO, COM SEDE EM
BELO HORIZONTE.",TRANSFORMADO EM NORMA JURÍDICA,TNJUR,PROPOSIÇÕES APROVADAS,MAPRV,1972-11-30,000148901,PL. 646 1972 - PROJETO DE LEI,DELIBERAÇÃO DE PLENÁRIO,LEI 6241 1973 - LEI ORDINÁRIA,20120306,rosanacf,1972-11-28,"list(passo = 1, data = ""1972-11-28"", local = ""PLENÁRIO"", historico = ""HISTÓRICO DA TRAMITAÇÃO\nPLENÁRIO:\nPRIMEIRA DISCUSSÃO\nAPROVAÇÃO: 10 10 1973\nSEGUNDA DISCUSSÃO\nAPROVAÇÃO: 29 11 1973\nREDAÇÃO FINAL\nAPROVAÇÃO: 29 11 1973\nCOMISSÕES:\nJUSTIÇA\nPRIMEIRA DISCUSSÃO\nRELATOR: DEP. FRANCISCO BILAC PINTO\nPUBLICAÇÃO: 9 8 1973\nJUSTIÇA\nSEGUNDA DISCUSSÃO\nRELATOR: DEP. MARCOS TITO\nPUBLICAÇÃO: 26 10 1973\nREDAÇÃO\nREDAÇÃO FINAL\nRELATOR: DEP. NELSON LOMBARDI\nPUBLICAÇÃO: 4 12 1973\nSANCIONADO\nPUBLICAÇÃO DA LEI: 11 12 1973."")",list(),list(),NULL,N,NA,1176,UTILIDADE PÚBLICA,1111,"UTILIDADE PÚBLICA, ENTIDADE, MUNICÍPIO, BELO HORIZONTE.","list(id = 1176, nome = ""DEPUTADO GERARDO RENAULT"", partido = ""ARENA"")",NA,NA,NA,/legislacao/mineira/LEI/6241/1973,LEI 6241 1973 - LEI ORDINÁRIA,NA
Remissivo,PROJETO DE LEI,PL,645,1972,DEPUTADO JOÃO BELLO                        ARENA,"DÁ DENOMINAÇÃO AO FÓRUM DA COMARCA DE RESPLENDOR DE DR. AMÉRICO MARTINS
DA COSTA.",TRANSFORMADO EM NORMA JURÍDICA,TNJUR,PROPOSIÇÕES APROVADAS,MAPRV,1972-11-30,000148902,PL. 645 1972 - PROJETO DE LEI,NA,LEI 6132 1973 - LEI ORDINÁRIA,20120516,rosanacf,1972-11-28,"list(passo = 1, data = ""1972-11-28"", local = ""PLENÁRIO"", historico = ""HISTÓRICO DA TRAMITAÇÃO\nPLENÁRIO:\nPRIMEIRA DISCUSSÃO\nAPROVAÇÃO: 3 5 1973\nSEGUNDA DISCUSSÃO\nAPROVAÇÃO: 14 6 1973\nREDAÇÃO FINAL\nAPROVAÇÃO: 27 6 1973\nCOMISSÕES:\nJUSTIÇA\nPRIMEIRA DISCUSSÃO\nRELATOR: DEP. MARCOS TITO\nPUBLICAÇÃO: 3 4 1973\nJUSTIÇA\nSEGUNDA DISCUSSÃO\nRELATOR: DEP. JOÃO NAVARRO\nPUBLICAÇÃO: 23 5 1973\nREDAÇÃO\nREDAÇÃO FINAL\nRELATOR: DEP. NÍLSON GONTIJO\nPUBLICAÇÃO: 27 6 1973\nSANCIONADO\nPUBLICAÇÃO DA LEI: 10 7 1973."")",list(),list(),NULL,N,NA,310,PRÓPRIO PÚBLICO,1757,"DENOMINAÇÃO, FÓRUM, COMARCA DE RESPLENDOR.","list(id = 310, nome = ""DEPUTADO JOÃO BELLO"", partido = ""ARENA"")",NA,NA,NA,/legislacao/mineira/LEI/6132/1973,LEI 6132 1973 - LEI ORDINÁRIA,NA
Remissivo,PROJETO DE LEI,PL,644,1972,DEPUTADO BONIFÁCIO DE ANDRADA              ARENA,"DECLARA DE UTILIDADE PÚBLICA A SANTA CASA DE MISERICÓRDIA DE
NEPOMUCENO.",TRANSFORMADO EM NORMA JURÍDICA,TNJUR,PROPOSIÇÕES APROVADAS,MAPRV,1972-11-28,000148904,PL. 644 1972 - PROJETO DE LEI,DELIBERAÇÃO DE PLENÁRIO,LEI 6282 1974 - LEI ORDINÁRIA,20120306,rosanacf,1972-11-24,"list(passo = 1, data = ""1972-11-24"", local = ""PLENÁRIO"", historico = ""HISTÓRICO DA TRAMITAÇÃO\nPLENÁRIO:\nPRIMEIRA DISCUSSÃO\nAPROVAÇÃO: 10 10 1973\nSEGUNDA DISCUSSÃO\nAPROVAÇÃO: 30 11 1973\nREDAÇÃO FINAL\nAPROVAÇÃO: 27 3 1974\nCOMISSÕES:\nJUSTIÇA\nPRIMEIRA DISCUSSÃO\nRELATOR: DEP. AMILCAR PADOVANI\nPUBLICAÇÃO: 9 8 1973\nJUSTIÇA\nSEGUNDA DISCUSSÃO\nRELATOR: DEP. VALDIR MELGAÇO\nPUBLICAÇÃO: 26 10 1973\nREDAÇÃO\nREDAÇÃO FINAL\nRELATOR: DEP. NÍLSON GONTIJO\nPUBLICAÇÃO: 27 3 1974\nSANCIONADO\nPUBLICAÇÃO DA LEI: 10 4 1974."")",list(),list(),NULL,N,NA,281,UTILIDADE PÚBLICA,1110,"UTILIDADE PÚBLICA, ENTIDADE, MUNICÍPIO, NEPOMUCENO.","list(id = 281, nome = ""DEPUTADO BONIFÁCIO DE ANDRADA"", partido = ""ARENA"")",NA,NA,NA,/legislacao/mineira/LEI/6282/1974,LEI 6282 1974 - LEI ORDINÁRIA,NA
Remissivo,PROJETO DE LEI,PL,643,1972,DEPUTADO BONIFÁCIO DE ANDRADA,DECLARA DE UTILIDADE PÚBLICA A UNIÃO COLEGIAL MUNICIPAL DE NEPOMUCENO.,TRANSFORMADO EM NORMA JURÍDICA,TNJUR,PROPOSIÇÕES APROVADAS,MAPRV,1972-11-28,000148905,PL. 643 1972 - PROJETO DE LEI,DELIBERAÇÃO DE PLENÁRIO,LEI 6150 1973 - LEI ORDINÁRIA,20120306,rosanacf,1972-11-24,"list(passo = 1, data = ""1972-11-24"", local = ""PLENÁRIO"", historico = ""HISTÓRICO DA TRAMITAÇÃO\nPLENÁRIO:\nPRIMEIRA DISCUSSÃO\nAPROVAÇÃO: 4 5 1973\nSEGUNDA DISCUSSÃO\nAPROVAÇÃO: 4 9 1973\nREDAÇÃO FINAL\nAPROVAÇÃO: 11 10 1973\nCOMISSÕES:\nJUSTIÇA\nPRIMEIRA DISCUSSÃO\nRELATOR: DEP. VALDIR MELGAÇO\nPUBLICAÇÃO: 3 4 1973\nJUSTIÇA\nSEGUNDA DISCUSSÃO\nRELATOR: DEP. RUY DA COSTA VAL\nPUBLICAÇÃO: 23 5 1973\nREDAÇÃO\nREDAÇÃO FINAL\nRELATOR: DEP. EUCLIDES CINTRA\nPUBLICAÇÃO: 10 10 1973\nSANCIONADO\nPUBLICAÇÃO DA LEI: 25 10 1973."")",list(),"list(expressao = ""(PL adj '660' adj 1973[PROP])[dbmt]"", banco = ""mate"", descricao = ""PL. 660 1973"", url = ""/proposicoes/pesquisa/avancada?expr=%28PL+adj+%27660%27+adj+1973%5BPROP%5D%29%5Bdbmt%5D"", tipo = ""PL"", numero = 660, ano = 1973)",NULL,N,NA,281,UTILIDADE PÚBLICA,1109,"UTILIDADE PÚBLICA, ENTIDADE, MUNICÍPIO, NEPOMUCENO.",NULL,NA,NA,NA,/legislacao/mineira/LEI/6150/1973,LEI 6150 1973 - LEI ORDINÁRIA,NA
Remissivo,PROJETO DE LEI,PL,642,1972,DEPUTADO BONIFÁCIO DE ANDRADA              ARENA,"AUTORIZA DOAÇÃO DE IMÓVEL DO ESTADO, LOCALIZADO NA CIDADE
DE SANTOS DUMONT.",TRANSFORMADO EM NORMA JURÍDICA,TNJUR,PROPOSIÇÕES APROVADAS,MAPRV,1972-11-28,000148906,PL. 642 1972 - PROJETO DE LEI,DELIBERAÇÃO DE PLENÁRIO,LEI 6134 1973 - LEI ORDINÁRIA,19980101,Carga,1972-11-24,"list(passo = 1, data = ""1972-11-24"", local = ""PLENÁRIO"", historico = ""HISTÓRICO DA TRAMITAÇÃO\nPLENÁRIO:\nPRIMEIRA DISCUSSÃO\nAPROVAÇÃO: 3 5 1973\nSEGUNDA DISCUSSÃO\nAPROVAÇÃO: 8 6 1973\nREDAÇÃO FINAL\nAPROVAÇÃO: 20 6 1973\nCOMISSÕES:\nJUSTIÇA\nPRIMEIRA DISCUSSÃO\nRELATOR: DEP. FRANCISCO BILAC PINTO\nPUBLICAÇÃO: NÃO CONSTA\nSAÚDE SOCIAL\nPRIMEIRA DISCUSSÃO\nRELATOR: DEP. MORVAN ACAYABA\nPUBLICAÇÃO: NÃO CONSTA\nFINANÇAS\nPRIMEIRA DISCUSSÃO\nRELATOR: DEP. LÚCIO DE SOUZA CRUZ\nPUBLICAÇÃO: NÃO CONSTA\nFINANÇAS\nSEGUNDA DISCUSSÃO\nRELATOR: DEP. NÍLSON GONTIJO\nPUBLICAÇÃO: 19 5 1973\nREDAÇÃO\nREDAÇÃO FINAL\nRELATOR: DEP. NELSON LOMBARDI\nPUBLICAÇÃO: 16 6 1973\nSANCIONADO\nPUBLICAÇÃO DA LEI: 12 7 1973."")",list(),list(),NULL,N,NA,281,NA,NA,NA,"list(id = 281, nome = ""DEPUTADO BONIFÁCIO DE ANDRADA"", partido = ""ARENA"")",NA,NA,NA,/legislacao/mineira/LEI/6134/1973,LEI 6134 1973 - LEI ORDINÁRIA,NA
Remissivo,PROJETO DE LEI,PL,641,1972,DEPUTADO JOSÉ LAVIOLA                      ARENA,"DÁ A DENOMINAÇÃO DE EE.CC. JOSÉ DE FREITAS À ESCOLA PRIMÁRIA SITUADA NA
FAZENDA DE JOSÉ LUDOVICO, EM CENTRAL DE MINAS.",TRANSFORMADO EM NORMA JURÍDICA,TNJUR,PROPOSIÇÕES APROVADAS,MAPRV,1972-11-28,000148907,PL. 641 1972 - PROJETO DE LEI,NA,LEI 6103 1973 - LEI ORDINÁRIA,20120516,rosanacf,1972-11-24,"list(passo = 1, data = ""1972-11-24"", local = ""PLENÁRIO"", historico = ""HISTÓRICO DA TRAMITAÇÃO\nPLENÁRIO:\nPRIMEIRA DISCUSSÃO\nAPROVAÇÃO: 10 4 1973\nSEGUNDA DISCUSSÃO\nAPROVAÇÃO: 14 5 1973\nREDAÇÃO FINAL\nAPROVAÇÃO: 25 5 1973\nCOMISSÕES:\nJUSTIÇA\nPRIMEIRA DISCUSSÃO\nRELATOR: DEP. MARCOS TITO\nPUBLICAÇÃO: 30 3 1973\nJUSTIÇA\nSEGUNDA DISCUSSÃO\nPUBLICAÇÃO: 26 4 1973\nREDAÇÃO\nREDAÇÃO FINAL\nPUBLICAÇÃO: 23 5 1973\nSANCIONADO\nPUBLICAÇÃO DA LEI: 12 6 1973."")",list(),list(),NULL,N,NA,1471,"PRÓPRIO PÚBLICO
ESTABELECIMENTO DE ENSINO",1758,"DENOMINAÇÃO, ESTABELECIMENTO DE ENSINO, MUNICÍPIO, CENTRAL DE MINAS.","list(id = 1471, nome = ""DEPUTADO JOSÉ LAVIOLA"", partido = ""ARENA"")",NA,NA,NA,/legislacao/mineira/LEI/6103/1973,LEI 6103 1973 - LEI ORDINÁRIA,NA
Remissivo,PROJETO DE LEI,PL,640,1972,DEPUTADO FÁBIO VASCONCELLOS                ARENA,"DECLARA DE UTILIDADE PÚBLICA O GINÁSIO COMERCIAL ARAÃO REIS, COM SEDE
EM BELO HORIZONTE.",TRANSFORMADO EM NORMA JURÍDICA,TNJUR,PROPOSIÇÕES APROVADAS,MAPRV,1972-11-28,000148908,PL. 640 1972 - PROJETO DE LEI,DELIBERAÇÃO DE PLENÁRIO,LEI 6284 1974 - LEI ORDINÁRIA,20120306,rosanacf,1972-11-24,"list(passo = 1, data = ""1972-11-24"", local = ""PLENÁRIO"", historico = ""HISTÓRICO DA TRAMITAÇÃO\nPLENÁRIO:\nPRIMEIRA DISCUSSÃO\nAPROVAÇÃO: 10 10 1973\nSEGUNDA DISCUSSÃO\nAPROVAÇÃO: 30 11 1973\nREDAÇÃO FINAL\nAPROVAÇÃO: 27 3 1974\nCOMISSÕES:\nJUSTIÇA\nPRIMEIRA DISCUSSÃO\nRELATOR: DEP. AMILCAR PADOVANI\nPUBLICAÇÃO: 2 10 1973\nJUSTIÇA\nSEGUNDA DISCUSSÃO\nRELATOR: DEP. MARCOS TITO\nPUBLICAÇÃO: 26 10 1973\nREDAÇÃO\nREDAÇÃO FINAL\nRELATOR: DEP. NÍLSON GONTIJO\nPUBLICAÇÃO: 27 3 1974\nSANCIONADO\nPUBLICAÇÃO DA LEI: 10 4 1974."")",list(),list(),NULL,N,NA,1197,UTILIDADE PÚBLICA,1109,"UTILIDADE PÚBLICA, ENTIDADE, MUNICÍPIO, BELO HORIZONTE.","list(id = 1197, nome = ""DEPUTADO FÁBIO VASCONCELLOS"", partido = ""ARENA"")",NA,NA,NA,/legislacao/mineira/LEI/6284/1974,LEI 6284 1974 - LEI ORDINÁRIA,NA
Remissivo,PROJETO DE LEI,PL,639,1972,DEPUTADO FERNANDO JUNQUEIRA                ARENA,"DECLARA DE UTILIDADE PÚBLICA O ""ESPORTE CLUBE BRASIL"", COM SEDE EM JUIZ
DE FORA.",TRANSFORMADO EM NORMA JURÍDICA,TNJUR,PROPOSIÇÕES APROVADAS,MAPRV,1972-11-28,000148909,PL. 639 1972 - PROJETO DE LEI,DELIBERAÇÃO DE PLENÁRIO,LEI 6097 1973 - LEI ORDINÁRIA,20120306,rosanacf,1972-11-24,"list(passo = 1, data = ""1972-11-24"", local = ""PLENÁRIO"", historico = ""HISTÓRICO DA TRAMITAÇÃO\nPLENÁRIO:\nDISCUSSÃO ÚNICA\nAPROVAÇÃO: 10 4 1973\nREDAÇÃO FINAL\nAPROVAÇÃO: 14 5 1973\nCOMISSÕES:\nJUSTIÇA\nPRIMEIRA DISCUSSÃO\nRELATOR: DEP. EUCLIDES CINTRA\nPUBLICAÇÃO: 30 3 1973\nJUSTIÇA\nSEGUNDA DISCUSSÃO\nRELATOR: DEP. BILAC PINTO\nPUBLICAÇÃO: 26 4 1973\nREDAÇÃO\nREDAÇÃO FINAL\nRELATOR: DEP. NÍLSON GONTIJO\nPUBLICAÇÃO: 19 5 1973\nSANCIONADO\nPUBLICAÇÃO DA LEI: 31 5 1973."")",list(),list(),NULL,N,NA,1468,UTILIDADE PÚBLICA,1108,"UTILIDADE PÚBLICA, ENTIDADE, MUNICÍPIO, JUIZ DE FORA.","list(id = 1468, nome = ""DEPUTADO FERNANDO JUNQUEIRA"", partido = ""ARENA"")",NA,NA,NA,/legislacao/mineira/LEI/6097/1973,LEI 6097 1973 - LEI ORDINÁRIA,NA
Remissivo,PROJETO DE LEI,PL,637,1972,DEPUTADO MÁRIO HUGO LADEIRA                ARENA,"DÁ A DENOMINAÇÃO DE ""RAULINO PACHECO"" AO GINÁSIO ESTADUAL DA CIDADE DE
RIO NOVO.",TRANSFORMADO EM NORMA JURÍDICA,TNJUR,PROPOSIÇÕES APROVADAS,MAPRV,1972-11-25,000148910,PL. 637 1972 - PROJETO DE LEI,NA,LEI 6061 1972 - LEI ORDINÁRIA,20120516,rosanacf,1972-11-23,"list(passo = 1, data = ""1972-11-23"", local = ""PLENÁRIO"", historico = ""HISTÓRICO DA TRAMITAÇÃO\nPLENÁRIO:\nPRIMEIRA DISCUSSÃO\nAPROVAÇÃO: 29 11 1972\nSEGUNDA DISCUSSÃO\nAPROVAÇÃO: 30 11 1972\nREDAÇÃO FINAL\nAPROVAÇÃO: 30 11 1972\nCOMISSÕES:\nJUSTIÇA\nPRIMEIRA DISCUSSÃO\nRELATOR: DEP. RUY DA COSTA VAL\nPUBLICAÇÃO: NÃO CONSTA\nJUSTIÇA\nSEGUNDA DISCUSSÃO\nRELATOR: DEP. NARCÉLIO MENDES\nPUBLICAÇÃO: 30 11 1972\nREDAÇÃO\nREDAÇÃO FINAL\nRELATOR: DEP. JÉSUS TRINDADE\nPUBLICAÇÃO: 2 12 1972\nSANCIONADO\nPUBLICAÇÃO DA LEI: 15 12 1972"")",list(),list(),NULL,N,NA,328,"PRÓPRIO PÚBLICO
ESTABELECIMENTO DE ENSINO",1759,"DENOMINAÇÃO, ESTABELECIMENTO DE ENSINO, MUNICÍPIO, RIO NOVO.","list(id = 328, nome = ""DEPUTADO MÁRIO HUGO LADEIRA"", partido = ""ARENA"")",NA,NA,NA,/legislacao/mineira/LEI/6061/1972,LEI 6061 1972 - LEI ORDINÁRIA,NA
Remissivo,PROJETO DE LEI,PL,636,1972,GOVERNADOR DO ESTADO,"CONCEDE PENSÃO ESPECIAL À VIÚVA DO PROFESSOR ALISSON
PEREIRA GUIMARÃES.",TRANSFORMADO EM NORMA JURÍDICA,TNJUR,PROPOSIÇÕES APROVADAS,MAPRV,1972-11-25,000148911,PL. 636 1972 - PROJETO DE LEI,DELIBERAÇÃO DE PLENÁRIO,LEI 6079 1973 - LEI ORDINÁRIA,19980101,Carga,1972-11-23,"list(passo = 1, data = ""1972-11-23"", local = ""PLENÁRIO"", historico = ""PLENÁRIO\nDISCUSSÃO ÚNICA\nAPROVAÇÃO: 6 4 1973\nCOMISSÕES:\nJUSTIÇA, SAÚDE E FINANÇAS (REUNIÃO CONJUNTA)\nRELATOR: DEP. MÁRIO HUGO LADEIRA\nPUBLICAÇÃO: PERDEU PRAZO\nREDAÇÃO\nREDAÇÃO FINAL\nRELATOR: DEP. FÁBIO NOTINI\nPUBLICAÇÃO: 13 10 1973\nSANCIONADO\nPUBLICAÇÃO DA LEI: 27 4 1973."")",list(),list(),"list(descricao = ""MSG 220 1972"")",N,NA,NA,NA,NA,NA,NULL,NA,NA,NA,/legislacao/mineira/LEI/6079/1973,LEI 6079 1973 - LEI ORDINÁRIA,NA
Remissivo,PROJETO DE LEI,PL,631,1972,DEPUTADO LOURIVAL BRASIL                   ARENA,"DECLARA DE UTILIDADE PÚBLICA O FLUMINENSE ESPORTE CLUBE, COM SEDE EM
LAGOA SANTA.",TRANSFORMADO EM NORMA JURÍDICA,TNJUR,PROPOSIÇÕES APROVADAS,MAPRV,1972-11-23,000148913,PL. 631 1972 - PROJETO DE LEI,DELIBERAÇÃO DE PLENÁRIO,LEI 6148 1973 - LEI ORDINÁRIA,20120306,rosanacf,1972-11-21,"list(passo = 1, data = ""1972-11-21"", local = ""PLENÁRIO"", historico = ""HISTÓRICO DA TRAMITAÇÃO\nPLENÁRIO:\nPRIMEIRA DISCUSSÃO\nAPROVAÇÃO: 9 5 1973\nSEGUNDA DISCUSSÃO\nAPROVAÇÃO: 4 9 1973\nREDAÇÃO FINAL\nAPROVAÇÃO: 11 10 1973\nCOMISSÕES:\nJUSTIÇA\nPRIMEIRA DISCUSSÃO\nRELATOR: DEP. RUY DA COSTA VAL\nPUBLICAÇÃO: 26 4 1973\nJUSTIÇA\nSEGUNDA DISCUSSÃO\nRELATOR: DEP. MANOEL COSTA\nPUBLICAÇÃO: 23 5 1973\nREDAÇÃO\nREDAÇÃO FINAL\nRELATOR: DEP. EUCLIDES CINTRA\nPUBLICAÇÃO: 10 10 1973.\nSANCIONADO\nPUBLICAÇÃO DA LEI: 24 10 1973"")",list(),list(),NULL,N,NA,322,UTILIDADE PÚBLICA,1103,"UTILIDADE PÚBLICA, ENTIDADE, MUNICÍPIO, LAGOA SANTA.","list(id = 322, nome = ""DEPUTADO LOURIVAL BRASIL"", partido = ""ARENA"")",NA,NA,NA,/legislacao/mineira/LEI/6148/1973,LEI 6148 1973 - LEI ORDINÁRIA,NA
Remissivo,PROJETO DE LEI,PL,630,1972,DEPUTADO CARLOS ELOY                       ARENA,"DÁ DENOMINAÇÃO ÀS ESCOLAS COMBINADAS DO DISTRITO DE ROÇAS NOVAS,
MUNICÍPIO DE CAETÉ.",TRANSFORMADO EM NORMA JURÍDICA,TNJUR,PROPOSIÇÕES APROVADAS,MAPRV,1972-11-23,000148914,PL. 630 1972 - PROJETO DE LEI,NA,LEI 6111 1973 - LEI ORDINÁRIA,20120516,rosanacf,1972-11-21,"list(passo = 1, data = ""1972-11-21"", local = ""PLENÁRIO"", historico = ""HISTÓRICO DA TRAMITAÇÃO\nPLENÁRIO:\nPRIMEIRA DISCUSSÃO\nAPROVAÇÃO: 25 4 1973\nSEGUNDA DISCUSSÃO\nAPROVAÇÃO: 8 6 1973\nREDAÇÃO FINAL\nAPROVAÇÃO: 20 6 1973\nCOMISSÕES:\nJUSTIÇA\nPRIMEIRA DISCUSSÃO\nRELATOR: DEP. VALDIR MELGAÇO\nPUBLICAÇÃO: 3 4 1973\nJUSTIÇA\nSEGUNDA DISCUSSÃO\nRELATOR: DEP. MARCOS TITO\nPUBLICAÇÃO: 4 5 1973\nREDAÇÃO\nREDAÇÃO FINAL\nRELATOR: DEP. NELSON LOMBARDI\nPUBLICAÇÃO: 16 6 1973\nSANCIONADO\nPUBLICAÇÃO DA LEI: 30 6 1973."")",list(),list(),NULL,N,NA,708,"PRÓPRIO PÚBLICO
ESTABELECIMENTO DE ENSINO",1759,"DENOMINAÇÃO, ESTABELECIMENTO DE ENSINO, MUNICÍPIO, CAETÉ.","list(id = 708, nome = ""DEPUTADO CARLOS ELOY"", partido = ""ARENA"")",NA,NA,NA,/legislacao/mineira/LEI/6111/1973,LEI 6111 1973 - LEI ORDINÁRIA,NA
Remissivo,PROJETO DE LEI,PL,629,1972,GOVERNADOR DO ESTADO,"AUTORIZA O PODER EXECUTIVO A ABRIR À SECRETARIA DE
ADMINISTRAÇÃO O CRÉDITO ESPECIAL DE CR$ 924.864,00.",TRANSFORMADO EM NORMA JURÍDICA,TNJUR,PROPOSIÇÕES APROVADAS,MAPRV,1972-11-23,000148915,PL. 629 1972 - PROJETO DE LEI,DELIBERAÇÃO DE PLENÁRIO,LEI 6070 1973 - LEI ORDINÁRIA,19980101,Carga,1972-11-21,"list(passo = 1, data = ""1972-11-21"", local = ""PLENÁRIO"", historico = ""PLENÁRIO\nDISCUSSÃO ÚNICA\nAPROVAÇÃO: 15 1 1973\nCOMISSÕES:\nJUSTIÇA, ECONOMIA E FINANÇAS (REUNIÃO CONJUNTA)\nDISCUSSÃO ÚNICA\nRELATOR: DEP. IVO MORAIS\nPERDEU PRAZO\nREDAÇÃO\nREDAÇÃO FINAL\nRELATOR: NÃO CONSTA\nPUBLICAÇÃO: PERDEU PRAZO\nSANCIONADO\nPUBLICAÇÃO DA LEI: 4 4 1973."")",list(),list(),NULL,N,NA,NA,NA,NA,NA,NULL,NA,NA,NA,/legislacao/mineira/LEI/6070/1973,LEI 6070 1973 - LEI ORDINÁRIA,NA
Remissivo,PROJETO DE LEI,PL,628,1972,DEPUTADO JAIRO PEREIRA                     ARENA,"DECLARA DE UTILIDADE PÚBLICA O UNIÃO ESPORTE CLUBE COM SEDE NO
SANATÓRIO SANTA ISABEL, MUNICÍPIO DE BETIM.",TRANSFORMADO EM NORMA JURÍDICA,TNJUR,PROPOSIÇÕES APROVADAS,MAPRV,1972-11-23,000148916,PL. 628 1972 - PROJETO DE LEI,DELIBERAÇÃO DE PLENÁRIO,LEI 6124 1973 - LEI ORDINÁRIA,20120306,rosanacf,1972-11-21,"list(passo = 1, data = ""1972-11-21"", local = ""PLENÁRIO"", historico = ""HISTÓRICO DA TRAMITAÇÃO\nPLENÁRIO:\nPRIMEIRA DISCUSSÃO\nAPROVAÇÃO: 9 4 1973\nSEGUNDA DISCUSSÃO\nAPROVAÇÃO: 8 6 1973\nREDAÇÃO FINAL\nAPROVAÇÃO: 20 6 1973\nCOMISSÕES:\nJUSTIÇA\nPRIMEIRA DISCUSSÃO\nRELATOR: DEP. AMILCAR PADOVANI\nPUBLICAÇÃO: 30 3 1973\nJUSTIÇA\nSEGUNDA DISCUSSÃO\nRELATOR: DEP. RUY DA COSTA VAL\nPUBLICAÇÃO: 4 5 1973\nREDAÇÃO\nREDAÇÃO FINAL\nRELATOR: DEP. NELSON LOMBARDI\nPUBLICAÇÃO: 16 6 1973\nSANCIONADO\nPUBLICAÇÃO DA LEI: 4 7 1973."")",list(),list(),NULL,N,NA,1470,UTILIDADE PÚBLICA,1101,"UTILIDADE PÚBLICA, ENTIDADE, MUNICÍPIO, BETIM.","list(id = 1470, nome = ""DEPUTADO JAIRO PEREIRA"", partido = ""ARENA"")",NA,NA,NA,/legislacao/mineira/LEI/6124/1973,LEI 6124 1973 - LEI ORDINÁRIA,NA
Remissivo,PROJETO DE LEI,PL,627,1972,GOVERNADOR DO ESTADO,"AUTORIZA A FUNDAÇÃO PANDIÁ CALÓGERAS - UNIVERSIDADE
MINEIRA DE RÁDIO E TELEVISÃO EDUCATIVOS A ALIENAR
IMÓVEL E DÁ OUTRAS PROVIDÊNCIAS.",TRANSFORMADO EM NORMA JURÍDICA,TNJUR,PROPOSIÇÕES APROVADAS,MAPRV,1972-11-21,000148921,PL. 627 1972 - PROJETO DE LEI,DELIBERAÇÃO DE PLENÁRIO,LEI 6056 1972 - LEI ORDINÁRIA,19980101,Carga,1972-11-17,"list(passo = 1, data = ""1972-11-17"", local = ""PLENÁRIO"", historico = ""HISTÓRICO DA TRAMITAÇÃO\nPLENÁRIO:\nDISCUSSÃO ÚNICA\nAPROVAÇÃO: 30 11 1972\nREDAÇÃO FINAL\nAPROVAÇÃO: 30 11 1972\nCOMISSÕES:\nJUSTIÇA, EDUCAÇÃO E FINANÇAS (REUNIÃO CONJUNTA)\nPRIMEIRA DISCUSSÃO\nRELATOR: DEP. VALDIR MELGAÇO\nPUBLICAÇÃO: 18 11 1972\nREDAÇÃO\nREDAÇÃO FINAL\nRELATOR: DEP. JÉSUS TRINDADE\nPUBLICAÇÃO: 2 12 1972\nSANCIONADO\nPUBLICAÇÃO DA LEI: 16 12 1972."")",list(),list(),"list(descricao = ""MSG 214 1972"")",N,NA,NA,NA,NA,NA,NULL,NA,NA,NA,/legislacao/mineira/LEI/6056/1972,LEI 6056 1972 - LEI ORDINÁRIA,NA
Remissivo,PROJETO DE LEI,PL,626,1972,GOVERNADOR DO ESTADO,"DÁ A DENOMINAÇÃO DE FUNDAÇÃO DE EDUCAÇÃO PARA O TRABALHO DE MINAS GERAIS,
UTRAMIG, À ENTIDADE INSTITUÍDA PELO DECRETO 9219, DE 23 12 1965 E CONTÉM
OUTRAS PROVIDÊNCIAS.",TRANSFORMADO EM NORMA JURÍDICA,TNJUR,PROPOSIÇÕES APROVADAS,MAPRV,1972-11-21,000148922,PL. 626 1972 - PROJETO DE LEI,NA,LEI 6069 1972 - LEI ORDINÁRIA,20160908,malves,1972-11-21,"list(passo = 1, data = ""1972-11-21"", local = ""PLENÁRIO"", historico = ""HISTÓRICO DA TRAMITAÇÃO\nPLENÁRIO:\nDISCUSSÃO ÚNICA\nAPROVAÇÃO: 30 11 1972\nREDAÇÃO FINAL\nAPROVAÇÃO: 30 11 1972\nCOMISSÕES:\nJUSTIÇA, EDUCAÇÃO E FINANÇAS (REUNIÃO CONJUNTA)\nDISCUSSÃO ÚNICA\nRELATOR: DEP. LÚCIO DE SOUZA CRUZ\nPUBLICAÇÃO: 28 11 1972\nREDAÇÃO\nREDAÇÃO FINAL\nRELATOR: DEP. JÉSUS TRINDADE\nPUBLICAÇÃO: 2 12 1972\nSANCIONADO\nPUBLICAÇÃO DA LEI: 22 12 1972."")",list(),list(),NULL,N,ADMINISTRAÇÃO PÚBLICA,,"FUNDAÇÃO DE EDUCAÇÃO PARA O TRABALHO DE MINAS GERAIS (UTRAMIG)
ORGANIZAÇÃO ADMINISTRATIVA",1429,"ALTERAÇÃO, DENOMINAÇÃO, FUNDAÇÃO DE EDUCAÇÃO PARA O TRABALHO DE MINAS
GERAIS (UTRAMIG).
OBJETIVO, COMPETÊNCIA, PATRIMÔNIO, FUNDAÇÃO DE EDUCAÇÃO PARA O TRABALHO
DE MINAS GERAIS (UTRAMIG).
COMPOSIÇÃO, NOMEAÇÃO, MANDATO, COMPETÊNCIA, CONSELHO CURADOR, FUNDAÇÃO
DE EDUCAÇÃO PARA O TRABALHO DE MINAS GERAIS (UTRAMIG).
NOMEAÇÃO, COMPETÊNCIA, SUPERINTENDENTE, FUNDAÇÃO DE EDUCAÇÃO PARA O
TRABALHO DE MINAS GERAIS (UTRAMIG).
NORMAS, SERVIDOR, FUNDAÇÃO DE EDUCAÇÃO PARA O TRABALHO DE MINAS GERAIS
(UTRAMIG).
COMPETÊNCIA, GOVERNADOR, DESIGNAÇÃO, REPRESENTANTE, ATO, LAVRATURA,
DOAÇÃO, FUNDAÇÃO DE EDUCAÇÃO PARA O TRABALHO DE MINAS GERAIS (UTRAMIG),
TÍTULO DA DÍVIDA PÚBLICA.",NULL,NA,NA,NA,/legislacao/mineira/LEI/6069/1972,LEI 6069 1972 - LEI ORDINÁRIA,NA
